title,content,date
[보은 맛집] 법주사 속리산 밥집 술안주 연탄구이 용궁식당,"안녕하세요보은이 아니더라도 여행만 가면두끼먹으면 최대로 많이 먹는것 같아요​마지막 끼니를 위해서내돈내산 용궁식당으로 가봅니다​보은여행 스케줄​🚗차로 이동(서울-보은)🚗​📍김세복 대추 밀냉면​📍말티재 전망대​📍정이품송​📍법주사​📍카페 고래​📍용궁식당​📍보은대추 닭강정 본점(포장)​🚗차로 이동(보은=서울)🚗​속리산터미널에서 차로 20분정도 걸립니다보은은 두군데가 메인이라 했잖아요속리산(법주사)쪽 과 보은시장쪽보은시장을 지나서 있는 용궁식당​차는 가게 앞에 5대 정도 주차할수 있어요주차못하면 도랑?에 빠질수 있는 시스템...ㅋㅋㅋㅋㅋㅋㅋㅋ진짜 못하면요... 근데 초보자들도 다 할수 있긴해요​용궁식당 바로 앞저 풀숲이 바로 도랑가게앞 5대가 모두차면저렇게 대로변에 주차해두시더라구요주말이라 괜찮았나 싶기도하구요이쪽이 차가 잘 안지나가는 곳이긴해요​​주택을 개조한듯한게용궁식당 전부 룸식으로 되어있어요그렇다고 룸이 작은곳도 있고 큰곳도 있어요좌식인 테이블 아주 오랜만이네요​좌식이지만 모든테이블 태블릿이 있어주문과 결제를 자리에서 한번에 할수 있어요그만큼 사람이 많이 온다는 뜻이겠죠실제로 각종 사인들이 많은데속리산(법주사) 등산후 단체손님이 많은듯싶어요매년온다는 글도 많구요​좌식, 입식 가리지 않는편인데방문자리뷰인가에좌식인데 순대국밥 등 판매해서장판이 끈적여서 위생 신경 안쓴다면 와도 된다해서걱정많이 하고 왔거든여양말신고 앉아서 걱정한만큼 아니었어요괜찮았어요​오징어구이 12000원돼지구이/ 간장돼지구이 12000원닭발구이 12000원막창구이 12000원돌판막창구이 16000원​순대, 순대국등 있지만메인은 연탄구이입니다!!​물티슈도 줍니당​멸치볶음​양파장아찌​배추절임?!아예 손이 안가게 생겼잖아요슴슴하니 계속 손이 가요용궁식당 연탄구이가 전체적으로 매운 느낌인데가정식으로 만든 슴슴한 느낌뭐라 표현할지를 모르겠네요​콩나물국은 차갑게 나왔구요​김치가 남의 집 김치먹는 느낌이라고 해야할까요딱 먹어보자마자 만든 느낌인데친구집 놀러가서 라면 먹으니집에서 많이 익은 김치 꺼내준 느낌인데아주 맛있다는 아니지만 계속 손이 가요​깍두기깍두기가 많이 익었는데많이 익은 깍두기 엄청 좋아하는 편입니다깍두기는 다 내꺼(?)​용궁식당 국밥을 판매해서 그런지김치 두종류 모두 직접 담근 맛이구요자극적인 맛은 또 아닌데 손이 계속 가요​보은 용궁식당 음료수 2000원음료수가 2000원 인데 페트 500ml라서 찍어보았구요특이한점은 탄산수를 판매해요!맨밑에가 탄산수​오징어구이 12000원돼지구이 12000원공기밥 1000원*2인연탄구이에 공기밥은 별도라서 따로 주문해야합니다​오징어구이 12000원돼지구이 12000원오징어와 돼지가 메인으로 알고서 주문했는데무엇을 주문한듯 연탄구이는 사랑입니다처음에 동시에 나왔어요나오기 직전에누가 실외흡연하고 들어왔나 싶을정도로담배냄새인가 뭐지 싶었는데 메뉴가 바로 나오더라구요담배냄새가 아닌 엄청난 불향이 납니다너무 쎈 불향에 착각했을정도..ㅋㅋㅋㅋㅋ​오징어구이 12000원그릇 보세요가정용 그릇 느낌입니다 ㅋㅋㅋㅋㅋㅋ투박하지만 정감가는 느낌​오징어구이는 오징어와 대파 뿐불향이 엄청난데연탄구이 불향이라서여태 불향 쎄다? 했던 집과는 아예 다른맛입니다맛있긴 정말 맛있어요먹자마자 아..여기 진짜 맛있다 싶어요​돼지구이 12000원돼지구이는 기본이 매콤, 간장맛 총 2가지 입니다오징어와 돼지고기가 가격이 같다보니해산물인 오징어가 좀더 가성비 있게 느껴질수 있어요그치만 돼지구이도 돼지, 고추뿐양파, 마늘 이런걸로 양 늘리기 전혀 하지 않아서가격이 납득이 가더라구요​술안주로 먹어도 맛있고밥이랑 먹어도 맛있고엄청 배고프지도 않았는데정신없이 먹었네요처음엔 불향이 엄청 쎄거든여먹으면서 식으면 잡내가 올라오진 않으나불향이 익숙해져서 그런가 약하게 느껴지긴 해요고추가 들어가 있어서 그런가 먹다보면양념이 꽤나 매워요맵찔이라 그럴수도​막창구이 12000원2명이서 2인분에 밥두개 시키면 양 적진 않아요메인인 오징어와 돼지고기만 잔뜩 있으니까요그치만 벽에 막창구이가 정말 맛있다는 낙서가 있더라구요와 이거 막창구이 안먹으면 후회하겠다해서바로 주문했습니다막창구이 또한 막창과 고추뿐일절 마늘, 양파로 양늘리기 하지 않습니다​막창은 여태 딱딱한 돼지막창 위주로 먹었었는데대구 막창을 먹어보진 않았지만말로 듣기에 무척이나 부드럽다기에대구 막창이 이런느낌인가 할정도로엄청 부드러운 막창입니다막창은 부드러우면 대부분 질겨서 안씹히는데용궁식당 막창은 또 그렇지가 않아요​3가지 연탄구이 양념맛은 동일한듯 한데맵찔이기준 먹으면 먹을수록 맛있게 매워지고오징어, 돼지, 막창의 맛이 다 달라요막창은 돼지막창 특유의 꼬릿한 냄새가 양념맛과 잘 어우러졌고요그렇다고 막창이 돼지냄새나고 그렇진 않아요(냄새 나름 예민한편)오징어도 해산물만의 맛이있고돼지도 돼지만의 맛이 있어요진짜 다먹어봐야해요 다음엔 닭발먹어보고 도장 깨고 싶네요3가지 모두먹으니 배터집니다36000원에 술도 안먹었는데 아주 만족절대 비싼가격이다 생각하진 않아요​남/여 화장실 구분되어 매장내에 있어요​구기자엿 1봉 6천원​50m© NAVER Corp.더보기/OpenStreetMap지도 데이터x© NAVER Corp./OpenStreetMap지도 컨트롤러 범례부동산거리읍,면,동시,군,구시,도국가용궁식당충청북도 보은군 수한면 안내보은로 1273-3 일반음삭점#보은내돈내산#보은맛집#충북보은맛집#보은여행#보은당일치기#보은1박2일#보은식당#보은밥집#보은술집#보은존맛탱#법주사맛집#법주사밥집#속리산맛집#속리산밥집용궁식당영업시간 10:00~20:00휴무일월요일주차가능(무료) 5대매장내 남/여 구분 화장실",20250822
충북 보은 속리산 점심식당 용궁식당 돼지구이 내돈내산... ,"#충북보은여행#보은속리산식당#충북보은식당#보은직화구이전문식당#속리산식당#보은여행#보은단풍여행#충북보은밥집#보은점심#보은밥집#241117#아빠랑보은여행#가성비별로#속리산맛집가격대비 아쉬웠던식당 ㅠㅠ위치 :충북 보은군 수한면 안내보은로 1273-3운영시간 : 화-일 10:00-20:00매주월요일정기휴무전화번호 :043-542-928850m© NAVER Corp.더보기/OpenStreetMap지도 데이터x© NAVER Corp./OpenStreetMap지도 컨트롤러 범례부동산거리읍,면,동시,군,구시,도국가용궁식당충청북도 보은군 수한면 안내보은로 1273-3 일반음삭점가을이 끝나가는 시점!! 오랜만에 친정아빠랑 보은을 다녀왔어요~!!속리산가서 울긋불긋 단풍도 실컷 보고 ~~레일바이크도 탄 후 시간을 보니 점심시간이라오랜만에 아빠와함께 찾아간 보은 식당!!외부는 이렇게 생겼어요! 주차공간이 협소해서 가게 앞 길가쪽에도 주차를 많이 하시더라구요~!!사실 어디지? 처음엔 기억이 가물가물 했었는데 내부에 들어가보니 예전에 속리산다녀오는 길에아빠랑 왔던기억이 가물가물!! 나더라구요 ㅎㅎ보은 속리산 맛집인가!?벽면 곳곳엔 많은 사람들이 다녀간 흔적이 보였어요~!보은 속리산에 오시는 분들이 정말 많이오나봐요!!저희는 바로 룸으로 안내를 받았어요.보은 용궁식당 메뉴아빠는 주차를 하고계셔서 먼저 들어갔어요~! 저는 너무 오랜만에 와서 주문을 어떻게 해야하나고민하다무조건 같은 메뉴로 통일해야 하는지 알고돼지구이를 3인분 주문(1인 12,000원*3)했어요!그런데공기밥이별도라공기밥도 따로 3개 주문!!룸에는 4개의 테이블이 있었어요~!! 벽면 곳곳에는 정말 충북 보은 속리산 맛집인증을 하듯 많은사람들이다녀간 흔적들이 있었어요! 대체 얼마나 맛있길래~~하는 기대가!!(하지만..그 기대는 아주 큰 실망으로..^^)기본 찬으로는 멸치볶음, 깍두기, 배추나물,김치, 양파장아찌 그리고 콩나물국이 나왔어요~!간결하죠?ㅎㅎ사실 밑반찬이 와~정갈하고,많다 이느낌은 아니였어요!드디어 나온 돼지구이! 연탄직화구이집 답게 불향이 확 났어요! 매콤한 돼지제육볶음맛!!맛있었는데 먹다보니 많이 매운..??ㅎㅎ 간장은 어땠을지 궁금했지만. 이미 3인분을 주문했으니..ㅎㅎ사실 한접시가 먼저나왔는데알고보니 1인분씩 따로 나오더라구요!이럴줄 알았으면 각 다른메뉴를 시켜볼껄...ㅠㅠㅠㅠㅠㅠ미리 직원분께서 센스있게 말씀해 주셨더라면 좋았을 텐데 ..하는 아쉬움이 있었어요.1인분에 12,000원 이라는 가격치고는 양이... 적죠?...ㅎㅎ플레이팅이라도 예쁘게 나왔으면 나았을것같은...??총3인분 3접시가 나온 모습이에요!!1인분에 공기밥도 미포함으로 돼지고기가 한돈인건진 모르겠지만..고기만 12,000원인데  양도 그렇고 성의없는 모습이랄까..??돈이  아까웠어요~요즘물가,아무리 올랐다지만 가격대비 밑반찬이 푸짐한것도 아니고...쌈채소나, 찌개가있는것도아니고..여러모로 아쉬움이 남았어요.!!예전에는 어떻게 시켰고 무얼먹었는지 오래전이라 기억은 가물가물하지만오랜만에 찾아간 충북 보은 용궁식당!!재방문 의사는 없을것 같아요!!!​",20241117
더덕구이가 맛있었던 건강한 밥상 보은 속리산 다래식당,"2024. 2. 11. 방문​​아빠랑 점심 먹으러 보은 속리산 다래식당에 다녀왔습니다.속리산 올라가는 길에 식당이 엄청 많이 모여 있습니다. 그 중 저는 다래 식당을 갔어요.여길 선택한 이유는 일단 네이버 예약이 가능했습니다.연휴라서 사람이 많아 식당 못 들어갈까봐 예약했는데 생각보다 식당은 널널했고예약 없이 방문 했어도 무난하게 식사 할 수 있었을거 같아요.영업시간 8:00-22:00주차는 속리산국립공원소형주차장에 주차했습니다.주차장에서 살짝 걸어가면 됩니다.​​​#다래식당메뉴입니다.뭘 먹을까 고민하다가 아빠는#자연산버섯전골정식 주문하고저는#산채돌솥비빔밥주문했습니다. 그리고 짝꿍이 더덕구이 먹고 싶다고 해서#더덕구이와#파전도 주문했습니다.근데 파전 말고#도토리묵먹을껄 하고 후회했어요.도토리묵도 맛있을거 같은데 말이죠. 또 주문하기에는 양이 너무 많을거 같아서 도토리묵은 다음에 먹기로 했습니다.​​​자연산 버섯전골 정식입니다.정식은 일반 상과 다르게 반찬 종류도 더 많고 생선에 전까지 나옵니다.전 나오는거 보고 또 파전 대신 도토리묵을 시켰어야 했다는 생각을.... 아쉬움을.... 또르르​​​지글지글 보글보글 전골은 오래 끓여야 하더라고요.저는 괜찮았는데 아빠는 밍밍하니 맛없다고 하더라고요. 아마도 아빠는 MSG가 듬뿍 들어간 전골을 기대한거 같아요.이 전골은 건강한 맛이고 버섯향이 솔솔 나는 전골입니다.조미료가 들어간거 같지 않아요. 그래서 자연그대로의 맛이 강한데 자극적인걸 좋아하시는 분들은저희 아빠처럼 밍밍해서 맛없다고 생각 할 수 있을거 같아요.​​​이건 일반상입니다.식사류 주문하면 이렇게 기본 상차림으로 나옵니다.반찬이 다 정갈하고 맛있어요. 목이버섯 나물이 신선하고 맛있었습니다.아빠도 목이버섯 나물 잘 드셨어요.​​​돌솥비빔밥이 나왔습니다. 콩나물국도 함께 나왔습니다.비빔밥은 맛이 없을 수가 없죠. 완벽하게 맛있어요.저희 아빠는콩나물국이 버섯찌개 보다 더 맛있다고 하셨는데....아빠를 위해 건강식 말고 MSG 들어간 자극적인 음식을 사드려야겠어요.​​​더덕구이 나왔습니다. 냄새부터 맛있더라고요.이날 식당에서 먹은 것 중 더덕구이가 제일 맛있었어요. 양념이 기가 막히더라고요.근데 살짝 아쉬운건 더덕이 너무 통이라는 사실입니다.제 동생말에 의하면 더덕 펴는 정성이 부족하다고 하더라고요.더덕 얇게 펴서 양념 바르면 양념이 더 잘 베서 더 맛있을거같긴해요.그래도 여기 양념 최고! 양념장 배워오고싶어요.​​​마지막으로 파전입니다.두툼하니 파와 오징어가 듬뿍 들어있었습니다.역시 기름 만난 전이 맛이 없을 수 없죠.맛있어서 도토리묵 못 먹은 아쉬움을 지울 수 있었습니다.​개인적으로 더덕구이, 파전이 식사보다 더 괜찮았고그래서 도토리묵양념이 더 궁금했던 식당이였습니다.​​​50m© NAVER Corp.더보기/OpenStreetMap지도 데이터x© NAVER Corp./OpenStreetMap지도 컨트롤러 범례부동산거리읍,면,동시,군,구시,도국가다래식당충청북도 보은군 속리산면 사내7길 7예약#다래식당#보은다래식당#속리산다래식당#속리산맛집#보은맛집#더덕구이맛집#속리산산채비빔밥#속리산버섯전골#속리산한정식#속리산밥집#속리산식당​",20240217
보은 속리산 맛집! 직접... 사용한 보은 건강 맛집 석정식당!,"안녕하세요!보고 싶은, 오고 싶은 보은관광입니다 :)추워진 날씨 보은에 관광을 하기 위해 방문했다가얼었던 몸을 녹이기 위해 뜨끈한 국물요리를 찾는 사람들이 많아지고 있는 요즘인데요!오늘은 보은에서직접 채취한 재료를 사용해 건강한 식사를 맛볼 수 있는 곳으로보은속리산 입구에 위치한 버섯전골 맛집 석정식당을 소개해 드리도록 하겠습니다!그럼 지금부터 함께 살펴볼까요?​보은 속리산 맛집! 직접 채취한 재료를 사용한 보은 건강 맛집 석정식당!충북 보은군 속리산면에 위치한이곳석정식당은 속리산 초입에 위치해 있어서등산 후 맛있는 음식을 맛볼 수 있는 속리산 맛집으로 소문난 곳입니다.석정식당의 가게 내부로 들어서면 입식과 좌식 테이블로 나누어져 있는데요.가게 내부가 좁지 않고 테이블 간 간격이 넓어서 단체로 방문을 하기에도 좋은 곳입니다.또한, 좌식 테이블이 있는 방 한편에는담금주들이진열되어 있어서 많은 손님들의 눈길을끌고 있답니다.다양한 향토음식들이 준비되어 있는 석정식당은이곳의 대표 메뉴인 산채 더덕정식을 주문하면여러 산나물들을 활용해 만든 밑반찬들이 상을 가득채우는데요.다양하게 맛볼 수 있는 밑반찬들은 모두 정갈하게 나와서부모님과 함께 식사를 즐기기에도 좋은 곳이랍니다.산채 더덕정식의 메인인더덕구이는 빨갛게 물들어 침샘을 자극하는 비주얼을 자랑하는데요.자극적이지 않고 달달한 맛이 특징으로 속리산의 자연을 맛볼 수 있어서많은 사람들이 이곳에 방문하면 찾는 인기 메뉴랍니다.더불어, 쫄깃쫄깃한 버섯의 식감과 더불어 추운 날씨에 따뜻하게 몸을 녹일 수 있는버섯전골 또한 이곳 석정식당을 대표하는 메뉴인데요.​버섯전골에 들어가는버섯들은 직접 자연에서 채취해 만들어서건강함과 맛 두 가지를 모두 사로잡아서 많은 사람들이 이곳을 방문하면찾는 인기 메뉴로자리 잡고 있답니다~뿐만 아니라 남녀노소 모두에게 인기를 자랑하는산채비빔밥은들어가는 나물의 재료가 총 12가지인데요.산채비빔밥 안에 들어가는 나물은 사장님께서 직접 채취한 나물을활용해 만들어서 더욱 건강하게 맛볼 수 있답니다.푸짐한 상차림과 맛과 건강함 삼박자를 모두 완벽하게 갖춘 석정식당!이곳 석정식당에 방문해추운 날씨 몸을 따뜻하게 녹여줄 깊은 버섯전골과향긋한 산채비빔밥 그리고 달고 더덕의 풍미가 일품인 더덕구이까지맛있는식사를 즐겨보시는 것을 추천드립니다 :)​그럼 다음번에도보고 싶은 오고 싶은 보은관광이 알찬 소식으로 여러분을 찾아뵙겠습니다.​",20240102
[충북보은여행] 속리산 법주사 석정식당 산채더덕정식은 여기다!,"미니쭈입니다 :)​막바지 여름휴가겸 보은 속리산쪽으로 여행갔다가법주사 소문난 맛집석정식당에서산채더덕정식으로 힐링하고 왔어요​속리산 입구에 산채더덕정식 맛집들이 많은데어디로 가야할지 모르겠다면?일단 석정식당으로 고고고​석정식당 직접 방문해서 먹고 온찐텐후기 지금 바로 만나볼게요리뷰스따투-!!!​​석정식당은 속리산 입구에 위치하고 있어서일단 접근성부터 합격입니다 💯​자차로 이동하시는 분들은근처에 공영주차장 이용하셔도 좋지만매장 바로 앞에 주차공간이 여유있으니편하게 주차하셔도 좋을 것 같아요 🙌🏻​산행 마치고 들르기에도 좋고,저처럼 그냥 석정식당만 방문해도 좋을 위치라온가족이 만족했답니다 ㅎㅎ50m© NAVER Corp.더보기/OpenStreetMap지도 데이터x© NAVER Corp./OpenStreetMap지도 컨트롤러 범례부동산거리읍,면,동시,군,구시,도국가석정식당충청북도 보은군 속리산면 법주사로 272 1층 석정식당​📍위치 / 충청북도 보은군 속리산면 법주사로 272석정식당⏰시간 / 08시오픈~22시마감🚘주차 / 매장 앞 주차공간 있음☎️문의 및 예약 / 043-543-3686​​믿고 먹는 블루리본일단 요런게 보인다 ? 👀고민말고 들어오면 되시겠습니다​​매장은 정말 깔끔한 스타일이였고평일 점심도 저녁도 아닌 애매한 시간임에도손님들이 많아서 깜짝 놀랐어요!역시 소문난 맛집은 다르구나 싶었답니다​손님 안계시는 테이블 위주로 찰칵찰칵 📸​바쁘신 와중에도 부부사장님께서넘넘 친절하셔서 기분 좋았던건 덤 💖💖​​메뉴 주문은 ..?산채,더덕정식 ₩20,0X 2인분 주문할게요 🙌🏻저는 속리산에 온 만큼 산채정식을 꼭 먹어보고싶어서산채더덕정식으로 주문했는데,다른테이블 보니까 버섯전골도 많이들 드시더라구요​비쥬얼보니 버섯전골계의 끝판왕이던데다음에는 버섯전골로도 도전해봐야겠어요 😋​​주문즉시 찹찹 시작되는 요리들와.. 해물파전 무드 미쳤다리 .. ✨​막걸리 주문 안하고는 못 베길 비쥬얼!!👀👀차만 안가져왔어도 한잔 땡기는건데참 아쉬운 순간입니다 ㅋㅋㅋ​0초0초광고 후 계속됩니다.다음 동영상subjectauthor취소석정식당재생2좋아요0좋아요공유하기재생 (space/k)재생00:080:00:00재생 (space/k)재생음소거 (m)음소거00:00/00:08실시간설정전체 화면 (f)해상도자동 480p자막사용 안함재생 속도1.0x (기본)해상도자동 (480p)720pHD480p270p144p자막설정사용 안함옵션글자 크기배경색재생 속도0.5x1.0x (기본)1.5x2.0x죄송합니다. 문제가 발생했습니다. 다시 시도해 주세요.도움말음소거 상태입니다.도움말라이센스고화질 재생이 가능한 영상입니다.설정에서 해상도를 변경해보세요.더 알아보기00:00석정식당해물파전 잠깐 구경하고 온 사이에테이블 세팅이 시작됐습니다!​테이블이 4인기준 굉장히 컸음에도 불구하고테이블이 꽉 찰정도로 밑반찬이 나와서정신을 못차리겠더라고요 😵‍💫너무 행복했던 여행의 순간이였달까요 ?​​된장찌개는 칼칼함에 1차 치임고소한 두부랑 달달한 애호박이 듬뿍들어있는시골 된장으로 끓인 구수한 맛 .. 😋제가 제일 좋아하는 된장찌개 였어요 👍🏻👍🏻​메인인 더덕구이도 아주 일품!숯불향이 은은하게 베여있고양념이 매콤달콤해서 밥도둑이 따로 없더라구요더덕 씹을때마다 나는 향긋한 향이확실히 맛집의 비결이 느껴지는 맛이였어요​​우리 딸이 환장했던 조기구이짭쪼롬하고 쫄깃탱탱하니 튼실했어요사실 요거 한마리에 찬물에 밥 말아서뚝딱 한그릇인데 ㅋㅋ 😋반찬 진짜 잘나오죠 !!!​​각종 버섯나물과 산채나물들이한상 가득 나와 건강하고 정갈한 밥상한끼를선물받는 느낌이였어요 ~​특히나 상위에 올라온 모든 버섯과 나물들은사장님께서 직접 채취한다고하셔서더욱 믿음이 가는석정식당입니다 👍🏻​자극적이지 않고 간이 세지 않아서자연 원물 본연의 맛을 느낄 수 있었던건강밥집 석정식당 !​​개인적으로는 황태부각무침이랑 보은대추절임이랑깻잎짱아찌가 기억에 특히 남아요 !​평소에는 밥 한그릇 다 못먹는 소식좌이지만석정식당에서는 한그릇 다 비우고공기밥 추가주문했다면 말 다했죠 ? 😋​전체적으로 건강한 밥상이라 속도 편했고과하지 않는 맛이라 오래 기억에 남아요물론 아이들과 함께해도 먹을게 많아서아이와도 같이 방문하셔도 좋을 것 같아요​​보은 속리산 근처 맛집 찾으신다면법주사 산채더덕정식 맛집 석정식당 추천 🙌🏻​나물 좋아하시는 분들은 분명 만족하실거고,특히 더덕구이는 석정식당에서만 맛볼 수 있는별미메뉴라서 추천드려요산행전후로 힐링과 몸보신을 담당하는속리산 법주산 산채더덕구이는 석정식당과 함께하세요!​#속리산맛집#법주사맛집#보은석정식당#석정식당#법주사산채비빔밥#법주사산채정식​​",20250908
