title,content,date
"보은 속리산레포츠시설, 가을 단풍에 북적","보은 속리산레포츠시설, 가을 단풍에 '북적' - 충북뉴스(충북뉴스 보은=오태경 기자) 보은군 속리산레포츠시설이 가을 단풍철을 맞아 나들이 명소로 각광받고 있다.보은군은 속리산을 찾는 관광객이 급증하면서 속리산레포츠시설이 다시 한번 \'가을 나들이 명소\'로 ...www.cbnews.kr(충북뉴스 보은=오태경 기자)  보은군 속리산레포츠시설이 가을 단풍철을 맞아 나들이 명소로 각광받고 있다.

보은군은 속리산을 찾는 관광객이 급증하면서 속리산레포츠시설이 다시 한번 '가을 나들이 명소'로 주목받고 있다고 21일 밝혔다.

속리산레포츠시설은 충청북도 균형발전사업의 일환으로 조성된 대표 관광레포츠 시설이다. 

속리산의 수려한 자연경관을 감상하며 이동할 수 있는 모노레일, 아찔한 속도감을 즐길 수 있는 집라인, 가족 단위로 인기가 높은 스카이바이크와 스카이트레일 등 다양한 체험시설을 갖추고 있다.

군에 따르면 올해 5월부터 9월까지 속리산레포츠시설 이용객은 총 4만 1052명으로 전년 같은 기간(4만 749명) 대비 소폭 증가했다. 9월 연이은 비와 흐린 날씨로 이용객이 감소했음에도 증가세를 보인 것이다.

특히 모노레일은 올 한 해 이용객이 4만 5365명으로 전체 방문객(5만 7053명)의 70% 이상을 차지하며 대표 체험시설로 자리매김했다.

10월 단풍 절정기를맞아 방문객이 급증하고 있으며, 보은대추축제와 어우러져 주말마다 모노레일과 집라인 탑승 대기줄이 길게 늘어서며  인기를 끌고 있다.​속리산레포츠시설은 단순한 체험공간을 넘어 지역경제 활성화의 핵심 거점으로 자리 잡고 있다. 인근 카페, 식당, 숙박시설 등 지역 상권에도 긍정적인 파급효과를 불러일으키며 속리산 관광벨트의 중심 역할을 하고 있다.​이경숙 속리산휴양사업소장은 ""속리산레포츠시설은 충청북도와 보은군이 함께 추진한 균형발전사업의 대표 성과로, 매년 이용객이 꾸준히 늘고 있다""며 ""가을 나들이철을 맞아 더 많은 관광객이 속리산의 매력을 안전하게 체험할 수 있도록 시설 운영과 안전관리에 만전을 기하겠다""고 말했다.​출처 : 충북뉴스(http://www.cbnews.kr)",20251022
보은 속리산 법주사 근처 맛집 능이향이 물씬 풍기는... ,"2025. 1. 4. 방문​​보은 속리산에 위치한 양가네 칼국수에 다녀왔습니다.영업시간 10:00-19:00매주 목요일 휴무속리산 법주사 가는 먹자골목(?)에 위치하고 있어요.가게 앞에 넓게 주차장이 준비되어 있습니다. 그래서 주차걱정은 하지 않아도 됩니다.​​​가게 내부의 모습입니다.이날 제가 갔을때는 손님이 없어서 무난하게 사진을 찍을 수 있었습니다.가게가 생각보다 넓어요.​​​한쪽에 셀프코너도 준비되어 있습니다.반찬이 심플하지만 더 필요하면 셀프코너를 이용하면 됩니다.그리고 공기밥도 셀프로 가져 올 수 있습니다.​​​#양가네칼국수메뉴입니다.양가네칼국수와#능이칼국수그리고#감자전주문했습니다.근데 가격이 정말 착하지 않나요? 능이칼국수가 9천원이라니요. 가격이 정말 착해요.​​​기본반찬이 나왔습니다.칼국수집에서 콩나물 주는거 좋아요!! 심지어 콩나물 아주 맛있어요. 잘 무치셨네요.셀프코너에서 콩나물 더 가져왔습니다.​​​먼저 감자전이 나왔습니다. 테두리 보이시죠?? 아주 바삭합니다.바삭 촉촉 그리고 간장이 참 맛있어요.​​​먼저 능이칼국수 입니다.양가네 칼국수랑 겉으로 보기에는 다를게 없어 보여요.처음에 딱 봤을때 둘의 차이점은 만두가 있고 없고의 차이였습니다.능이칼국수 안에는 만두가 들어 있고 양가네칼국수는 만두가 없어요.그리고 칼국수 면을 싹 들면 안에 능이가 들어있습니다. 국물에서도 능이향이 은은하게 납니다.그리고 만두에도요! 만두에도 능이버섯이 들어있습니다.만두에도 능이가 들어가서 능이칼국수에만 만두가 들어가나봐요.​​​양가네 칼국수입니다. 능이 칼국수와 비슷한 비주얼 이지만 만두도 능이도 없습니다.하지만 국물은 아주 진하고 맛있습니다.국물 분명 어디서 먹어본것처럼 친숙합니다. 근데 또 달라요.비슷하면서도 또 다른 특별한 국물을 가진 양가네 칼국수였습니다.면도 쫀쫀하고 칼국수 안에 실한 칼국수도 있습니다.뭐가 많이 들어가있는거 같지는 않은데 깔끔하면서 맛있습니다.​속리산에 산채비빔밥이랑 버섯전골 이런 식당이 많은데 칼국수집도 아주 좋네요.비오는날 먹으면 더 좋을거 같아요. 역시 칼국수는 비오는 날이죠.​​​50m© NAVER Corp.더보기/OpenStreetMap지도 데이터x© NAVER Corp./OpenStreetMap지도 컨트롤러 범례부동산거리읍,면,동시,군,구시,도국가양가네칼국수충청북도 보은군 속리산면 법주사로 248-27#양가네칼국수#보은맛집#속리산맛집#법주사맛집#보은양가네칼국수#속리산양가네칼국수#보은칼국수#속리산칼국수#속리산법주사맛집#법주사칼국수​",20250120
"보은 속리산,법주사 (+보은대추닭강정,석정식당)","처음으로속리산을 가보았습니다!이날은 우중산행 안개도 많이끼고 조심해야함 미끄러운.목적지는 문장대먼가 이 사진 맘에드는 분위기 ㅋ문장대까지좀 가파르긴하지만 엄청 힘들거나하진않습니다 관악산 일반적인 산행정도의느낌​다만 돌길이 많아서 조심해야함.문장대절경이 이날은 안개라 볼수없었지만 나름 다른 운치가있었으니 오히려 조아.이 계단 만들었을때 엄청 위험했을듯.고인물이런분위기 나쁘지않아.이렇다고합니다.내려가는길은 같은코스로 내려가서 좀 지루했습니다.용바위골 휴게소.법주사 가는길 맑은 계곡.법주사 도착​유네스코 세계문화유산 산사중 처음으로 가보는 산사 법주사입니다.보수중인가.인자하다.유명한 팔상전입니다.현존하는 가장 오래된 목탑이에요1624년에 다시 지어졌다고합니다.진짜 멋있음.이 시점 좋음.대웅전보물로 지정되어있습니다.33미터 불상은 어디서든 보이기.인자한 부처님귀이건 왜?!쌍사자 석등보존상태가 아주좋은 석등입니다.금동미륵입상입니다 이름은.​박정희때 다시 지어진거고 원래는 청동색이였다고합니다.철주당간역시 복원된것,​아무튼 볼만했습니다!!올해 블루리본에 올랐다고하는 석정에서 산채,더덕정식!수많은 반찬들 하나씩만 먹어도 배불러지는!메인은 된장찌개 더덕.그리고 조기까지.맛이 의외로 다 비슷하지만 또 식재료 자체의맛에 따라 괜찮은게 있죠더덕은 쏘쏘산초 이렇게 실물로 먹은건 처음인데 맘에들었습니다 강렬한 향이!​전체적으로 다양한 나물 산채반찬 다양하게먹을수있어서 그게 좋았음.보은 대추 닭강정대추진액과 대추토핑​아주 미세하게 대추향을 느낄수있는 무난한 닭강정입니다!",20251017
[충북 보은] 아이랑 가기좋은 보은 숙소 속리산숲체험휴양마을... ,"이번 여름 보은여행에 다녀온 숙소 후기 두번째입니다.첫번째 슥소가 궁금하시다면 링크 클릭클릭~[충북 보은] 속리산말티재자연휴양림 휴양관 묘봉 후기 보은숙소후기 보은자연휴양림보은은 속리산을 끼고 있는 동네에요. 보통 한개 있는데 보은은 진짜 너무 좋은 자연휴양림을 3개나 가지고...blog.naver.com300m© NAVER Corp.더보기/OpenStreetMap지도 데이터x© NAVER Corp./OpenStreetMap지도 컨트롤러 범례부동산거리읍,면,동시,군,구시,도국가속리산 숲체험휴양마을입구충청북도 보은군 속리산면 갈목리속리산 숲체험휴양마을충청북도 보은군 속리산면 속리산로 596속리산 휴양림 두번째 이야기​보은의 너무 좋은 숙소가 있어서 소개해 드릴께요~다녀왔는데 대만족!아이들과 가기 너무 좋구요~ 심지어 숙박료에 아침이 포함이에요!석식은 신청하면 숙소에서 먹기 가능~ 지금부터 상세히 알려드릴께요~ 따라오세요~#보은밥주는숙소#보은조식숙소#보은조식공짜#보은조식포함숙소​속리산 숲체험 휴양마을 입니다. 주소가 다른거 같지만 실제로는 같습니다. 왜냐면 입구가 하나뿐이거든요.속리산숲체험마을은 들어가려면 3시에 와야해요. 문 열어주는 곳을 지나가야지만 숲체험휴양마을에 들어갈 수 있거든요. 차안에서 체크인을 합니다.직원분이 너무 친절하게 안내해주십니다.안내장을 주시는데 아주 상세하게 읽어보시라고 적혀있어요. 숙소 위치에 따라 색상이 바닥에 잘 칠해져있어요. 왜냐면 이곳은 일방통행이거든요. 잘못들어가면 돌아갈 수가 없어요. 다시 산을 내려갔다 올라오셔야합니다. 지도를 보고 잘 보고 가셔야 합니다.속리산숲체험휴양마을은 일방통행인거 꼭 기억하세요.출구는 반대쪽 삼거리 끝에서오른쪽으로 가야합니다.숲속의집 6인실( 한옥마을)은 노란색, 숲속의집 4인실(황토초가)은 초록색길, 숲속의집 4인실 (황토너와)은 빨간색연립동 통나무집은 분홍색길식당은 보라색입니다.속리산숲체험휴양마을 안내사항​카드키 잃어버리면 15천원이에요 조심하세요. 숙소내외 모든 장소 취사 금지, 애왼동물 출입금지, 흡연금지침구류 추가 1만원​조식시간: 오전 8시 ~ 9시30분 [9시까지입장해야함]공휴일 만실일경우 7시30분부터 가능조식은 무료 [숙박인원기준]​석식은 성인 2만원 초등 1.5만원 미취학아동 무료석식시간: 17시30분~20시[19시까지 입장해야함]​물놀이장 운영시간 오전 9시30분~ 11시30분오후 13시 30분~ 17시30분당일입실객은 15시부터 입장가능 조기입장불가, 퇴실객은 수영장인근에 주차하고 11시30분까지 수영장에서 놀고 퇴실할것호랑이버스는 물놀이장 운영시간동안 운영운영간격은 일정하지 않으나 10~20분간격저희 숙소는 산호대 4 통나무집이에요. 통나무집은 총 3개의 동이 있어요.이따가 다시 설명할께요. 숙소까지 가는 길이 외길이라 잘 보셔야합니다. 산호대 4번은 통나무집이고 분홍색이니까 기억하세요.속리산숲체험휴양마을 전화번호: 043-540-3220지내다가 궁금하시면 전화 꼭하세요.요렇게 길바닥에 색이 칠되어 있어요.핑크색은 통나무~ 기억하시죠!! 길따라 갑니다.통나무집은 추래석문 산호대 봉황문 이렇게 세개의 동이 있는데요. 추래석문이 가장 바깥쪽으로 주차장이랑 가까워요.  산호대는 가운대 건물이에요. 봉황대는 가장 안으로 들어가요.통나무집은 엘레베이터가 없어요. 산호대4,5,6은 1층 1,2,3은 2층입니다. 저희는 다행이도 4번이라 ㅎㅎㅎ 안도했어요.안내문도 받았지만 숙소안에도 정보는 또 적혀있어요. 입실은 3시 퇴실은 11시키 반납은 문옆 반납함에 넣어두시면 되요.산호대는 통나무집이라 들어가자마자 나무 향이 쫘악퍼져요~ 넓은 방과 깔끔한 화장실이 준비된 숙소에요. 원룸형식입니다.붙박이장에 이불과 베게 다 준비되어 있어요.  총 4인기준입니다. 참고로 바닥이불이 많이 아주 많이 얇아요.베란다도 있는데요. 빨래걸이도 준비되어있습니다. 베란다도 넓어요.산호대를 바라보는 곳이 뷰가 있지는 않아요. 아쉽지만 이유가 있을거 같아요.수영장입니다. 족욕탕과 스파탕이 함께 있어요. 족욕탕과 스파탕은 온도가 따뜻하구요. 물도 많지 않아서 둘째도 걷기 편해요오후 4시정도의 모습입니다. 수영장에 사람이 많죠 ㅎ 해가 산으로 넘어가는중이라 스파쪽이 그늘지어졌어요. 아침에는 화장실쪽이 그늘져요. 의자는 자유롭게 사용하는 분위기였어요. 빨리 와서 차지해야 겠죠. 물은 깊지 않아요. 어른들은 허리정도 와요.각 숙소앞에 순환버스 정류장이 있어요호랑이모양이라 호랑이버스라고 이야기해요.통나무집의 장점은 식당을 걸어서 갈 수 있다는 사실이에요.식당입구에 손닦는게 있어요. 입구에서 석식요금은 계산하시면 되요.속리산숲체험휴양마을에 숙박하시면 석식관련 문자가 오거든요. 그때 신청 꼭 하시면 되요. 저희도 미리 예약해서 결제는 현장에서 했습니다.이미 사람들이 많더군요. 5시부터 식사인데 저희는 6시쯤 갔어요반이상 자리가 차있더군요보은에서 자란 채소와 야채를 가지고 만든 음식이래요.보쌈이 진짜 너무 맛있어요. 살살 녹아요. 샐러드와 김밥 , 두부조림, 메밀전, 김치 , 된장국이 준비되어 있어요.#속리산숲체험휴양마을석식#속리산숲체험휴양마을저녁식당에서 술을 팔지는 않는데요. 가져오신 술은 마실 수 있대요. 대신 취해서 소동부리면 안되는거 아시죠. 머든지 적당히!! 저희는 맥주를 사서 가져갔는데 맥주잔은 준비되어 있어서 사용했어요. 맥주와 보쌈이 아주 환상조합이였어요.숙소에서 남이해준 밥을 먹는다는게 엄청 편하더군요. 진짜 강추인데 아쉽게도 매일 메뉴가 같대요. 반찬 한두개만 차이지는거 같아요.다음날 아침은 숙박비에 포함인거 아시죠?? 잊지말고 먹어야죠 ㅎㅎ원래 8시부터인데 만실이라 7시반부터 식사 가능하다고 해서 그시간에 일어나서 다녀왔어요. 저희가 첫손님입니다.시금치, 계란말이, 깍두기, 오뎅볶음, 파프리카무침 , 미역국만찬 준비완료#속리산숲체험마을조식아기의자도 3개정도 있어요. 선착순이에요. ㅎㅎ 저희도 잘 사용했어요. 아이들용은 아니지만 포크와 숟가락도 있어요.밥먹고 나오면 호랑이차가 기다리고 있어요. 투어용과 숙소용이 있으니 구분해서 타세요. ㅎ0초0초광고 후 계속됩니다.다음 동영상subjectauthor취소속리산숲체험휴양마을재생41좋아요0좋아요공유하기재생 (space/k)재생00:010:00:00재생 (space/k)재생음소거 (m)음소거00:00/00:01실시간설정전체 화면 (f)해상도자동 480p자막사용 안함재생 속도1.0x (기본)해상도자동 (480p)720pHD480p270p144p자막설정사용 안함옵션글자 크기배경색재생 속도0.5x1.0x (기본)1.5x2.0x죄송합니다. 문제가 발생했습니다. 다시 시도해 주세요.도움말음소거 상태입니다.도움말라이센스고화질 재생이 가능한 영상입니다.설정에서 해상도를 변경해보세요.더 알아보기00:00접기/펴기속리산숲체험휴양마을#속리산숲체험휴양마을저희는 아침에 속리산숲체험휴양마을 투어하는 버스를 탔어요. 아가들이 호랑이버스를 상당히 좋아했거든요. 더운데 호랑이버스 타면 속도감은 없지만 시원해요한옥마을부터 가는데 멋지더군요. 다음 숙소는 이곳으로!?!0초0초광고 후 계속됩니다.다음 동영상subjectauthor취소속리산숲체험휴양마을재생65좋아요0좋아요공유하기재생 (space/k)재생00:060:00:00재생 (space/k)재생음소거 (m)음소거00:00/00:06실시간설정전체 화면 (f)해상도자동 480p자막사용 안함재생 속도1.0x (기본)해상도자동 (480p)720pHD480p270p144p자막설정사용 안함옵션글자 크기배경색재생 속도0.5x1.0x (기본)1.5x2.0x죄송합니다. 문제가 발생했습니다. 다시 시도해 주세요.도움말음소거 상태입니다.도움말라이센스고화질 재생이 가능한 영상입니다.설정에서 해상도를 변경해보세요.더 알아보기00:00접기/펴기속리산숲체험휴양마을#속리산숲체험휴양마을풍수지리 하는 분들에게 조언받아서 자리를 선정했다고 하네요.한옥숙소 참 멋지죠!각 숙소마다 정류장이 있으니 거기서 기다리면 버스 탑승 가능해요. 아침에는 식당으로 주로 가구요. 식사 이후에는 수영장으로 돌아다녀요.호랑이버스타면서 곳곳을 구경하니 너무 이쁘더군요.보은이 소나무가 많은거 같던데 산의 아름다움을 많이 살릴려고 한거 같아요.어느덧 수영장까지 지나서 ~ 출구로 나오니 속리산테마파크가 등장합니다.전기차의 장점은 일반도로는 못다니지만 출구에서 다시 올라갈 수 있어요. 출구로 내려오면서 본 긴~ 공간이 있는데 무엇인가 궁금했는데 설명해주셨어요.속리산전찬후훈련장 입니다. 말이 어렵지 단거리 달리기 연습공간입니다. 달리기 선수들을 양성하는 곳인데 우사인볼트가 연습하는 방법이라고 하네요. 우리 선수들도 열심히 해서 좋은 결과 나오면 좋겠네요.#보은속리산단거리연습장#보은단거리달리기연습장0초0초광고 후 계속됩니다.다음 동영상subjectauthor취소속리산숲체험휴양마을재생54좋아요0좋아요공유하기재생 (space/k)재생00:030:00:00재생 (space/k)재생음소거 (m)음소거00:00/00:03실시간설정전체 화면 (f)해상도자동 480p자막사용 안함재생 속도1.0x (기본)해상도자동 (480p)720pHD480p270p144p자막설정사용 안함옵션글자 크기배경색재생 속도0.5x1.0x (기본)1.5x2.0x죄송합니다. 문제가 발생했습니다. 다시 시도해 주세요.도움말음소거 상태입니다.도움말라이센스고화질 재생이 가능한 영상입니다.설정에서 해상도를 변경해보세요.더 알아보기00:00접기/펴기속리산숲체험휴양마을#속리산숲체험휴양마을멀리서 보면 보이겠지만 각도가 살짝씩 올라갑니다.롤리트리 아동용 UV차단 아쿠아 메쉬 플랩캡 - 물놀이잡화 | 쿠팡현재 별점 4.8점, 리뷰 968개를 가진 롤리트리 아동용 UV차단 아쿠아 메쉬 플랩캡! 지금 쿠팡에서 더 저렴하고 다양한 물놀이잡화 제품들을 확인해보세요.link.coupang.com모닝투어 끝내고 숙서 체크아웃한 다음에 수영장에 놀러왔어요. 확실히 오전이 사람이 더 적긴해요.수영장은 운영시간이 정해져있으니 명심하세요. 수영장은 참고로 첫째기준 120 아이가 혼자 서있을수 있어요. 근데 조금 불안합니다. 구명조끼 가져오시면 좋을거 같아요.#속리산숲체험휴양마을수영장운영시간오전 9시~11시30분오후 1시~ 17시30분​취사금지,음식금지, 음주금지어제 놀아봤다고 튜브도 가져와서 놀아요. 뜨겁다고 난리 칠때는 언제고 아이들의 변덕은 신기해요. 물놀이장에 물이 뿜어져 나오는 곳도 있는데 저것만으로도 신나하더군요. 그밑을 지나가면 비가 오는것처럼 재미있어서 아이들이랑 물총가지고 물놀이 하기 너무 좋아요.수영장에 보이는 곳에 화장실 겸 샤워장이 있어요. 참고로 샤워실이 야외라고 보시면되요. 한명은 밖에서 서있는게 좋아요. 화장실 앞에 바구니도 있어서 샤워하실때 편할거에요.탈의실은 화장실 뒷쪽으로 가야해요.수영장에서 파랑색 따라서 조금만 오시면 공터가 있는데 그곳이 임시 주차장이에요. 퇴실하시고 차끌고 오실때 여기 주차하시면 되요.날이 너무 더웠는데 가끔씩 구름이 가려줄때 시원해져요.보은에 이렇게 편하게 여행 할 수 있는 공간이 있다는게 넘넘 좋더군요.그래서 그런지 아이들과 함께하는 가족들이 많아 보였습니다. 다음에 기회가 된다면 좀 더 길게 숙박하고 싶은데 자리 예약이 쉽지 않다는 단점이 있지요. 그래도 다음에 다른 숙소를 꼭 가보고 싶네요.참고로 2025년 보은대추축제는 2025년 10월 17일~10월 26일까지 진행되요.뱃들공원과 속리산 일원에서 진행됩니다.#2025년축제#2025년보은대추축제​50m© NAVER Corp.더보기/OpenStreetMap지도 데이터x© NAVER Corp./OpenStreetMap지도 컨트롤러 범례부동산거리읍,면,동시,군,구시,도국가속리산 숲체험휴양마을충청북도 보은군 속리산면 속리산로 596#속리산숲체험휴양마을#속리산숲체험휴양마을산호대후기#속리산숲체험휴양마을수영장#속리산숲체험#속리산숲체험휴양마을석식#속리산숲체험마을물놀이#속리산숲체험휴양마을숙박#보은숙박#보은숙소추천#보은아이랑#보은여행#보은아이랑추천#보은아이랑여행추천#보은가볼만한곳#보은여행추천#보은속리산휴양림#보은휴양림추천#보은휴양림수영장#보은휴양림계곡",20250806
