title,content,date
보은 속리산 맛집 70년 손맛 경희식당 후기,"본게시물은 소정의 원고료를 받았습니다​안녕하세요~ :)오늘은 속리산 맛집을 소개해 드리려고 이렇게 포스팅을 작성하고 있는데요!요번에 다녀왔던 곳은 제가 지인에게 추천을 받았던 곳이에요.소박한 한정식이 이렇게 만족스러울 줄은 몰랐어서 후기를 남기게 되었어요.산에서 내려온 입맛이 포근히 안긴 한 끼였답니다!그럼 시작해 볼게요~​“경희식당”​경희식당​주소 : 충북 보은군 속리산면 사내7길 11-4전화번호 : 043-543-3736영업 시간 : 매일 09:00 - 19:00 (라스트 오더 18:30)1. 속리산 맛집제가 이때 찾았던 속리산 맛집은 속리산 법주사 입구 바로 근처에 위치해 있어요~외관은 고즈넉한 노포 느낌으로, 오래된 전통이 묻어나더라고요!착한식당으로 선정되었다는 현판과 함께 방송 출연 사진이 입구에 걸려 있던...!믿음이 가는 첫인상이라서 벌써부터 기대 만발. ㅎㅎㅎ내부는 옛날 시골집 분위기가 물씬 났어요.나무로 된 가구와 창틀이 정겹더라고요~구석구석 전통적인 멋이 살아 있어 어른들도 좋아할 분위기예요!창틈으로 따뜻하게 햇살이 들어오던 점도 한 몫 해 주었어요.​2. 경희한정식단일 메뉴로 되어 있어서 인원 수만큼 주문해 주었는데요~ :)상이 차려지고 나서는 탄성이 절로 나왔어요.불고기 전골을 중심으로 온갖 반찬들이 가득 차려지더라고요...!접시 하나하나 정성이 들어간 게 느껴졌고, 차림새도 예뻤답니다.0초0초광고 후 계속됩니다.다음 동영상subjectauthor취소속리산 맛집재생207좋아요0좋아요공유하기재생 (space/k)재생00:180:00:00재생 (space/k)재생음소거 (m)음소거00:00/00:18실시간설정전체 화면 (f)해상도자동 480p자막사용 안함재생 속도1.0x (기본)해상도자동 (480p)1080pHD720pHD480p270p144p자막설정사용 안함옵션글자 크기배경색재생 속도0.5x1.0x (기본)1.5x2.0x죄송합니다. 문제가 발생했습니다. 다시 시도해 주세요.도움말음소거 상태입니다.도움말라이센스고화질 재생이 가능한 영상입니다.설정에서 해상도를 변경해보세요.더 알아보기00:00속리산 맛집3. 상차림 구성가장 먼저 우거지국부터 후루룩 맛보아 주었는데요.구수하고 담백해서 깊은 맛이 밥과 잘 어울렸어요!​동그랑땡은 두툼하고 속이 꽉 차 있어서 합격이었어요. ㅎㅎ겉은 노릇하게 구워져 씹는 맛이 좋았답니다.고기가 듬뿍 들어간 듯 식감이 풍성해서 따끈할 때 먹는 게 제맛이니 초반에 꼭 드셔 보셔요!열무김치는 자극적이지 않아 메인 요리들과 잘 어우러졌어요~시원하고 깔끔해서 중간중간 리프레시용으로 딱이었어요.반찬 가짓수가 저엉말 많더라고요... ㄷㄷ하나씩 맛보다 보니 밥이 금세 줄어들었답니다.​​나물들의 종류도 어마어마했는데, 모두 정성껏 무쳐낸 맛이었어요.산나물은 사장님이 직접 채취하신다고 하셔서인지 싱그러움이 입안 가득 퍼지더라고요~다양한 나물 덕분에 밥 없이도 먹을 게 많았어요. :)속리산 맛집에서만 느낄 수 있는 특별한 구성인 듯해서 대만족!​도라지회는 달큰하고 아삭했어요.입맛 돋우는 데 제격이라서 자꾸만 손이 가던 맛이랍니다. ㅎㅎ김부각은 바삭하고 고소해서 간식처럼 집어먹기 좋았어요.아이들도 좋아할 만한 맛이더라고요.​된장찌개는 자극적이지 않고 진한 편이었는데요~ :)직접 담근 장의 맛이 그대로 느껴져서 바닥까지 비우게 되었어요.​묵은 탱글탱글한 식감이 좋았어요.간장 양념도 간이 알맞았답니다.전체적으로 짜지 않아서 어르신들도 좋아할 만한 맛이에요!조기구이는 적당히 익혀 주셔서 살이 촉촉했어요.비린내 없이 깔끔하게 구워져서 사장님 요리 실력에 감탄하게 되더라구요. ㅎㅎㅎ​고추쌈장무침은 톡 쏘는 맛이 중간중간 입맛을 살려줬어요!반찬 중 의외로 젓가락이 자주 향하게 되던 아이랍니다. :)​도라지튀김은 색다른 메뉴였는데요~바삭한 튀김옷과 안의 향긋하면서도 오독오독 씹히는 식감이 잘 어우러졌어요.​4. 메인 음식들홍어찜은 질기지 않고 부드러웠는데요.특유의 향이 너무 강하지 않아 부담 없이 먹기 좋았어요.못 드시는 분들도 도전해 보실 만한 느낌...!소스가 촉촉하게 적절히 배어 있었고, 밥과 함께 먹으면 별미였답니다.​불고기버섯전골은 이 집의 중심 요리로, 한 상의 무게감을 단단히 잡아 주더라고요...!커다란 냄비에 끓여내는 전골에는 소고기와 여러 종류의 버섯이 가득 들어 있었고, 국물은 맑으면서도 깊었어요.양념이 과하지 않아 재료 본연의 맛이 살아 있었고, 은근히 배어드는 단맛이 입안에 오래 남았답니다!​특히 버섯들이 씹을 때마다 다른 식감을 주어 먹는 재미가 있었는데요~마지막에 따끈한 국물에 밥을 말아 먹으니 속이 따뜻해지고, 산속에서 먹는 듯한 포근함이 느껴졌어요!마무리까지 갓벽했답니다. ㅎㅎ​5. 속리산 맛집 총평속리산 맛집을 찾으시는 분들은 경희식당은 한 번쯤 들러볼 만한 것 같아요!화려하거나 과장되지 않았지만 확실히 기억에 남는 식사였답니다.할머니의 손맛이 살아 숨 쉬는 듯한 반찬 하나하나와 부담 없는 양념, 그리고 직접 재배한 재료들까지...!식사를 마치고 나오는 길엔 마음도 속도 편안하더라구요~ :)다시 속리산에 갈 때 다시 가고 싶은 곳이에요. ㅎㅎ그럼 여기서 이만 후기를 마칠게요!50m© NAVER Corp.더보기/OpenStreetMap지도 데이터x© NAVER Corp./OpenStreetMap지도 컨트롤러 범례부동산거리읍,면,동시,군,구시,도국가경희식당충청북도 보은군 속리산면 사내7길 11-4예약#보은맛집#속리산맛집#법주사맛집#속리산법주사맛집​",20250522
보은 법주사 맛집 신토불이 약초식당 속리산버섯전골 후기,"​​​충북 보은 법주사 맛집신토불이 약초식당​​​​산​에서 버섯을 캐온 날에는 얼큰한 버섯찌개가 저녁상에 올랐다. 고추장을 푼 얼큰한 국물에 비계 섞인 돼지고기, 자연산 버섯이 듬뿍 들어간 버섯찌개는 어디에서도 맡아본 적 없는 독특한 버섯 향이 진동했다. 날씨가 쌀쌀해지면 뜨끈하게 끓여 낸 버섯전골이 생각났다. 울긋불긋한 단풍이 아름답게 물드는 가을 산 보은에 약초산채버섯정식을 전문점으로 하는 맛집이 있다고 해 오랜만에 보은 속리산에 자리한 법주사를 찾았다.​​​​​​​속리산 향토음식거리, 솔향미가가 뭐야?​아름다운 속리산 세조길과 법주사 맛집이 모여있는  향토음식거리 솔향미가는 속리산면에서 지역 경제의 활성화를 목적으로 추진했다고 한다.솔향미가 : 솔 향을 품은 맛 거리.​​​​​수확의 계절답게 속리산 맛거리는 먹거리로 풍성했다. 노상에 펼쳐진 각종 버섯과 나물은 물론이고 지역 특산물인 보은 대추는 미니 사과 크기를 가져 아주 탐스러웠다.​​​​​​​​보은의 맛을 알리는 향토음식점으로 지정된 신토불이 약초식당은 속리산 사내리 음식거리 사이에 자리 잡았다. 빨간 간판 사이 특허라는 말이 눈에 들어왔다. 법주사 맛집은 많은 메뉴 중에서도 특허받은 45첩 약초밥상이 유명하다고 한다.​​​​​​야외 테이블​​​​실내 컨디션​​​​매장이 아주 크고 넓었다. 100명은 넘게 수용할 수 있다는 신토불이 약초밥상은 야외 테이블석까지 합하면 족히 200명은 앉을 수 있을 것 같았다.​​​​조그마한 글씨 '수고했어, 오늘도'​​​​홀뿐만 아니라 프라이빗 한 룸도 마련되어 있었으니 보은 맛집은 아주 크고 넓었다.​1993년 개업 후 속리산 터줏대감으로 오랜 세월 자리를 지킨 보은 맛집은 우리 땅에서 나는 것들이 사람에게 제일 좋다는 생각으로 몸에 좋은 약초를 더하고 체질에 맞게 차려냈다고 한다. 그래서 신토불이의 한상은 보기만 해도 건강했다.​​​​세월이 더해져 쌓인 노하우는 약초 한정식은 2종의 특허까지 받게 했고 입소문이 났다. 더덕구이부터 비빔밥, 올갱이국, 파전 다양한 음식을 판매하고 있었지만, 이왕 속리산 법주사 맛집까지 왔으니 특허 인증 받은 약채산채버섯정식을 먹어보고 싶었다.​​​​​​​대표 메뉴 🌿약초산채버섯정식​​​​​​​​​​​​​​45첩 약초 밥상​특허받았다는 약초산채정식을 주문하면 임금님 수라상 부럽지 않은 건강밥상이 차려진다. 테이블 두 개를 이어야 다 올릴 수 있는 45첩 반상은 우리 땅에서 난 나물과 약초, 버섯으로 만들었다.​이곳의 반찬들은 보면 재료의 정체가 심상치 않다.​일반적으로 쉽게 볼 수 없는 아카시아꽃, 대추나무의 새순, 잔디싹, 산초, 머위잎 등으로 장아찌를 담그거나 자극적이지 않게 나물로 무치셨다. 향토음식 전문점이라는 타이틀에 맞는 담백하면서 건강한 밥상이다.​​​​​​산채음식 했을 때 더덕구이와 버섯전골이 빠지면 섭섭했다.산에서 나는 고기라는 더덕을 양념해 구우면 그 어떤 고기 뺨치게 부드럽고 감칠맛이 돌았다. 영양면에서도 훌룡했다. 가을철 더덕은 그 뿌리부터가 굵직하니 맛깔스러웠다.​​​​​매일 아침 국내산 재료를 엄선해 만드신다는 약초밥상은 손수 재료를 채취해 직접 장아찌로 만들어 오래 묵혀 두셨을 장아찌 반찬이 많았다. 속리산버섯전골 뿐만 아니라 한상에 사장님의 세월과 정성이 묻어있는 것 같아 반찬 하나하나 모두 귀하게 느껴졌다.​​​​​​​​​깻잎장아찌와는 또 달랐던 맛, 머위잎으로 만든 건 이런 맛이구나. 들깨 부각은 이런 고소함이 있었다, 아카시아꽃의 향긋함이 감도는 장아찌는 신기함이 있었다. 다양한 버섯으로 만든 반찬과 나물을 종류별로 즐기기 좋은 보은 법주사 맛집이었다.​​​​​​그렇다고 나물과 약초만 있는 건 아니었으니, 45첩 반상뿐만 아니라 메인 메뉴도 존재했다. 상다리가 부러진다고 표현될 정도로 건강했던 반찬들은 눈을 휘둥그레지게 만들었지만 잊지 말아야 할 것. 보은 법주사 맛집이라는 이곳의 주메뉴는 속리산버섯전골이었다.​​​​​​신토불이 버섯전골​고춧가루가 들어가 빨갛게 끓여낸 국물이 맵지는 않을까.자연의 보양식이라는 버섯이 종류별로 들어간 버섯찌개는 무와 야채가 푹 우러나 맵키는 커녕 시원하기만 했다. 버섯불고기와 더덕구이, 기본 밑반찬의 맛처럼 버섯전골 역시 자연의 맛을 고스란히 살려 담백하면서도 속이 편안해지는 맛이었다.​​​​​​후식으로 솔잎차를 주셨다. 솔잎을 청으로 담가 내주신 솔잎차는 달큼하면서 진한 솔잎 향이 인상적이었다. 마지막까지 건강함 그 자체였다.​​​​​0초0초광고 후 계속됩니다.다음 동영상subjectauthor취소보은 법주사 맛집 신토불이약초식당 속리산버섯전골 후기재생36좋아요0좋아요공유하기재생 (space/k)재생00:230:00:00재생 (space/k)재생음소거 (m)음소거00:00/00:23실시간설정전체 화면 (f)해상도HD720p자막사용 안함재생 속도1.0x (기본)해상도1080pHD720pHD480p270p144p자막설정사용 안함옵션글자 크기배경색재생 속도0.5x1.0x (기본)1.5x2.0x죄송합니다. 문제가 발생했습니다. 다시 시도해 주세요.도움말음소거 상태입니다.도움말라이센스고화질 재생이 가능한 영상입니다.설정에서 해상도를 변경해보세요.더 알아보기00:00접기/펴기보은 법주사 맛집 신토불이약초식당 속리산버섯전골 후기보은 법주사 맛집 신토불이약초식당 속리산버섯전골 후기#보은맛집#보은법주사맛집#법주사맛집#속리산맛집#속리산버섯전골#신토불이약초식당​​단풍으로 물든 산새와 기암이 어우러진 절경을 바라보며 이리저리 부딪히며 흐르는 시냇물을 벗 삼아 걷다 보면 법주사에 닿는다. 유네스코에 지정된 문화유산을 구경하며 마음을 고요하게 했던 목탁소리와 은은한 절향은 고즈넉한 가을여행지로 좋은 곳이었다. 다람쥐가 뛰노는 세조길을 걷다가 허기진 배를 기분 좋게 채워줄 법주사 맛집으로 신토불이약초식당 추천드린다.​​​신토불이약초식당충청북도 보은군 속리산면 법주사로 268충북 보은 신토불이 약초식당충북 보은군 속리산면 사내리 343-6043-543-0433​영업시간매일 08:30~21:00​✔️POINT단체 이용 가능주차장 완비약채산채비빔밥/약채산채정식 전문향토음식 대회 금상 수상산채정식 특허 음식점​",20231013
보은 속리산 석정식당 블루리본 산채더덕정식 방문후기,"몇 년 만에 다시 찾은 속리산. 서울에서 부랴부랴 출발해 도착하니, 어느덧 점심시간이라 음식점을 검색했는데요. 와중에 딱 하고 눈에 들어온 곳이 있어, 바로 다녀왔답니다. 바로 지난 주, 부산에 다녀왔던 것 과는 다르게 이곳은 계곡들 사이로 휴가를 즐기던 분들이 참 많이 계셨어요.​목적지에 도착하자마자 멀리서 부터 보이는 블루리본 표기. 30가지 반찬이 제공되는 산채더덕정식으로 유명한, 보은 속리산 석정식당 입니다. 하지만, 기대와는 다르게 나왔을 때, 참 많이 당황스러울 수 밖에 없었는데요. 직접 다녀온 후기 하나하나 풀어보도록 할게요.석정식당​주소​충북 봉른군 속리산면 법주사로 272 1층 석정식당​운영시간​매일08:00~22:00​전화번호​043-543-3656​주차장에서 부터 5분 정도 걸어들어오면, 우체국 바로 옆에 바로 자리했답니다. 앞서 언급했던 것 처럼, 2025 블루리본 선정 표기가 떡 하니 붙어 있었으며, 하나의 증표로도 잘 인정되고 있는 만큼 어떤 곳일지 무척이나 궁금해지는 와중이였어요.​바로 들어갔는데, 드문드문 자리가 있어 자리를 잡는데는 어렵지 않았구요. 각종 정식을 드시는 분들 부터, 단품메뉴를 시켜 허기를 달래던 분들까지 다양했답니다. 저희는 본래 목적인 산채더덕정식을 가장 먼저 주문. 일단 더위부터 달래기로 했습니다.손님분들께서 조금 빠져나가시고 가까스로 메뉴판과 식당 내부를 촬영할 수 있었습니다.​사실, 말이 30가지 반찬이지 이게 어떻게 이 가격에 가능한거지? 라는 생각이 떠나질 않았는데요.​그러던 찰나, 반찬이 저희가 앉은 테이블에 깔리는데 채 5분도 걸리지 않았답니다.이렇게 모든 반찬들이 깔렸습니다. 보고 이게 공기밥 한개로 감당이 될까? 라는 생각이 절로 들 만큼 테이블이 꽉 찼는데요. 잠시 위에 올려뒀던 스마트폰을 올릴 공간도 부족해 부랴부랴 채웠답니다. 자연스레 눈이 휘둥그레 지는 것은 순리였어요.​밥을 최대한 뒤로 둔 채, 우선 반찬 하나하나를 먹어보기 시작합니다.​하지만, 생각보다 의아한 점과 불만족 스런 상황들이 참 많았는데요. 우선, 뒤늦게 다른 분들이 올려주신 포스팅들을 살펴보니, 더덕구이가 서빙되지 않았다는 것을 알게됐어요. 구석에 담긴 반찬 하나가 이건가? 싶어 다른 질문을 드리지 않았는데, 너무 부주의했다 싶었습니다.중간에 놓인 굴비 두 마리와 된장찌개에 들어간 애호박이 그래도 참 맛있었습니다. 이것만 두고 밥을 다 먹어도 되겠다 싶을 정도로 말이죠.​허나, 명이로 보이던 나물은 지나치게 짰고, 오이피클에서 느껴지는 오이 특유의 쓴맛이 고스란히 느껴져 매우 당황스러운 상황이 계속됐습니다.​분명 다른 분들은 만족스런 식사를 마치신 것 같았는데, 이곳까지 친히 운전을 해서 같이 온 동행에게 미안하다는 생각이 많이 들었어요.그래도 조금 괜찮지 않을까? 하며, 중간에 담긴 저 더덕을 먹어보려 노력했으나, 결국 반찬 대부분을 남기고 식당을 나설 수 밖에 없었답니다. 보은 하면 버섯전골과 다른 음식들도 괜찮았던 것 같은데, 지금생각해도 상당히 의아한 상황이였답니다.​맛집 판단의 가늠좌, 블루리본이 딱 하고 붙어 있어, 괜찮을까? 싶어 다녀왔으나 그렇지 못했던 곳. 다음부턴 이곳에 다른 식당을 가보면 단품 메뉴로 배를 채우지 않을까 생각되네요.​이상 제가 직접 돈 주고 다녀와서 남겨본 석정식당 후기였습니다. 참고만 해주셨으면 좋겠네요!50m© NAVER Corp.더보기/OpenStreetMap지도 데이터x© NAVER Corp./OpenStreetMap지도 컨트롤러 범례부동산거리읍,면,동시,군,구시,도국가석정식당충청북도 보은군 속리산면 법주사로 272 1층 석정식당​",20250818
25년 6월 보은 2박 3일 | 고릴라 캠핑 인 속리산 (애견 동반),"​영월에서 작은 텐트로는 더 이상 안되겠다는 생각을 하고, 텐트를 보러가서 리빙쉘 대형 텐트를 질러버렸다..! 생각보다 가격이 괜찮아서 뽕 뽑을 생각으로 질러버림! 몰라 사버려!​그리고 텐트 개시할 겸 6월에 캠핑을 또 갔다. 이번에는 보은, 속리산으로.​고릴라 캠핑을 자주 방문하는데, 여기서 운영하는 캠핑장이 있더라구. 캠핑장도 엄청 크고 근처에 속리산 명소들도 많아서 여행 겸 가기 좋을거 같아서 예약했다.​가장 좋았던 점은,, 샤워실이 칸막이랑 방수천으로 분리가 되어있다는 점! 깨끗하고 시설 관리가 잘 되어 있었다. 물론 여기도 애견 동반 가능 😆​가는 길에 앙금의 배변을 위해 공원을 잠시 들렀다. 진천 종박물관이었는데, 주차장도 크고 미술관도 있고 이것저것 많아서 다들 구경할 겸 쉬어가는거 같았다. 우리는 안에는 못들어가서(강아지가 있어서) 밖에만 산책하고 구경했다.​진천종박물관충청북도 진천군 진천읍 백곡로 1504-12 진천종박물관​이번엔 운좋게 보은 오일장과 날짜가 딱 맞아서 캠핑장 체크인 전에 오일장 먼저 방문했다. 근데 영월 오일장을 생각해서 그런지.. 보은 오일장은 너무 주민들 장보는 느낌의 장이라서, 관광객은 구경할게 없더라!​​그냥 쭉 구경하고, 유명하다는 보은 대추 닭강정을 포장해왔다. 배고픈 우리,, 어떻게 먹을까 하다가 트렁크에서 먹기로 했다 ㅋㅋ​​트렁크 열어두고 앉아서 냠냠​​그러고 무사히 캠핑장 체크 완료! 이 날은 해가 너무 뜨거워서 타죽는줄 알았다. 고릴라인속리산 캠핑장은 도로 바로 옆 평지라 바람불거나 춥거나 그런 이슈는 없었다.​화장실, 샤워실, 세척실 등 편의 시설도 곳곳에 잘 배치되어 있고 캠지기 사장님도 친절하시다. 그리고 반려견 데리고 온 집이 되게 많았다.​​첫 대형 텐트라 치는데 엄청 버벅거렸다. 앞 뒤 반대로 치고, 메인폴과 서브폴 바꿔 넣고~ 두시간은 낑낑 거린듯. 땡볕이라 너무 더워 죽는줄 알았다.​​겨우 겨우 친 우리의 뉴 텐트, 70만원대의 아웃코스 피크스타 텐트다. 그리 비싼 텐트는 아니지만 천고도 높고 창문도 많아서 매우 쾌적했다. 텐트랑 함께 의자도 아베나키로 바꾸고, 아베나키 박스도 하나 장만했다. 그럴듯 하네!​​배고픈 우리는 이른 저녁을 먹었다. 야무지게 고기 구워먹음! 장작은 매점에서 샀다.​​앞에 산책로도 있어서 앙금이 저녁 산책을 시키고, 일찍 잠에 들었다. 우리는 다음날도 아침부터 나갈 생각이었기 때문에,, 그리고 먼 길을 내려와서 꽤 피곤했다.​​그리고 다음날! 속리사하면 유명한 법주사로 먼저 가본다. 법주사 주차장은 캠핑장에서 5분도 채 안걸린다. 사실 코 앞이라 그냥 걸어가도 될 거리다 ㅋㅋㅋ.. 그걸 알았으면 차두고 걸어가는건데..​주차 요금이 5000원! 법주사 입장료는 없음! 근데 반려견 동반 불가라서 법주사 들어가기 전 공원만 돌고 나왔다. 공원도 커서 우리 강아지는 신나했지만 사람은 법주사 못가서 쪼금 아쉬웠다..​​공원을 돌고 해가 너무 뜨거워 잠깐 캠핑장을 들렀다. 너무 더워서 무리하지 말고 쉬면서 돌아다니기로 했다.​​점심은 남은 고기에 비빔면~​​강아지는 낮잠으로 재충전하고!​​이번에는 정이품송을 보러간다. 정이품송도 캠핑장이랑 진짜 가깝다. 차타고 10분도 안걸리는 위치에 있다. 정이품송 옆 주차장에 주차를 하고 걸어가본다. 사실 정이품송 나무는 캠핑장 오는 길에 차에서도 보였지만 (도로 바로 옆에 있음) 그래도 설명도 읽어보고 찬찬히 보고 싶었다.​​교과서에서나 보던 정이품송이 너구나! 몇백년을 이 자리에 있었다는게 놀랍다. 그 오랜 세월동안 엄청나게 많은게 변했고, 그걸 봐왔을텐데 그 기분이 어땠을지.​​세월이 지나 대칭이던 모양이 이제는 비대칭에 가지도 조금 적어졌다.​정이품송 주차장은 생각보다 넓고 그늘도 많아 주차해놓고 의자펴고 여유를 즐기능 사람들이 많았다. 이런줄 알았으면 우리도 의자 가져올걸~​​다음으로 가볼 곳은 말티재! 꼬불 꼬불한 길 전경으로 유명한 곳이다. 주차하고 전망대로 올라가면 말티재가 한 눈에 보인다. 몰랐는데 하루에 100명 정도 무료 입장을 시켜준다. 들어가는 입구에 무료입장 카운트가 되고 있음!​말티재 전망대충청북도 보은군 장안면​전망대 안 카페는 대추차를 팔아서 아이스 대추차를 사마셔봤다. 완전 진하고 맛있었다! 전망대 바깥 무대에서는 밴드어르신들이 멋진 공연도 한다. 여러모로 흥나고 재밌었던 곳이었다.​​우리는 보은 시내에 들러 저녁에 먹을 순대국을 포장해가기로 했다. 그래서 진짜 말티재를 직접 운전해서 내려갔다.​음.. 보는건 예쁘지만 운전은 쉽지 않아.​​우리가 포장할 순대전골은 보은 시내에 위치한 김천 식당. 블루리본도 받은 유명한 곳이다. 포장은 입구 왼쪽에 말하면 바로 해준다.​김천식당충청북도 보은군 보은읍 삼산로1길 25-4​주차 자리는 없어서 근처에 눈치껏 대야한다. 우리는 어떤 휴무인 병원 앞에 댔는데, 보니까 병원 입구 천장에 제비가 둥지를 틀어 아기제비들이 울고 있었다. 실제로 제비 둥지를 본건 처음이라 신기하고 우는 아가들이 귀여웠다 ㅠㅠ​​숙소로 돌아와, 순대전골을 끓여본다.​​진하고 맛있었던 순대전골. 밥 한공기 뚝딱 할 수 있는 맛이었다. 술도 술술 들어가는 맛 😋​​여전히 불멍은 빠질 수 없구요.​​다음날엔 정리를 하고 바로 집으로 달렸다. 너무 더워져서 사실상 상반기 마지막 캠핑!​둘이 모해​",20250914
