title,content,date
"제주 갈 때 가보는 청주(오송, 오창, 청주 도심 맛집들)","이사 후로 제주 딸 집에 갈 때 청주 공항을 이용한다.평소 자차 아닌 경우 오송역도 종종 이용한다.​그럴 때면 청주를 가보며 혹은 그 외 가보기도 한다.처음에는 오송과 오창이 헷갈렸다.오송은 오송역이 가깝고, 오창은 청주공항이 가깝다.그럴 때 가보았던 오창, 오송 맛집들이다.오송브런치카페 아일(마당 이쁜 야외카페)직은 섬 같은 오송 아일의 홈쿡 스타일이 반갑다 10년 넘게 가꿔온 꽃나무와 잔디밭에 담장도 주인장의 손...blog.naver.com야외 정원이 정갈한 오송 브런치 카페 아일이다.오랜 기간 주인장의 손길 닿은 정원이다.​​오송 맛집, 부드러운 숙성고기 한마음 정육 식당(오송역 근처)한 달 전 외국에서 오빠 부부가 방학 이용해 왔었다. 오빠 부부는 바쁜 일정으로 한 달이 후딱 지나 아쉬웠...blog.naver.com오송 한마음 정육 식당 주인장이 솔선수범이다,더불어 직원들도 부지런하다.​​오송맛집 오봉집 청주오송점 점심 특선(오송역 근처)오송역 근처인 오송맛집 오봉집을 갔다. 청주오송점으로 도로변이라 찾기 쉬웠다. 점심특선, 38년 어머니의...blog.naver.com(고객을 배부르게)사훈에 실속과 핵심을 잘 잡았다.오송 오봉 집 사훈 아래 문구도 반갑다.​​오송 중국집 아리 대반점(유산슬 맛집)오송 중국집, 오송 짜장면, 오송 짬뽕 아리 대반점 간판이 상징하고 있다. 오송 중국집 아리 대반점을 명함...blog.naver.com중국집이 빠지면 아쉽다.아리 대 반점은 오송 유산슬 맛집이다.​​오창맛집, 청주공항맛집 두심온 가보다(두부 틀)직접 만든 순두부로 맛있는 한 끼 오창맛집 청주공항맛집 두심온 상징이다. 이른 시간 가서인지 넒은 주차...blog.naver.com공항 근처 오창 맛집으로 유명한 두심온이다.​​동남지구맛집 청주 차산(자개 인테리어)청주는 주로 제주 갈때 청주공항 이용하느라 가곤 한다. 청주 동남지구는 처음 가보았다. 청주동남지구맛집...blog.naver.com자개 인테리어가 멋진 차산이다.작은 냄비 안에 최대한 다양하게 넣었다.​​개신동 충북대 맛집 삼식당 갔던 날충북대 고기집 충북대 맛집 소문난 삼식당 가로와 세로 간판에 소개 핵심을 담았다. 저녁에는 고기를 주로 ...blog.naver.com주인장의 반찬 솜씨도 한몫한다.​​청주 산남동 맛집 시오야끼 가보다(특제 간장소스)청주 산남동 맛집 기와지붕 인테리어와 붓글씨 글씨체 간판이다. 청주 산남동 맛집 시오야끼 간판을 서로 ...blog.naver.com정갈한 메뉴판이 그동안 다녀본 식당 중에 으뜸이다.​​청주 율량동 맛집 회전초밥 스시 히어로(청주대 근처)꽃샘추위 꽃샘바람 불던 날 회전초밥 집을 갔었다. 그날에 비하면 요즘은 봄이 성큼 와 제주부터 전국이 이...blog.naver.com초밥을 즐기지만 회전 초밥집은 처음 가보았다.다양한 메뉴를 감상하듯 맛본 날이다.​​청주캠프닉, 그랜드 바베큐 가보다(불멍, 물멍, 반려견도)야외에서 애견동반 가능한 그랜드 바베큐 간판도 시원스럽다. 먼저 혹심, 궁금증에 이용안내를 읽어본다. ...blog.naver.com아이들 있는 집에 나들이 삼아 권해본다.그랜드 바비큐는 자유로운 야외 놀이로 먹거리와 즐겁다.​​청주오송 맛집 보드람치킨 청주오송점 (전용 압력튀김기)청주 오송하면 가끔 이용하는 오송역만 연상했다. 보드람 치킨 탄생이 2001년이다. 20년이 넘은 보드람치킨...blog.naver.com보드람 치킨은 이름처럼 유독 마음에 드는 집이다.오송역으로 아들 군 휴가 마중 나간 날 다시 한번 갔었다.아들도 맛나다며 좋아했다.50m© NAVER Corp.더보기/OpenStreetMap지도 데이터x© NAVER Corp./OpenStreetMap지도 컨트롤러 범례부동산거리읍,면,동시,군,구시,도국가보드람치킨 청주오송점충청북도 청주시 흥덕구 오송읍 오송생명8로 178 상가동(아파트 후문 농부마트 앞) 2동 108호​50m© NAVER Corp.더보기/OpenStreetMap지도 데이터x© NAVER Corp./OpenStreetMap지도 컨트롤러 범례부동산거리읍,면,동시,군,구시,도국가아일충청북도 청주시 흥덕구 오송읍 쌍청2길 8 101호예약​",20250808
"[청주 오송1산단 ‘스시88’] 깔끔 가성비 평일런치 10,000원... ","청주 오송 ‘스시88’<▼위치 및 영업정보▼>✅ 위치-  충북 청주시 흥덕구 오송읍 오송생명로 161 103호 (오송호수공원 근처)✅ 영업시간- 월~금 11:30 - 21:00 (15:00 - 17:00 브레이크타임)- 토 11:30 - 21:00- 일요일 정기휴무✅ 연락처- 0507-1342-6588✅ 주차정보- 주차장 따로 없어서, 가게 근처 도로변에 해야함청주집 들렸다가 점심 먹으러 간, 오송호수공원 근처 ‘스시88‘내돈내산 만족하고 온 후기☺️깔끔한 외관주차장은 따로 없어서, 가게앞에 도로에 해야한당민생회복지원금도 사용가능~!정갈한 인테리어평일 점심시간에 방문 했는데, 직장인분들이 많이 계셨다.<▼메뉴판▼>이날은 과하게 먹고싶지 않아서,, 런치스시(8p) 주문 !10,000원이라는 아주 가성비 있는 가격💯평일 점심에 가볍게 먹기 딱 좋군요​(다른 블로그글에서는 ‘런치스시’ 평일 점심에만 되는걸로 메뉴판 사진을 봤는데, 이젠 주말도 되는건지...? 싶다.토요일에도 ‘런치스시’ 되는지는 가게에 여쭤보시고 가시길 추천)셋팅런치세트는샐러드, 우동, 초밥 구성이다.먼저나온 샐러드, 우동 !샐러드에 흑임자소스 + 시리얼 맛있네유👍🏻우동도 호로록광어, 연어, 양파연어, 초새우, 한치, 생새우, 계란, 유부딱 먹기좋은것들로만 구성되어있당‼️회도 크고 싱싱 쫄깃쫄깃함 ㅎㅎ회친자로써 인정합니다.. (내가 뭐라고 인정 ㅠㅋㅋㅋㅋㅋ)​남자분들한텐 부족할 수 있는 양이긴 한데,만원에 가성비 있게 먹는걸로 생각하면 좋을 듯 싶네용~재방문의사 100%오송에서 초밥 먹고싶을때 또 와야지 !<▼위치 지도▼>50m© NAVER Corp.더보기/OpenStreetMap지도 데이터x© NAVER Corp./OpenStreetMap지도 컨트롤러 범례부동산거리읍,면,동시,군,구시,도국가스시88충청북도 청주시 흥덕구 오송읍 오송생명로 161 103호​-#청주스시#오송스시#오송점심#오송회식#오송역맛집#오송역점심#오송역주차장#오송역카페#청주데이트#청주데이트코스#청주점심#오송역시간표#오송호수공원#오송역식당#오송역주차",20250807
오송곱창맛집 청주오송곱창맛집 청주오송곱창 벽돌곱창 오송점... ,"안녕하세요~~오송2산단에 맛집이 점점 늘어나고 있는데요~그 중에서도오송곱창맛집 청주오송곱창맛집 청주오송곱창 오송역맛집 으로 유명한벽돌곱창에 드디어 가보게 되었습니다!​지인이 가족들과 갔다가집안 기둥 뿌리가 뽑힐 뻔 했다고 할 만큼너무 맛있었다고 해서 궁금했는데저도 드디어 가봤습니다!ㅠㅠ​그 후기 시작합니다~~50m© NAVER Corp.더보기/OpenStreetMap지도 데이터x© NAVER Corp./OpenStreetMap지도 컨트롤러 범례부동산거리읍,면,동시,군,구시,도국가벽돌곱창 오송점충청북도 청주시 흥덕구 오송읍 오송생명12로 48 102호, 103호 벽돌곱창 오송점예약​매장 외관오송2산단에 식당들이 많은 먹자골목에 있어요.그래도 왕복 4차선 도로에 있어서 잘 보여요~​메인 메뉴는#한우특대창#칼비빔면#한우육회#사장밥인가봐요~그리고 모든 테이블에#육회와#순두부찌개가 서비스로 제공된대요~영업시간 16시~24시주말 14시~24시연중무휴​매장 내부#벽돌곱창의 매장 내부는 이렇게 되어 있어요.벽돌로 인테리어 된 부분이 특이하죠?ㅎ오픈런 했는데 벌써 오신 손님이 있어서특별한 인테리어 부분은 사진을 별로 못 찍었어요ㅠㅠ​메뉴<고기류>한우 곱창모둠 250g(곱창, 대창, 막창, 염통) (2인 이상)25,000원한우 특곱창 250g24,000원한우 특대창 180g18,000원한우 염통구이 150g14,000원소막창 160g19,000원특양 160g19,000원한우 2+ 육회 160g20,000원곱창전골 中38,000원​<식사류, 주류>볶음밥4,000원치즈 추가3,000원오징어 김치 칼국수5,000원사장밥7,000원순두부 추가2,000원라면(신라면, 진라면, 너구리, 안성탕면)4,000원소주4,500원맥주5,000원청하6,000원음료2,000원​네이버 플레이스에 리뷰를 쓰면#오징어김치칼국수#칼비빔면#볶음밥이 무료래요!이 세 가지 다 먹어보고 싶은데 어떡하죠?ㅠ ㅎㅎㅎ​아기의자랑 담요도 있고,불쇼를 요청하면 해준다고 하시네요!와우 ㅎㅎ 저는 아이가 같이 있어서 불쇼 요청 안 했어요 ㅋ​테이블 옆에 선반이 있어서머리끈, 오프너, 폰 충전기 등등이 있는 점도 좋았어요.​음식기본 반찬으로는#대파김치#콩나물무침#숙주장아찌가 나와요.셋 다 곱창이랑 먹으면 너무 맛있을 것 같은거예요!!그래서 곱창이 오기 전까지 손도 안 대고 있었어요 ㅎㅎ(맛의 조합은 소중해..)​그리고 서비스인#순두부찌개가 나왔어요.뚝배기 한가득 보글보글 끓어서 나왔어요~계란도 같이 들어가 있어서곱창을 먹고 식도와 위에 붙은 고기기름을순찌 국물로 씻어내주는 느낌이었어요 ㅋㅋ​쪽파 한가득과 청양고추, 양파가 들어가있는개인간장도 그냥 먹어도 맛있었어요~​그리고 저희는아이가 있어서 서비스로 주먹밥을 주셨어요~김가루도, 날치알도 이렇게나 많이 주시다니..혜자스럽다 정말...사장님께 ""아이가 먹을 수 있게 덜 매운 사장밥 해주실 수 있나요?"" 했는데제대로 된 음식이 아니면 내놓지 않는다는 철칙이 있으셔서주먹밥을 해주셨어요.감사합니다ㅠㅠ사장님 덕분에 아이가 너무 잘 먹었어요~~​그리고 저희가 주문한#한우곱창모둠과#특곱창이 나왔어요.이미 거의 조리가 되서 나온 상태라염통이랑 곱창은 바로 먹어도 되고,대창과 우삼겹, 채소들만 익혀서 먹으면 된다고 하시네요.0초0초광고 후 계속됩니다.다음 동영상subjectauthor취소오송곱창맛집 청주오송곱창맛집 청주오송곱창재생1공유하기재생 (space/k)재생00:110:00:00재생 (space/k)재생음소거 (m)음소거00:00/00:11실시간설정전체 화면 (f)해상도자동 480p자막사용 안함재생 속도1.0x (기본)해상도자동 (480p)1080pHD720pHD480p270p144p자막설정사용 안함옵션글자 크기배경색재생 속도0.5x1.0x (기본)1.5x2.0x죄송합니다. 문제가 발생했습니다. 다시 시도해 주세요.도움말음소거 상태입니다.도움말라이센스고화질 재생이 가능한 영상입니다.설정에서 해상도를 변경해보세요.더 알아보기00:00접기/펴기오송곱창맛집 청주오송곱창맛집 청주오송곱창오송곱창맛집 청주오송곱창맛집 청주오송곱창#오송곱창맛집#청주오송곱창맛집#청주오송곱창​찍어먹는 소스도 콩가루/매콤소스/기름장 이렇게 세 가지 종류나 나왔고,반찬들도 구워서 함께 먹을 수 있고, 개인 간장에 찍어서도 먹을 수 있어서맛의 조합이 다양해서 골라 먹는 재미가 있어요~그냥 곱창만 먹어도 맛있는데, 이렇게 저렇게 조합해서 먹으니 더욱 맛있는거 있죠!​대창도 기름에 바삭바삭 잘 구워서 먹으면대창 안의 기름은 꼬숩꼬숩바깥의 껍질은 바삭바삭 쫄깃쫄깃어찌나 맛있던지요~~​진짜 정신없이 먹다가 ""아참! 사진 찍어야지!""해서 뒤늦게 올려보는 전체 풀샷..ㅠ사장님이 중간중간 와서 너무 타지 않게 관리해주셨고,식빵도 한 조각 넣어서 기름이 너무 많아지는 것도 막아주셨어요.​식사가 거의 끝나갈 즈음에는 육회 서비스도 주셨어요.신선한 육회를 조물조물 양념해서 주셔서  편하게 먹을 수 있었어요~같이 주신 부추도 어찌나 신선한지!!​식사 후에는 슬러시도 주시고, 쫀드기도 주셨어요 ㅎ입구 옆에#스너글탈취제도 있으니취향 껏 온 몸에 찹찹 뿌리고 나가셔요~ㅎㅎ​제가 간게 평일 4시 오픈 시간이었는데들어가자마자 다섯 팀 넘게 들어오고,6시가 넘어 저녁식사 타임이 되자 또 손님들이 들어오고,금새 웨이팅도 있는 찐 맛집인오송곱창맛집 청주오송곱창맛집 청주오송곱창#벽돌곱창다음에 또 가서 다른 메뉴들도 먹어보고 싶네요~​",20250807
오송 토속순대국밥 : 오송 순대국밥 청주 오송 맛집,"청주 오송 맛집이자 가성비까지 완벽한 곳으로이미 입소문난오송 토속순대국밥이전에는 포장해서 집에서 먹다가 드디어!매장에 직접 방문해서 곱창전골을 먹고 왔어요.​1층은 국밥전문 / 2층은 곱창전골 전문으로 운영되며,1층과 2층 모두 넓은 홀이 있는 오송 국밥 맛집이라오송역 근처 단체식당을 찾는 분들께도 추천드려요.오송 토속순대국밥충북 청주시 흥덕구 오송읍 오송생명13로 3 1,2층월-토 10:30-21:00 (매주 일요일 정기휴무)브레이크 타임 15:00-17:00/ 라스트오더 14:30 17:30단체이용가능, 포장, 주차, 남여화장실 구분, 유아의자, 주차50m© NAVER Corp.더보기/OpenStreetMap지도 데이터x© NAVER Corp./OpenStreetMap지도 컨트롤러 범례부동산거리읍,면,동시,군,구시,도국가토속순대국밥충청북도 청주시 흥덕구 오송읍 오송생명13로 3 1,2층오송역 근처에 위치한 오송 토속순대국밥은오송역에서도 도보로 10분 정도 거리에 있고,가게 옆 주차장이 있어서 차량으로 방문하기에도편한 청주 오송 국밥 맛집인데요.​지역화폐가 사용 가능한 식당이라이번 민생회복 소비쿠폰사용도 가능하답니다.​1층은 국밥 전용 홀로 운영되고 있어서토속곱창전골을 먹기 위해 방문한 우리는토속순대국밥 건물의 2층으로 올라갔어요.​점심시간이 막 시작되기 전인 오전 11시쯤방문했었고, 12시가 넘어가니 손님들이 계속 오더라고요.홀 내부가 꽤 넓은 덕분에 단체 이용이 가능하고유아의자가 있어서 아기 동반 식사하기에도 좋아요.이번에도 지안이와 함께 방문해서 유아의자 유용했어요 !오송 국밥 맛집 토속순대국밥의 단일메뉴는토속곱창전골로 진한 사골육수에곱창 & 내장과 야채가 듬뿍 들어있더라고요.포스팅을 작성하는 지금은 9,000원이라는가성비 이벤트까지 진행 중이에요.​메뉴고민 없이 토속곱창전골 2인분으로 주문-!​밥, 볶음밥용 김, 당면사리, 야채사리,곱창전골과 곁들여 먹기 좋은 깍두기,양파절임 등 밑반찬들은 셀프바에서직접 가져다 먹을 수 있었어요.​당면러버인 저는 당면사리 추가로 넣었고,깍두기가 적당히 잘 익어서 곱창전골이랑같이 먹기에 너무 잘 어울리더라고요.2인분 치고는 역시나 꽤 많은 양의 곱창전골예전에 포장으로 먹었을 때도 양이 진짜 많아서5인분으로 6명이 먹고도 충분할 정도였는데,이게 인당 9,000원이라니 갓성비가 아닐까 싶어요.​진하게 우려낸 육수 베이스에 매콤한 양념이 더해져얼큰한 맛을 제대로 느낄 수 있는 토속곱창전골고소한 맛과 감칠맛을 더해줄 들깨가루와 마늘,부추에 깨순까지 푸짐하게 들어있더라고요.​테이블 위에서 냄비째로 보글보글 끓여먹기만하면 되는 곱창과 순대 가득 곱창전골인데더운 날씨에 땀 흘리면서 먹기에도 맛있었고,진하고 얼큰한 국물 한 입 떠먹는 순간여기가 오송 국밥 맛집이구나 싶을 거예요.​저는 점심 식사로 방문했지만, 저녁식사를 하러오송 토속순대국밥에 방문한다면 술 한 잔 빠질 수가없겠다 싶을 정도로 맛있는 곱창전골이었어요.​흰쌀밥에 국물만 떠먹어도 맛있고잡내없이 쫄깃한 식감의 곱창과 내장,속이 꽉 찬 순대까지 완벽했어요.​순대국밥이나 곱창전골 특유의 잡내에예민하신 분들도 부담 없이 맛있는곱창전골을 먹기에 좋을 것 같더라고요.​마무리는 역시 케이디저트인 볶음밥으로!쌀밥 한 그릇을 이미 다 먹은 상태였지만볶음밥은 완전히 다른 영역이라고 생각되어자작하게 남은 곱창전골 국물에밥, 참기름, 김치, 쪽파, 김가루를 넣고국자로 잘 섞어주기만 하면 완성된답니다.​청주 오송 맛집 토속순대국밥의 곱창전골마무리는 꼭 볶음밥으로 하는 걸 추천드려요!고소한 김가루와 잘 익은 김치, 곱창전골의풍미까지 완벽한 마무리라 배부른 와중에볶음밥까지 싹 다 먹어치우고 왔거든요 ㅎㅎ청주 오송 맛집 오송역 근처 맛집인 토속순대국밥잡내없이 맛있는 곱창전골을 먹을 수 있어서누구랑 가도 성공적인 오송 국밥맛집이더라고요.무엇보다 1인분 9,000원이라는 가격에 이 모든 걸먹을 수 있다는 점이 큰 장점이라서 가성비까지완벽한 청주 오송 맛집으로 추천드려요.든든한 점심 먹으러 방문하기에도 좋고,술 한잔 곁들일 저녁 메뉴로도 완벽한곱창전골 드시러 꼭 한번 방문해 보세요.저는 이번이 벌써 3번째 방문이라 앞으로도쭉-단골이 될 오송 맛집으로 저장했답니다.​#협찬 #오송국밥맛집 #청주오송맛집 #오송국밥
#오송토속순대국밥 #오송곱창전골 #오송맛집m.blog.naver.com​",20250807
[충북/오송] 토속순대국밥 #청주 오송 맛집,"​오늘은오송 순대맛집!!토속순대국밥에 다녀왔습니다.게시물 작성자가 AI 활용 표시 설정AI 기술을 활용하여 콘텐츠의 이미지, 영상 또는 소리를 변형하였거나 새로이 생성하였을 수 있습니다.자세히 보기AI 활용​위치오송역 인근에 있으니 지도 참고하시면 되겠습니다.50m© NAVER Corp.더보기/OpenStreetMap지도 데이터x© NAVER Corp./OpenStreetMap지도 컨트롤러 범례부동산거리읍,면,동시,군,구시,도국가토속순대국밥충청북도 청주시 흥덕구 오송읍 오송생명13로 3 1,2층​영업시간오픈 10:30마감 21:00브레이크 15:00~17:00​민생회복 소비쿠폰도 사용 가능합니다!역시 청주 오송 맛집은 다르군요.메뉴건강한 음식을 만들고자국내산 사골을 전통방식으로 직접 끓여깊고 진한 육수는 정성스럽게 준비하십니다.​당일 조리, 당일 소진!!청주 오송 맛집이라 자부심이 넘칩니다.​​식당 1층은 순대국밥2층은 전골만 판매합니다.​곱창전골 정가는 11,000원입니다.하지만 마음씨 넓은 사장님께서외식물가 부담을 덜고자 무료 9,000원에 제공하고 계십니다!!청주 오송 맛집으로 인정~~​​​주문 및 결제는 자리에 있는 키오스크에서 가능합니다!가게 분위기화장실과 세면대는 가게 밖에 위치하고 있습니다.세면대가 밖에 있어서 밥 다먹고 입을 행구기 좋더라구요~​​내부는 널찍하고 깔끔합니다.1층은 국밥만, 2층은 전골만으로 분리가 되니깐더욱 깔끔하게 느껴집니다.​​​밑반찬밑반찬은 셀프입니다밥과 당면, 볶음밥 재료도 셀프~!​​저희는 양파&오이 장아찌와 깍두기를 담아왔습니다.너무 짜고 달지 않아서 순대전골과 어울리는 밑반찬입니다.순대전골(1인 9,000원)잠깐 기다리니 전골이 나왔습니다~~​​​​0초0초광고 후 계속됩니다.다음 동영상subjectauthor취소순대재생0좋아요0좋아요공유하기재생 (space/k)재생00:070:00:00재생 (space/k)재생음소거 (m)음소거00:00/00:07실시간설정전체 화면 (f)해상도자동 480p자막사용 안함재생 속도1.0x (기본)해상도자동 (480p)1080pHD720pHD480p270p144p자막설정사용 안함옵션글자 크기배경색재생 속도0.5x1.0x (기본)1.5x2.0x죄송합니다. 문제가 발생했습니다. 다시 시도해 주세요.도움말음소거 상태입니다.도움말라이센스고화질 재생이 가능한 영상입니다.설정에서 해상도를 변경해보세요.더 알아보기00:00순대보글보글 익혀주니 이렇게 얼큰한 비주얼이 됩니다.​​곱창과 순대, 다른 부속물도 듬뿍 들어있습니다.​​​​조금씩 덜어서 호호 불어가며 먹었습니다.너무 맵지 않고, 기분좋은 얼큰함이라 술 안주로도 좋을 것 같습니다 :)​​​​이제 볶음밥 타임~~~!!!볶음밥 재료는 모두 셀프바에 있으니챙겨와서 잘 볶아줍니다.​​저희는 전골이 너무 많아서이만큼이나 덜어두고 볶았습니다.​볶음밥은 볶는 사람의 역량이 크지만기본 전골 베이스의 맛이 뛰어나서정말 맛있었습니다​총평가격도 착하고맛도 좋은 오송 토속순대국밥이었습니다.​오송이나 청주 방문 계획있으시면순대전골 한 끼 생각하셔도 좋을 것 같습니다~~​오송 맛집으로 추천드립니다!!​​​​​​​#토속순대국밥#청주맛집#청주오송맛집#청주국밥#청주순대국밥#청주데이트#청주가볼만한곳#오송맛집#오송데이트#오송핫플#청주핫플#청주필수코스#청주오송맛집#오송순대국밥#오송국밥​",20250807
청주 오송 돌다리삼계탕 / 오송역 복날 현지인 맛집 깔끔한 삼계탕,"​오송역 현지인 맛집 깔끔한 삼계탕 추천청주 오송읍[ 돌다리삼계탕 ]내돈내산​50m© NAVER Corp.더보기/OpenStreetMap지도 데이터x© NAVER Corp./OpenStreetMap지도 컨트롤러 범례부동산거리읍,면,동시,군,구시,도국가돌다리삼계탕충청북도 청주시 흥덕구 오송읍 오송생명3로 145 돌다리삼계탕운영시간: 매일 11시~20:30브레이크타임 14시~16:30 / 매주 일요일 정기휴무전화번호: 043-239-3434주소: 충북 청주시 흥덕구 오송읍 오송생명3로 145 돌다리삼계탕​청주 오송읍에 일정이 있어 갔다가점심을 먹기 위해 둘러보던 중,여름 몸보신 필수 메뉴 삼계탕을 먹기 위해현지인 맛집“돌다리삼계탕”을 방문했다.🎈​오송역에서 도보 10분 거리로접근성이 매우 좋았고,매장 건물 뒤로아담한 주차 공간이 있었고근처 골목길, 갓길 주차도 가능했다.​마침 초복과 중복 사이점심시간인 낮 12시에 방문했더니 웨이팅이 있었지만,삼계탕전문점으로 회전율이 좋아그리 오래 기다리지 않고 자리할 수 있었다.😉​​들어선 매장에는무더운 날씨에 몸보신 하기 위해 찾아온손님들이 맛있게 식사 중이였고인근직장인들부터 어르신들까지 현지인들로 북적였다.​정겨운 인테리어에 쾌적한 매장은 꽤 넓었고기본 4인석의 테이블이 많아가족단위, 단체손님까지 전혀 무리 없어보였다.​​매장 중앙에 반짝일 정도로 깨끗하게 관리된추가 반찬이 담긴 셀프코너며국내산으로 이루워진 원산지 표기가 돋보였고,​전문성이 느껴지는 깔끔한 메뉴판도 한눈에 들어왔다.(매장 내 남녀구분된 화장실도 있음!)​​기본 반찬으로 삼계탕에 곁들여 먹기 좋은시원한 깍두기와 배추김치,별미 무말랭이무침, 아삭한 고추와 양파가 나왔다.​​이어나온 김이 모락모락뚝배기에 담겨나온 뽀얀 삼계탕이보기만해도 든든해졌다.​무더운 여름날 에어컨 아래 시원한 식당 안에서 먹는뜨끈한 삼계탕~ 말해모해!ㅎㅎ​​뜨끈하고 뽀얀 국물을 한입 먹어보니따로 소금간을 더 할 필요 없이담백하면서 깊고 진한 국물 맛이 진국이었다.​푹 삶아진 영계의 닭다리부터 쏙쏙,뼈가 쉽게 분리되면서 고기가 부드러웠고안에 담긴 찹쌀이 고소하고 쫀득해 정말 맛있었다.👍🏻​​​청주 오송읍 오송역 삼계탕 맛집“돌다리삼계탕”🔖​​잘 먹었습니다.🧡​",20250807
