title,content,date
[청주 식당/가경동] 무지개송어짜글이 -청주짜글이... ,"[청주 식당/가경동]무지개송어짜글이-청주짜글이/ 가경동짜글이청주송어/ 청주송어회제가 좋아하는 맛집오랜만에 다녀왔어요 :)​#청주짜글이#가경동짜글이#청주송어#청주송어회'무지개송어짜글이'​​​​​50m© NAVER Corp.더보기/OpenStreetMap지도 데이터x© NAVER Corp./OpenStreetMap지도 컨트롤러 범례부동산거리읍,면,동시,군,구시,도국가무지개송어짜글이충청북도 청주시 흥덕구 장구봉로 10무지개송어짜글이주소 :충북 청주시 흥덕구 장구봉로 10/지번 -충북 청주시 흥덕구 가경동 1492-5전화번호 : 043-236-1530이용 시간월 ~ 토 11:30 - 21:3015:00 - 16:30 브레이크 타임일 정기휴무 (매주 일요일)​​​​저는 사장님께 미리 예약 후 방문했는데친절히 예약해 주셨어요주차는 주차 가능한 곳에 주차 후 방문길가에 있어서매장 찾기 쉬웠답니다 :)​#청주짜글이#가경동짜글이#청주송어#청주송어회'무지개송어짜글이'​​​​​매장 내부점심시간엔 인기 많은 곳일부러 점심시간 피해서 방문했어요사장님께서 친절히 맞이해 주셨고매장이 넓어서 좋았답니다 :)​#청주짜글이#가경동짜글이#청주송어#청주송어회'무지개송어짜글이'​​​​​​​​​​​​​​메뉴판짜글이 2인 + 송어회 1인( 세트로 주문 )음식 재료의 원산지잘 표기되어 있어요 :)​#청주짜글이#가경동짜글이#청주송어#청주송어회'무지개송어짜글이'​​​​​​​​​​​​​​​​넓은 매장 :)​​​​​​​​​​​​​애피타이저로 나온직접 구워 먹는 두부맛있겠다!!​​​​​​​​​​​두부 부침을 맛있게 먹고 있으면송어회가 나와요 :)야채 가득 + 송어회초고추장 + 참기름콩가루 + 마늘빕 등​취향대로 재료 넣고비벼 먹기먹고 먹고 또 먹고 너무 맛있다!!​#청주짜글이#가경동짜글이#청주송어#청주송어회'무지개송어짜글이'​​​​​​​​​​송어회를 다 먹어갈 때쯤이면각종 찬과 함께짜글이, 공깃밥이 나와요 :)​#청주짜글이#가경동짜글이#청주송어#청주송어회'무지개송어짜글이'각종 찬들과고기 가득 짜글이먹고 먹고 또 먹고너무 맛있다...!​​​​​​​​​​마무리 후식까지 최고 :)​사장님 친절하시고음식도 너~무 맛있는 곳 :)​#청주짜글이#가경동짜글이#청주송어#청주송어회'무지개송어짜글이'​#청주짜글이#가경동짜글이#청주송어#청주송어회#흥덕구송어#흥덕구송어회#가경동송어회#가경동송어#청주터미널맛집#청주터미널맛집추천#가경동맛집#가경동맛집추천#청주맛집#청주맛집추천#흥덕구맛집#흥덕구맛집추천#짜글이#송어#송어회#송어맛집#송어회맛집#짜글이맛집#청주점심#청주점심메뉴#청주점심메뉴추천​​​​​​​​​​​​​​",20250220
청주 가경동 맛집 푸짐한 수곡동근처 추천!,"본 포스팅은 브랜드로부터 원고료를 지원받아직접 체험 후 촬영해서 제작되었습니다​위치 및 지도50m© NAVER Corp.더보기/OpenStreetMap지도 데이터x© NAVER Corp./OpenStreetMap지도 컨트롤러 범례부동산거리읍,면,동시,군,구시,도국가핵밥 충북대점충청북도 청주시 서원구 1순환로674번길 72 2층​​​안녕하세요 잇님들제가 볼일을 보러 수곡동 갔다가배가 고파서서 식당을 찾았어요​우연하게 들어간 청주 가경동 맛집에서푸짐한 가정식 덮밥을 먹었던 핵밥을추천고 싶어서 글을 남겨봐요​아늑한 분위기와 정말 맛있어보이는 메뉴들을 보니 끌리지않을 수가 없었어요​특히 가정식 덮밥을 전문으로하고 있다는 점이 끌리기도 했지만가정식 덮밥이 특히 그리웠던 제가이곳을 선택하게 된 이유랍니다​더군다나 배가 고파져서 얼른들어가고 싶었어요기분 좋은 시간이 될 것 같았답니다​​이곳 가경동 맛집 을 방문하면서정말 인상 깊었던 것들이 많아서추천드리고 싶어요​들어섰을 때 깨끗하고 따뜻한느낌이 눈에 띄었답니다​편안한 자리에 앉아 메뉴를살펴보니 즐거움이 느껴졌답니다​이곳 가경동 맛집에서 식사를하지 않았더라면 후회했을 것 같아요가정식 덮밥이 주 메뉴이고, 기본찬,사ㅇI드까지 다양하게 준비되어 있어더욱 기대가 컸어요​저녁에 가경동에 가볍게 들른저로서는 간판이 아주 쉽게 눈에들어왔어요​밝은 조명이 살아있고아늑한 분위기를 주더라구요​​또한 한쪽 벽면에는일회용 앞치마도 준비되어 있었어요​식사를 마친 후에는 문 앞에 마련된이쑤시개가 인상적이었어요세심한 배려가 느껴지더라구요마지막까지 기분 좋은 기억으로남을 수 있었답니다​매장에 들어서면 깔끔한 화장실이손님을 반겨주는데요​제가 들어갔을 때도매우 정돈되어 있더라구요​​매장은 아늑하고 간결한 느낌으로꾸며져, 편안함을 느낄 수 있었습니다​또한 밝은 분위기와자연적인 느낌이 조화로워편안하고 즐거운식사 환경을 제공해주었어요​전체적으로 세심하게 신경쓴것을느낄 수 있었답니다​소품 하나하나에 정성이엿보였다고나 할까요​친구와 함께 이야기 나누기좋은 분위기였어요​​각 테이블에는 조미료도 잘정리되어 있었답니다​​숟가락도 젓가락도 하나하나포장되어 있어서 위생적인 부분도안심할 수 있었어요​​이 모습에 청결에 대해서신경을 많은 쓰는 곳이라는생각이 들며 신뢰가생겼어요​모든 식기류가 깨끗하고 잘정돈된 것이 인상적이었어요​​메뉴를 살펴보던 중,닭튀김카레덮밥 정식이 눈에확 띄었어요​쉽게 접할 수 있는 토핑이 들어가서많은 사람들이 좋아할 거 같은메뉴라고 생각이 들었어요​카레를 한 입 먹어보면 맛있다는감탄이 나오는 메뉴라더라고요먹기 전부터 기대가 만발했던부분이에요​​곁들여서 먹을 수 있는 기본찬도 제공되고닭튀김 두 조각과 미니우동동 함께해서다양하게 즐길 수 있었어요​주문한 메뉴가 나오고냄새가 코를 자극하면서너무 행복한 순간이었답니다​진한 카레의 맛과 튀김의바삭함이 잘 어우려졌어요​​맛의 조화가 뛰어난 이 메뉴는모든 점이 만족스러웠어요​두 음식이 입안에서 춤을 추는느낌이 들만큼 정말 맛있었답니다​​이 닭튀김 카레 덮밥을한입 베어먹었을 때의 느낌은정말 매력적이었어요​닭튀김의 튀김은씹을 때마다 바삭소리가느껴지듯 식감이 좋았어요​속의 재료는 촉촉하고 육즙이 풍부해,고기 본연의 맛이 입 안 가득 퍼지며,카레의 진한 향이 고소한 닭고기와잘 어우러졌어요​각 재료의 맛이 잘 조화된 훌륭한한 끼 식사였어요​​풍부한 카레 소스가 매력적인이 요리는 한끼 식사를 더욱 특별하게만들어 주었어요​정식 사ㅇI드에 나온닭튀김과 아삭한 양배추샐러드와한입에 먹으니 너무 맛있었어요​​각 재료의 맛이 잘 조화되어감칠맛 나는 한 끼를 선사했고,다채로운 식감은 매 순간 식욕을돋구어주었어요​특히 닭튀김은 바삭하면서육즙이 정말 풍부해 정말맛있었어요​​간단한듯 하면서 푸짐한 식사를즐기고 싶을때 다시 찾고 싶은 메뉴였답니다​메인 메뉴 외에도 제공된 미니우동도맛있었어요​우동 면발이 쫄깃하고 국물도깊은 맛이 있더라구요​​간단히 먹기 좋은 양에, 눈으로의즐거움도 느낄수 있으면서로 조화를 이루는 그 맛이 없어서는안 될 친구처럼 느껴졌어요​​정식메뉴에 포함된 우동은 덮밥과함께 즐길 수 있었다는 점도 참좋았답니다​한 그릇 비운 후에는 정말만족스러웠어요.​​담백하고 쫄깃한 면발은 주 메뉴와잘 어울렸답니다​서로 다른 두 가지 요리를 함께즐길 수 있어서 만족스러웠죠담백한 덮밥과 아주 잘 어울렸어요​​이곳 수곡동 맛집 덕분에더 맛있게 식사를 마칠 수 있었어요​기본으로나오는 게 이 정도라니,무척이나 만족스러웠답니다​푸짐한 양도 정말 인상적이었어요​​식사를 마치고 사ㅇI드 메뉴로 나온치즈떡이 인상 깊었어요​떡의 부드러운 식감과 치즈의고소함이 잘 어우러져 입안 가득행복감을 전해주었어요​특히 치즈가 떡과 함께 쫄깃하게늘어나는 모습은 보는 재미까지더했어요​저는 이 치즈떡을 따뜻할 때 먹어서치즈의 풍미를 제대로 즐길 수있었답니다​​맛있고 푸짐한데 가성비까지있는 식사 덕분에 하루 마무리를잘 지을 수 있었어요​정성껏 만든 음식이 저의배를 든든하게 채워준 것같아요​​정말 후회 없는 선택이었다고생각해요​나가기 전에는 직원분들의 친절한인사가 정말 마음을 따뜻하게해주었어요​​덕분에 이곳 가경동 맛집에 다시방문하고 싶다는 생각도 들었답니다​수곡동 근처에 자주 들러서맛있는 음식을 즐기고 싶은식당이었어요​​앞으로 수시로 방문할 것 같아요​식사를 완전히 비운 후에는뿌듯한 마음이 드는 경험이었어요​​가경동 맛집에서의 경험은 정말너무 기분좋은  맛으로 남았어요​​맛있게 배부른 저녁을 보내고싶다면 반드시 찾아가보세요가경동 맛집으로 추천하고 싶은곳이예요​​0초0초광고 후 계속됩니다.다음 동영상subjectauthor취소청주 가경동 맛집 푸짐한  덮밥 수곡동 근처 핵밥 추천재생0좋아요0좋아요공유하기재생 (space/k)재생00:050:00:00재생 (space/k)재생음소거 (m)음소거00:00/00:05실시간설정전체 화면 (f)해상도자동 480p자막사용 안함재생 속도1.0x (기본)해상도자동 (480p)720pHD480p270p144p자막설정사용 안함옵션글자 크기배경색재생 속도0.5x1.0x (기본)1.5x2.0x죄송합니다. 문제가 발생했습니다. 다시 시도해 주세요.도움말음소거 상태입니다.도움말라이센스고화질 재생이 가능한 영상입니다.설정에서 해상도를 변경해보세요.더 알아보기00:00접기/펴기청주 가경동 맛집 푸짐한  덮밥 수곡동 근처 핵밥 추천청주 가경동 맛집 푸짐한  덮밥 수곡동 근처 핵밥 추천​​Previous imageNext imagePrevious imageNext imagePrevious imageNext imagePrevious imageNext imagePrevious imageNext imagePrevious imageNext image​",20250212
청주 가경동 메리맘스 상가 정육식당 한우요,"헬로우 지니입니다><오랜만에 재방문 포스팅인데요!저희 동네에 유일에 하게 있는 한우 가게청주 가경동 메리맘스 상가 정육식당 한우요포스팅 시작하겠습니다.한우요충청북도 청주시 흥덕구 서현로 60 135호예약주소: 충북 청주시 흥덕구 서현로 60 135호전화번호: 0507-1426-8264영업시간: 매일 16:00-22:00라스트 오더: 21:00예약: 가능주차: 건물 내 주차장 이용 가능청주 가경동 메리맘스 상가에 위치한정육식당 한우요고기는 정육식당이기 때문에 골라서 먹을 수 있습니다.한우요의 장점은 상차림비가 없습니다.또한, 셀프로 이용하는 주류맥주 3,000원 소주 1,000원입니다.내부는 넓은 편은 아니지만,테이블은 여러 개입니다.테이블이 좁은 게 살짝 단점이에요.지니 맘미가 고기를 골라서 가져왔는데요.차돌박이는 언제나 먹어도 맛있잖아요!지니의 최애 부위 안창살도 있습니다.안창살이 없는 가게도 많은데요.청주 가경동 메리맘스 상가정육식당 한우요는!!!안창살이 있어서 좋았습니다><Previous imageNext image후식 메뉴도 다양해서 술안주로 먹기에도 좋았습니다.기본 반찬으로 파김치가 나오는데요!파김치 정말 맛있습니다.뭇국과 육사시미도 등장!!지니는 육사시미 넘 좋아해용><참기름 찍어서 드셔보세요.역시 소고기는 숯불에 구워 먹어야 맛도리잘 익은 차돌박이 정말 맛도리랍니다.지니가 좋아하는 안창살!가격이 비싼 만큼 정말 쫄깃 그 자체한우요 등심이 푸짐하고 가격도 저렴했습니다.육회 추가!!!육회는 원하는 만큼 만들어주시는데요.담백한 맛이었습니다.마지막으로,,, 삼겹살까지 또 구워 먹음!!엄빠와 쩨쩨랑 4명이서 실컷 먹었던,청주 가경동 한우요마지막 마무리는 소면으로!!!소면 맛은 특별한 맛은 아니었고 쏘쏘된장찌개도 주문해서 공깃밥에야무지게 말아먹었습니다><완전 배부르게 먹은 가게!!청주 가경동 한우요 고잉해보세요!일단, 주류가 저렴해서 너무 좋아요.#한우요#가경동한우요#홍골한우요#청주한우요#메리맘스상가#가경동한우맛집#가경동정육식당#청주정육식당#청주주류이벤트​",20250123
[청주 가경동 맛집] 파스타가 맛있는 믹스레스토랑,"[청주 가경동 맛집] 파스타가 맛있는 믹스레스토랑안녕하세요, 비비앙뜨에요. 며칠 전 친목계 오다클럽의 만남으로 가경동을 다녀왔는데요. 드디어 오다클럽의 모든 멤버들이 결혼을 했기 때문에 다들 유부녀 클럽으로 변했어요!! 다들 솔로일 때 부터 이어진 모임이 유부녀가 되고, 출산까지 한 엄마들의 모임으로 가기 직전이기에 뜻 깊은 만남이었어요.​그래서 저희가 맛도 맛이지만 분위기, 가격까지 세가지를 모두 아우르는 청주 가경동 맛집 믹스레스토랑 본점에서 맛있는 파스타와 필라프, 플래터를 먹으면서 시간을 보내게 되었답니다.믹스레스토랑 본점주소 : 충북 청주시 흥덕구 경산로43번길 12 1층전화번호 : 043-231-5969영업시간 : 매일 11:00~22:00대표메뉴 : 상하이파스타 10,900원50m© NAVER Corp.더보기/OpenStreetMap지도 데이터x© NAVER Corp./OpenStreetMap지도 컨트롤러 범례부동산거리읍,면,동시,군,구시,도국가믹스레스토랑 본점충청북도 청주시 흥덕구 경산로43번길 12 1층외관​청주 가경동 시외버스터미널에서 걸어서 약 12분 정도 걸리고 거리는 약 500m 정도의 위치에요. 저희가 오는걸 반기는지 눈발이 조금씩 흩날리는 멋진 분위기 연출! 저희는 좀 늦은 점심시간으로 오후 2시쯤 방문했답니다.​​외관은 크게 변한건 없지만 최근에 착한가격모범 식당 인증을 받은 모습이더라고요. 이렇게 적혀있는 푯말을 확인할 수 있었답니다. 👍실내​실내로 입장하고 나면 예전 그 분위기 그대로였지만 인테리어는 몇가지가 바뀐 것 같았어요. 여전히 따스한 분위기 덕에 겨울에 오기 좋은 그런 데이트 장소임이 틀림 없었어요.​​좌석 배치도 적절했고 천장에 달린 샹들리에와 꽃장식, 거울이 2개나 있어서 식사 후 용모를 체크할 수 도 있엇어요. 근사한 분위기에서 저희는 아이 포함 5명이기 때문에 4명 자리에 앉았답니다.​​스페셜메뉴로 티본스테이크가 있었어요. 집에서 해먹기도 힘든데 가격도 착한? 그런 느낌! 새로 나온 투움바파스타부터 다양한 파스타가 있다고 하니까 참고해서 주문을 해봤답니다. 😊메뉴판​자리에 앉아서 청주 가경동 맛집의 메뉴판을 살펴봤어요. 기본적으로 스페셜메뉴와 스테이크, 파스타, 필라프, 리조또 이렇게 있는데요. 메뉴들 가격도 무척 저렴해서 요즘 외식 물가 대비 정말 착한 가격의 착한 가게라고 생각해요.​​게다가 스테이크는 가격 인하까지 하시는데, 물가상승만 되는 이 시점에 이런게 얼마나 소중한지 다들 아시잖아요. 가격이 무척 저렴한 편! 그래서 대부분 손님들은 스테이크는 꼭 드시더라고요.​​파스타는 뭘 먹을까 한참 고민하다 새로 나왔다는 투움바파스타를 골라서 시켰고 여기에다 상하이필라프, 믹스플래터까지 주문해서 같이 먹었답니다.​<주문한 메뉴>상하이필라프 11,500원투움바파스타 12,900원믹스플래터 25,000원상차림​주문을 하고 나면 기본 세팅이 이루어지는데요. 식기부터 피클까지 담긴 그릇이 너무 이뻐요. 결혼생활을 지속하다보니 그릇 세트에 진짜 관심이 많이 생겨서 유심히 보던 식기들..​​식기가 너무 이뻐서 알아봤는데 접시가 폴란드 그릇으로 가격이 꽤 비싸서 패스.. 그런데 한 세트 정도는 가지고 있으면 나중에 집에서 먹을 때 분위기 내기 좋을 것 같았어요.​​피클은 아삭하고 시원한 맛! 적당히 달콤해서 먹기도 좋았어요. 나이가 든건지 이제는 양식 먹을 때 피클 없으면 안되는.. 😂​​주문한 메뉴들이 나오고 나니 테이블을 가득 채웠어요! 오다클럽 모두 핸드폰 들어!! 사진도 찍고 곧바로 먹어봤답니다.투움바파스타 12,900원​투움바파스타부터 보여드리자면 새우와 베이컨이 들어간 파스타로 매콤하면서 꾸덕한 스타일의 파스타에요. 투움바라고 한다면 보통 아웃백 많이 생각하시잖아요? 거의 비슷한 맛을 구현해내셨더라고요.​​꾸덕한 소스가 넓고 굵직한 페투치네 면에 찰싹 달라붙어 진한 풍미가 느껴지는데 신기하게 토마토의 산미랑 크림소스의 담백함이 느껴지긴 했어요! 그리고 살짝 나는 매콤함이 느끼함도 쏙쏙 잡아준답니다.​0초0초광고 후 계속됩니다.다음 동영상subjectauthor취소청주 가경동 맛집 투움바파스타재생22좋아요0좋아요공유하기재생 (space/k)재생00:040:00:00재생 (space/k)재생음소거 (m)음소거00:00/00:04실시간설정전체 화면 (f)해상도자동 480p자막사용 안함재생 속도1.0x (기본)해상도자동 (480p)1080pHD720pHD480p270p144p자막설정사용 안함옵션글자 크기배경색재생 속도0.5x1.0x (기본)1.5x2.0x죄송합니다. 문제가 발생했습니다. 다시 시도해 주세요.도움말음소거 상태입니다.도움말라이센스고화질 재생이 가능한 영상입니다.설정에서 해상도를 변경해보세요.더 알아보기00:00접기/펴기청주 가경동 맛집 투움바파스타청주 가경동 맛집 투움바파스타​새우도 튼실하고 식감도 좋고~ 뭔가 탱글한데 톡톡 터지는 느낌이 좋았어요. 소스에 베이컨이 들어가서 풍미도 좋았고 식감도 아주 일품이었답니다. 👍믹스플래터 25,000원​다음으로 믹스플래터를 보여드릴게요. 큰 쟁반에 샐러드, 감자튀김, 화이타, 또띠아, 4가지 소스, 콘샐러드 등 다양하게 들어가서 먹을게 많아요.​​감자튀김부터 먹어보면 뿌링클 가루인가? 이게 들어가서 달콤하면서 담백한 맛, 아이들이 먹기에도 딱 좋은 그런 맛이에요.​​그리고 샐러드는 아삭하고 시원한데요. 갈릭드레싱인지 감칠맛도 좋고 의외로 양이 많은데다 양식 먹다보면 샐러드가 필수처럼 느껴질정도로 너무 맛있게 먹었어요.​​그리고 화이타에는 목살과 새우, 파프리카를 넣고 구운 메뉴였어요. 칼칼한 맛과 향긋함이 있어서 맛도 좋고 부드럽고 불맛도 난답니다.​​그리고 새우는 작지만 신선해서 비리지도 않고 불맛이랑 이런게 잇으니까 같이 먹기도 좋았어요.​​또띠아를 집어 샐러드, 목살과 새우를 올리고 소스까지 발라 먹으면 만들어 먹는 재미도 좋고 맛도 좋고 마음에 들었어요. 🤞상하이필라프 11,500원​마지막 메뉴인 상하이필라프에요. 원래 상하이파스타 시키려다가 필라프로 선회! 매콤하게 볶아진 필라프는 새우와 양파, 마늘, 애호박, 버섯, 숙주나물이 들어갔어요.​​고슬고슬한 밥에 마요네즈 토핑이 고소하게 느껴지고 매운맛도 적당해서 좋더라고요. 그리고 숙주나물이 있어서 그런지 아삭한 식감도 너무 좋았답니다.​​새우도 튼실하고 잘 볶아져서 불맛도 적당하니 맛있었어요. 역시 한국인은 밥심인가요! 너무 맛있게 먹어서 싹싹 긁어 바닥을 보였답니다. 🤣마무리오랜만에 방문했던 청주 가경동 맛집 믹스레스토랑! 율량동에서 가경동까지는 꽤 거리가 되지만 그래도 가볼만한 가치가 있는 곳으로 맛도 좋은데다 가격도 착한 진정한 파스타 맛집이에요.​새로 나온 메뉴들도 있었고 기존 메뉴들을 업그레이드 하여 변경한 점도 많다고 하시더라고요. 요즘 보통 셋~넷이서 외식하면 10만원은 기본인데 5만원 정도 밖에 안되는 멋진 가격! 아주 맛있게 식사하고 왔답니다. 👌​​엄마도 좋아하고 집 근처니까 나중에는 포장해서 집에 가져가서 먹을 예정! 저렴한 가격의 맛있는 파스타 아주 맛깔나게 먹고 왔답니다. 👏#청주가경동맛집#가경동맛집#청주파스타맛집#청주가경동파스타#믹스레스토랑본점",20250117
청주 가경동 메리맘스 맛집 초밥이 맛있는 완식당,"청주 가경동 메리맘스 맛집완식당집에 친구가 놀러왔당뭐 먹을까 하다가 집근처에 있는#청주초밥맛집완식당에 가기로 결정ㅎㅎ요즘 부쩍 자주 가는 느낌이네또복이도 맛있게 잘 먹어서 이제 더더 자주 갈거같당​​​​📍 충북 청주시 흥덕구 서현로 60 1층 107호🕝 11:30 - 21:00 (브레이크타임 15:00 - 17:30)☎️ 0507-1356-0516​​50m© NAVER Corp.더보기/OpenStreetMap지도 데이터x© NAVER Corp./OpenStreetMap지도 컨트롤러 범례부동산거리읍,면,동시,군,구시,도국가완식당충청북도 청주시 흥덕구 서현로 60 1층 107호예약​​​오픈하자마자 방문한 터라몇 없는 4인 테이블에 자리를 잡을 수 있었다언제와도 따뜻하고 깔끔한 우드 인테리어​​​​​​오늘도모듬초밥 B 2개 + 치즈새우 단품초밥2P 주문방어를 먹을까 하다가 나중에 방어회로 먹고싶어간단하게 주문했다​​​​​​젓가락｜종이컵｜간장｜간장그릇｜물테이블마다 셋팅되어 있다​​​​​​수다 떨다보니 나온 모듬초밥완식당은 음식도 맛있고 한데메뉴가 조금 늦게 나오는 경향이 있음😅😅😅​​​​​​샐러드｜타코야끼｜미니우동｜초밥이렇게 나와서또복이 타코야끼랑 미니우동주고나는 샐러드랑 초밥먹고 딱이었당​​​​​​가쓰오부시는 싫다고 해서 다 빼주고요?나도 타코야끼 좋아하는데 엄마가 양보한거얌...​​​​​​미니우동도 또복이가 맛있게 잘 먹었다초록색 파가 싫다해서 파는 싹 건져줌ㅋㅋㅋㅋ​​​​​​치즈도 좋아하고 새우도 좋아하는 또복이를 위해주문한 치즈새우초밥근데 생각보다 잘 안먹음...왜쥬...​​​​​​자, 이제 먹어봅시당ㅎㅎ다음에는 다른 메뉴를 시켜봐야지ㅋㅋㅋ근데 모듬초밥 B가 제일 만만함​​​​​​총 12P로 구성된 모듬초밥광어2 연어2 참치2 치즈새우1 간장새우1 아나고1계란1 한치1 후토마끼1​이렇게 적혀있는데 이 날은 연어만 3개고참치는 안보이넹...🤔🤔​​​​​​아마 때에 따라 종류가 달라지는 것 같은데설명이 1도 없어서 아쉬웠당하지만 잘 먹고 왔음ㅋㅋㅋ​​​​​​한번도 이용하지 않은 셀프바뭔가 들어오는 길에 바로 있어서 자리에 앉으면이용하기가 쉽지 않다ㅋㅋㅋㅋ​​​​​​다음엔 방어를 먹으러 가봐야겠당겨울방어는 먹어줘야쥐...​​​​​​​​집근처에 있어서 자주 가게 되는 완식당맛있게 먹고 왔지만 포스팅하다보니아쉬운 부분이 생기지만 그래도 또 재방문할듯ㅎㅎ청주 가경동 초밥맛집 찾으시는 분들께 추천!​",20241227
