title,content,date
[청주] 가경동 저렴한 가격에 고기 질과 맛까지 보장된 식당... ,"가경동 한우요​⏰ 영업시간매일 16:00~22:0021:00 라스트 오더​📞 전화0507-1426-8264​✅ 특이사항콜키지 무료, 주차, 배달, 포장, 무선 인터넷#청주맛집추천 #청주로컬맛집 #청주맛집리스트 #청주백반집 #청주가봐야할곳 #청주노포맛집
#청주현지인맛집 #청주인생맛집 #청주코스요리 
#청주회식장소추천 #청주삼겹살맛집 #청주소고기맛집 #가경동맛집 #강서동맛집 #가경동소고기 #가경동삼겹살맛집 #가경동정육점 #강서동정육식당 #가경동정육식당 #가경아이파크맛집 #가경자이아파트주변맛집 #한우요 #가경동한우요 #강서동한우요 #청주한우요 #청주육회비빔밥 #청주물회맛집 #청주갈비탕맛집m.blog.naver.com​​청주 가경동 가경 아이파크 3단지 앞 메리맘스 건물 1층 조각상 옆에 위치해있어요.주차는 건물 내 주차장에 가능하며, 결제 시 차량번호를 말씀드리면 3시간 동안 무료주차 가능합니다 🚘내부는 10개의 테이블로 넉넉한 편이었고 연탄 불로 굽다 보니 어느 정도 냄새는 났어요 🥩​메 뉴 판삼겹살 150g 12,000원 (3인분 이상 주문 가능)비빔냉면 7,000원소주/맥주 3,000원​고기는 소고기, 돼지고기, 육사시미, 육회 등으로 다양하게 판매되고 있고 기본 3인분부터 주문 가능합니다.그 외에 사이드 메뉴도 다양했고 주류가 소주/맥주 3,000원으로 굉장히 저렴하게 판매되고 있어요​🥂​​​​보통 저렴한 정육 식당 같은 곳을 가면 기본 상차림비를 받거나 상차림이 부실한 편인데한우요는 기본 상차림비가 없었고 밑반찬 종류가 다양했어요!​​​​계란찜과 소고기무국, 육사시미와 쌈 채소, 김치, 파김치, 맛보기 육회 비빔까지 주시는데 맛도 엄청 좋았어요 👍👍👍반찬이나 국 하나 나무랄 데 없었고 특히나 소고기무국이 대전 태평소 국밥보다 맛있었어요..... ( 진짜 제 스타일 ❤️ )육사시미 또한 쫀득하고 신선해서 감탄연발했어요!!​​전 삼겹살을 주문했는데 암퇘지를 사용해서 그런지 고기 신선도나 맛도 최고였어요.가격도 저렴해서 좋았는데 고기 신선도나 부위까지 좋았고 고기 가지고 장난치는 식당들이 많은데 양심적으로 좋은 고기만 판매하시는 거 같아서 먹기 전부터 신뢰도 .. 🆙🆙🆙​​​​고기 단독으로 먹어도 부드러움과 육즙 가득해서 맛있었는데 여기에 같이 주시는 파김치랑 먹으면 극락... 🔥고기를 3인분 주문했는데 너무 맛있어서 추가 주문해서 먹었어요 🐷​​​​고기와 최강 궁합인 비빔냉면도 주문했는데 사장님이 기본적으로 음식을 굉장히 잘하시는지 비빔냉면 맛도 최고.... 👍고기나 밑반찬 사이드 메뉴 모두 만족스러웠지만 사장님이나 직원분들도 너무나 친절하셔서 더 기분 좋게 식사했어요!​숨은 맛집을 찾은 느낌이어서 가족들과 식사하면 너무 좋을 거 같습니다 👍👍👍50m© NAVER Corp.더보기/OpenStreetMap지도 데이터x© NAVER Corp./OpenStreetMap지도 컨트롤러 범례부동산거리읍,면,동시,군,구시,도국가한우요충청북도 청주시 흥덕구 서현로 60 135호예약​#청주맛집추천#청주로컬맛집#청주맛집리스트#청주백반집#청주가봐야할곳#청주노포맛집#청주현지인맛집#청주인생맛집#청주코스요리#청주회식장소추천#청주삼겹살맛집#청주소고기맛집#가경동맛집#강서동맛집#가경동소고기#가경동삼겹살맛집#가경동정육점#강서동정육식당#가경동정육식당#가경아이파크맛집#가경자이아파트주변맛집#한우요#가경동한우요#강서동한우요#청주한우요#청주육회비빔밥#청주물회맛집#청주갈비탕맛집",20250604
"청주냉동수리,청주 저온저장고,청주가경동식당... ","청주가경동식당 워크인냉동고온도안내려가는고장,상당히 노후된 청주 가경동 워크인냉동고 온도안내려가는 고장수리입니다.대흥냉동OIO-455O-89I7청주냉동수리,청주 저온저장고,청주가경동식당 워크인냉동고온도안내려가는고장,청주복대동 워크인냉동냉장고,청주칠러수리,청주강내저온저장고 차단기내려가는고장,증평 워크인냉동,증평 저온저장고,세종냉동,세종 저온저장고수리,공주냉동,공주 저온저장고수리,보은냉동,보은 저온저장고,보은사과저장고,괴산냉동,괴산 저온저장고,음성 복숭아저장고,음성냉동,음성 저온저장고수리,진천냉동,진천 저온저장고,청주가경동식당 워크인냉동고온도안내려가는고장,대흥냉동OIO-455O-89I7설치된지 15년이상 경과한 워크인냉동기실외기~아무것도 안돌아가는 고장~수리기술자들이 2번 방문했다가 수리불가판정하고 철수했다는~​청주가경동식당 워크인냉동고온도안내려가는고장,대흥냉동OIO-455O-89I7워크인냉동고 실외기 내부를 확인하니 자동차 폐차하듯 즉시 폐기해야하는정도의노후상태입니다.  기계는 오랜 사용기간이 경과하면 고장을 많이 일으키고 결국 수리가성비가 많이 떨어지면 폐기하고 새기계를 들이는게 중장기적으로 가성비가 오히려 좋게됩니다.청주가경동식당 워크인냉동고온도안내려가는고장,대흥냉동OIO-455O-89I7워크인냉동고 온도콘트롤러상태도 도저히 손대기 어려운정도로 엉망~~우선 여기먼저 수리진행~~일부부품교체~시간이 꽤 소요~청주가경동식당 워크인냉동고온도안내려가는고장,대흥냉동OIO-455O-89I7워크인냉동고 실내기~냉동온도를 영하10도 정도로 사용하는중인데~~실내기상태도 매우 안좋아보입니다~~외관이 저정도 부식하면~~내부는 확인하나마나~~청주가경동식당 워크인냉동고온도안내려가는고장,대흥냉동OIO-455O-89I7워크인냉동고 실내기측판을 확인차 오픈하니 이미 폐기수준을 훨씬넘어 도저히 사용하기 어려운 엄청난 부식상태~일부 가스도 미세하게 새는것으로 보이고~다른 냉동기술자처럼 나도 여기서 철수해야되는거 아닌가 잠시 갈등~고객님은 꼭 돌아가게해달라고 부탁을~기술이 아니고 마술을 부려야 될듯한 상태인데!~청주가경동식당 워크인냉동고온도안내려가는고장,대흥냉동OIO-455O-89I7실외기내의 부품들은 먼지속에서 캐내야 보일정도의 상태인데 아무튼 차분하게작업진행~일부 부품은 교체~청주가경동식당 워크인냉동고온도안내려가는고장,대흥냉동OIO-455O-89I7결국 돌아갑니다.워크인냉동고 온도도 하강중~ 그런데 1년에 한두번은 가스를 보충해야할듯~완전하게 정리하려면 비용을 들여 통째 교체해야만 되는데 일단은 사용가능하도록수리완료~!대흥냉동OIO-455O-89I7#청주냉동수리,#청주저온저장고,#청주가경동식당워크인냉동고온도안내려가는고장,#청주복대동워크인냉동냉장고,#청주칠러수리,#청주강내저온저장고 차단기내려가는고장,#증평워크인냉동,#증평저온저장고,#세종냉동,#세종저온저장고수리,#공주냉동,#공주저온저장고수리,#보은냉동,#보은저온저장고,#보은사과저장고,#괴산냉동,#괴산저온저장고,#음성복숭아저장고,#음성냉동,#음성저온저장고수리,#진천냉동,#진천저온저장고,",20250602
청주 가경동 초밥 맛집 뷔페 쿠우쿠우,"청주 가경동 초밥 맛집 뷔페 쿠우쿠우​안녕하세요 춘입니다!오늘은청주 가경동 초밥 맛집으로 유명한쿠우쿠우를 소개해드리려고 합니다​쿠우쿠우쿠우쿠우 청주점충청북도 청주시 흥덕구 풍산로 15 2층(가경동,대우메가폴리스)위치, 주차청주 가경동 초밥 맛집​​​쿠우쿠우는청주 가경 터미널 맞은 편에 있는대우메가폴리스 2층에 자리하고 있습니다메가폴리스 주차장 자리가 엄청 넉넉해요!!거의 1000대 가량 수용된다고 합니다 ㅎㅎ차 끌고 식당 한번 갈때마다 주차 때문에 골치인데이렇게 편하게 차 댈 수 있으면 너무 좋죠​그리고 쿠우쿠우에서 식사를 하면3시간으로 넉넉하게 주차무료 가능해서편안하게 식사 가능하다는 점~​​​​​쿠우쿠우 가격은 아래와 같습니다​평일 런치24,900원평일 디너29,900원주말 / 공휴일32,900원초등학생 평일15,900원/ 주말16,900원미취학 아동8,000원​평일 점심은 24900원으로진짜 요즘 물가에 혜자스러운 가격입니다...​​​실내 공간청주 가경동 초밥 맛집​​​쿠우쿠우는 실내 공간도 엄청 넉넉한 편이에요단체 50인까지도 수용가능한 좌석이 있고행사가 가능한 룸도 있다고 하니단체 손님들에게도 딱입니다​​​샐러드바청주 가경동 초밥 맛집​이제 본격적으로 샐러드바 탐방을 시작해볼까요!쿠우쿠우는음식 종류가 120가지나 된다고 하는데요진짜 가보면 맛있어 보이는게 넘 많아서넘 정신없습니다 ㅋㅋㅋㅋ제가 코너별로 간략히 보여드릴게요​0초0초광고 후 계속됩니다.다음 동영상subjectauthor취소쿠우쿠우재생48좋아요0좋아요공유하기재생 (space/k)재생00:070:00:00재생 (space/k)재생음소거 (m)음소거00:00/00:07실시간설정전체 화면 (f)해상도자동 480p자막사용 안함재생 속도1.0x (기본)해상도자동 (480p)1080pHD720pHD480p270p144p자막설정사용 안함옵션글자 크기배경색재생 속도0.5x1.0x (기본)1.5x2.0x죄송합니다. 문제가 발생했습니다. 다시 시도해 주세요.도움말음소거 상태입니다.도움말라이센스고화질 재생이 가능한 영상입니다.설정에서 해상도를 변경해보세요.더 알아보기00:00쿠우쿠우​​우선 쿠우쿠우하면 바로초밥 맛집이잖아요?!초밥, 캘리포니아롤, 각종 해산물이맨 앞쪽에 비치가 되어있어요각 롤과 초밥과 회 등 종류만 해도 엄청 많습니다​그리고 쿠우쿠우는 초밥이 작은 사이즈로 나와서여러가지를 맛보기가 너무 좋더라구요​​​​​​스시 옆쪽에는 과일, 푸딩, 케익 종류가 있는데비주얼 하나같이 미쳤습니다.....​​​​​​​​그 맞은편엔 다양한 음료를 가져갈 수 있는 코너가 있어요커피에서부터 각종 티, 탄산, 슬러쉬까지없는게 없습니다!!저는 티를 즐겨마시는데저렇게 티백이 많은게 넘 좋더라구요​​​​​​​​그리고 초코퐁듀와 와플, 빵들까지...특히 와플은 직접 안구워도 되고직원분들이 구워서 진열해놓기 때문에편하게 가져가서 먹기만 하면 됩니다넘 좋아요!!!​​​​​​​​매장 더 안쪽으로 가면 피자와 국수 코너도 있어요국수 종류도 진짜 많죠?!흔히 잔치국수나 냉모밀, 쌀국수 정도 있는데여긴 짜장에 짬뽕까지 ㅎㅎㅎ​​​​​​​​​​이제 샐러드바 코너입니다.샐러드 종류도 이렇게 많을 수가 있나 싶을 정도로다양한 샐러드가 구비되어 있어요​​​​​​​​​고기와 튀김, 구운 야채도 빠질 수 없죠!!사진 보면서 알았는데타코야키와 츄로스를 안먹고 왔다니..슬픔... 흑흑​​​​​​​​로스트 코너에는 따뜻한 요리들이 있는데여기도 종류가 진짜 ㅋㅋㅋㅋ넘 많아서 다 못찍어왔어요치킨, 불고기, 파스타, 볶음 우동,마지막에 쭈닭까지 <3진짜 없는 것 빼고 다 있는 쿠우쿠우120개 요리의 위엄!! ㅋㅋㅋㅋㅋ​​​​​​​메뉴가 너무 많아서고르고 골라 두접시 담아왔어요왼쪽은 따뜻한 고기, 튀김파오른쪽은 해산물파! ㅋㅋㅋㅋ​다 맛있었지만 특히초밥이 진짜 다 맛있었어요 ㅠㅠㅠ​​​​​​​나중에 배부를 땐 요렇게 초밥만 가져오기 ㅋㅋ아까 말한 것처럼 초밥 사이즈가 작아서호로록 여러가지 맛보기 넘 좋아요!!!​​​​​​​그리고 마지막 디저트 타임와플에 초코퐁듀로 빼뺴로도 만들고아이스크림까지 야무지게 담아서 먹었어요초코퐁듀 최고 ㅠㅠ 바삭한 와플이랑 넘 잘어울려요​​​​​​​나갈 때 보시면 이렇게영수증 이벤트도 진행중이니 꼭 참여해보세요!주차도 나갈 때 말하시면 3시간 넣어주셔서밥 먹구 쇼핑하셔도 딱이겠죠?! ㅎㅎ​오늘 이렇게청주 가경동 초밥 맛집쿠우쿠우 방문기를 적어보았어요맛있는 초밥 마음껏 드시고 싶다!하시면가성비 넘치고 맛까지 좋은쿠우쿠우 꼭 한번 방문해보시길 추천드릴게요.​그럼 오늘 포스팅은 여기에서 마치겠습니다우린 다음에 또 만나요 안녕~!​",20250528
청주 가경동맛집 강서동맛집금성식당 후기,"​​​며칠 전 친구랑 청주 금성식당 다녀왔어요. 원래 고깃집은 워낙 자주 가는 편인데요, 친구가 “요즘 청주에서 먹은 고기 중 최고였다!“고 할 정도로 맛있게 먹고 온 곳이라 이렇게 후기로 남겨보려고 해요.저희가 주문한 메뉴는 ‘둘이서세트’에 밀면 하나 추가해서 총 56,000원어치였어요. 메뉴 구성은 생갈비 2인분에 목살 1인분, 그리고 밀면인데요. 목살은 일반이랑 이베리코 중에서 선택할 수 있었는데, 당연히 이베리코로 골랐어요.그리고 밀면도 물밀면이랑 비빔불면 중에서 고를 수 있어서 저희는 시원한 물밀면으로 선택했답니다. 찌개는 김치, 된장, 짜글이 중에서 고를 수 있었고요. 김치찌개로 골랐는데 이게 정말 대박이었어요!찌개부터 얘기하자면 양이 정말 푸짐해요ㅋㅋ 거의 4인분이라고 해도 믿을 정도였는데, 두 명이서 먹기엔 너무 많을까 싶었지만 너무 맛있어서 공기밥까지 하나 추가해서 싹 비워냈어요.김치찌개는 끓고 난 다음에 사진 찍는 걸 깜빡할 정도로 맛이 일품이었는데요. 짜지도 않고, 달지도 않고 딱 적당히 칼칼하면서 깊은 맛이 나더라고요. 완전 밥도둑이었어요.고기 맛도 정말 훌륭했어요. 특히 이베리코 목살은 육즙도 풍부하고 식감도 너무 좋아서, 친구가 감탄을 멈추지 않았답니다.친구 말로는 최근 청주에서 먹은 고기집 중에서 가장 맛있었다고 하더라고요. 생갈비도 마블링이 예쁘게 들어가 있어서 구울 때부터 고소한 향이 올라오는데, 입에 넣자마자 부드럽게 녹는 느낌이 너무 좋았어요.반찬들도 하나하나 정갈하게 잘 나왔고요, 무엇보다도 하나같이 맛있어서 고기랑 같이 곁들이기에 딱 좋았어요. 개인적으로는 콩나물무침이랑 오이무침이 특히 맛있었어요. 느끼함을 잡아주는 데 아주 딱이더라고요.셀프 코너도 잘 마련되어 있었는데요. 쌈채소, 쌈장, 마늘, 고추, 소스류는 물론이고, 찌개 육수나 사리까지 다 리필할 수 있어서 부족함 없이 먹을 수 있었어요. 요즘은 고기집 가도 리필 눈치 보이는 곳도 있는데, 여긴 자유롭게 이용할 수 있도록 돼 있어서 참 좋았어요.무엇보다도 사장님이랑 직원분들이 정말 친절하세요. 손님 하나하나 신경 써주시고, 고기 굽는 팁도 알려주시고, 찌개도 더 필요하면 이야기하라고 먼저 얘기해주시더라고요. 분위기도 전체적으로 따뜻하고 정감 있어서 기분 좋은 식사를 할 수 있었어요.너무 맛있어서 끓고 나서 사진 찍는 것도 까먹은 김치찌개 ㅋㅋㅋ​김치도 고기도 엄청 많이 넣어주셨어요!​저희는 오픈도어 형식으로 열리는 자리에서 식사했는데요. 날이 선선한 저녁이라 바람 살랑살랑 불어오는데 진짜 야외 피크닉 느낌도 나고 너무 좋았어요.평일 저녁인데도 분위기가 한가롭지 않고, 6시 지나자마자 테이블이 거의 다 찼어요. 이미 입소문이 난 맛집이라 그런지 손님이 끊이질 않더라고요.전체적으로 음식, 분위기, 서비스 모두 만족스러웠고요. 친구가 “여긴 다음에 가족들이랑 또 오고 싶다”고 할 정도였어요. 저도 다음엔 부모님 모시고 다시 방문해보려고요. 푸짐한 구성에 맛도 확실히 보장돼 있어서 가성비 좋은 고깃집 찾는 분들께 적극 추천하고 싶은 곳이에요!고기도 적당히 식감이 있고 딱 맛있었어요!ㅎㅎ고기 먹으면서 밀면 곁들이면 예술이죠 캬밀면도 간이 딱 좋고 육수도 맛있었어요.양이 기본적으로 다 푸짐해서 대식가들이 좋아할 것 같아요ㅎㅎ네이버예약을 하고 갔더니 사장님께서 김치찌개 밀키트를 선물로 주셨어요. 여러분도 네이버 예약하고 가세요!! 사장님 왤케 퍼주세요 ㅠㅠ금성식당 : 네이버방문자리뷰 1,751 · 블로그리뷰 1,253m.place.naver.com​계산대에서 계산 후에는 룰렛을 돌려보라고 하셔서나갈 때 룰렛을 돌려서 음료수 나왔더니 다음번 방문때 음료수 서비스 쿠폰을 챙겨주셨어요!0초0초광고 후 계속됩니다.다음 동영상subjectauthor취소청주 가경동맛집 강서동맛집금성식당 후기재생2좋아요0좋아요공유하기재생 (space/k)재생00:100:00:00재생 (space/k)재생음소거 (m)음소거00:00/00:10실시간설정전체 화면 (f)해상도자동 480p자막사용 안함재생 속도1.0x (기본)해상도자동 (480p)1080pHD720pHD480p270p144p자막설정사용 안함옵션글자 크기배경색재생 속도0.5x1.0x (기본)1.5x2.0x죄송합니다. 문제가 발생했습니다. 다시 시도해 주세요.도움말음소거 상태입니다.도움말라이센스고화질 재생이 가능한 영상입니다.설정에서 해상도를 변경해보세요.더 알아보기00:00접기/펴기청주 가경동맛집 강서동맛집금성식당 후기📍 청주 금성식당충북 청주시 흥덕구 강서로 770507-1400-7597매월 3번째 월요일 휴무오픈 시간 : 평일 11:40-22:00 / 주말 12:00-22:00 (라스트오더 21:20)​50m© NAVER Corp.더보기/OpenStreetMap지도 데이터x© NAVER Corp./OpenStreetMap지도 컨트롤러 범례부동산거리읍,면,동시,군,구시,도국가금성식당충청북도 청주시 흥덕구 강서로 77 금성식당예약​#가경동맛집#청주터미널맛집#청주강서동맛집#청주회식#생갈비#고기맛집#이베리코#청주고깃집#청주미식투어#청주외식",20250526
청주 가경동 맛집 금성식당 이베리코 목살 필수,"안냐세용 여러분 >_<오늘은 가경동에 푸짐하고 맛있는 맛집네이버 예약하고 가면 김치찌개를 포장해주시는 혜자금성식당 !!벌써 10주년이나 사랑받은 가경동 맛집 >_<생갈비랑 이베리코 꽃목살 필수입니다 여러분​#가경동맛집#청주터미널맛집#청주강서동맛집#청주가경동맛집#청주회식#삽겹살#생갈비#고기맛집금성식당주말12:00 - 22:0021:20 라스트오더평일11:40 - 22:0014:30 - 16:30 브레이크타임21:20 라스트오더정기휴무 (매달 3번째 월요일)​50m© NAVER Corp.더보기/OpenStreetMap지도 데이터x© NAVER Corp./OpenStreetMap지도 컨트롤러 범례부동산거리읍,면,동시,군,구시,도국가금성식당충청북도 청주시 흥덕구 강서로 77 금성식당예약저는 네이버로 예약하고 도착 !!금성상회 금성식당 길 잃어서 세번째 도착ㅋㅋㅋㅋ지도 보시고 가경동으로 터미널 근처니까 잘 찾아 오셔야 합니다저희는 뇌빼고 와버림​​​가게 바로 옆에 주차자리 2대 있는데저희는 위쪽으로 돌아가서 골목에 주차했어용​​칼퇴하고 왔지만 벌써 사람들이 먹고 간 흔적이데이트로도 좋고 가족끼리 오기도 좋고회식하기에도 좋았어요​​​​셀프바가 있어서 부족한 음식은 더 드시면 됩니당​​​우선 메뉴판입니다 >_<​0초0초광고 후 계속됩니다.다음 동영상subjectauthor취소가경동 맛집 금성식당 메뉴판재생3좋아요0좋아요공유하기재생 (space/k)재생00:140:00:00재생 (space/k)재생음소거 (m)음소거00:00/00:14실시간설정전체 화면 (f)해상도자동 480p자막사용 안함재생 속도1.0x (기본)해상도자동 (480p)720pHD480p270p144p자막설정사용 안함옵션글자 크기배경색재생 속도0.5x1.0x (기본)1.5x2.0x죄송합니다. 문제가 발생했습니다. 다시 시도해 주세요.도움말음소거 상태입니다.도움말라이센스고화질 재생이 가능한 영상입니다.설정에서 해상도를 변경해보세요.더 알아보기00:00접기/펴기가경동 맛집 금성식당 메뉴가경동 맛집 금성식당 메뉴판#금성식당#가경동고기집#가경동맛집#청주터미널맛집둘이서 세트 (540g)48,000원찌개선택 고추장짜글이,고기선택 이베리코 꽃목살 시오야키 / 생갈비물냉밀면 7000원​가경동 맛집 !!주문하면 밑반찬부터 주십니당ㅎㅎㅎ엄청 정갈하고 이쁘게 나오져??​​​그리고 세트로 나오는 고추장짜글이 !!이거 본품??이져??짜글이 집임 완전 ;;​​점심시간에는점심특선으로 먹을 수 있는데하,, 회사 근처에도 생기라고요 맨날 갈테니까​​​그리고 고기가 나옵니당 !!​​​청주 가경동 맛집 >_<​와 이거 생갈비가 정말 맛있는데꽃목살? 미쳐버림이거 무슨 맛인데요처음 먹는 고기 맛이었어요​​​저는 목살보다 삼겹살파 인데인생 목살임 진짜로 ;;; 무적권 드세요​​​​생갈비가 원래 귀하거든요근데 와 ㅋㅋㅋㅋㅋㅋㅋ 생갈비 정말 맛있는데 목살 짜세고기도 열심히 굽고​​​셀프바에서 라면사리 하나 갖고와서짜글이에 넣었어용ㅋㅋㅋㅋㅋ​​​​짜글이에 들어있는 고기도 엄청 큼직하고갈비가 들어가있는데완전 감동,,​​​​이렇게 퍼주셔도 되나 싶을 정도임,,​고기가 정말 맛있는게 ㅠㅠ가경동 맛집 사실 고기집은 고기가 맛있어야죠​​​​리얼 육즙 뚝뚝 떨어짐 ㅇㅅㅇ♥︎​​​​금성식당 이러니까 10년째 인기지그리고 나온 냉면 >_<고기먹다가 냉면은 진리잖아요​​​짜글이가 있어서 사실 냉면 먹겠나 했지만웬걸 넘 맛있었어요ㅋㅋㅋㅋㅋㅋㅋㅋㅋ​​​​시원한 육수 한입에 고기 한점장아찌 종류가 여러개였는데그중에 이 나물이 넘 잘어울리고 맛있었어요그리고 양파장아찌랑 ㅠ0ㅠ​​​​갈치속젓 같은데 이 귀한거도 있었음,,전체적으로 신경 많이 쓰신​가경동 맛집 >_<청주 터미널 고기집 찾으시면 금성식당입니닷​​반찬이 하나하나 다 맛있는데그보다 우선 고기가 정말 맛있어서행복했어요​​​저는 대구에서 생갈비 처음 먹은 기억이 넘 좋아서생갈비 찬양자인데이베리코 꽃목살이제가 먹어본 꽃목살 중에 젤 맛있었어요진짜임​​그리고 후식으로는 정겨운 음료가 있었어요ㅋㅋㅋㅋㅋㅋ​계산하고 나면 이제 룰렛? 돌릴 수 있는데다음 방문때 쓸 수 있음 헤헤​​​가경동 맛집 >_< 짱짱 혜자였던게저 네이버로 예약하고 갔더니김치찌개를 주심,,이거 이틀내내 먹었잖아요,,​​고기 더 넣어서 맛있게 먹은,,​넘 맛있고 행복하고,,무조건 재방문이에요 리얼임고기가 넘 맛있었던 금성식당​사장님 또 갈게요ㅋㅋㅋㅋㅋㅋㅋ그럼 이만총총0초0초광고 후 계속됩니다.다음 동영상subjectauthor취소청주 가경동 맛집 금성식당재생0좋아요0좋아요공유하기재생 (space/k)재생00:590:00:00재생 (space/k)재생음소거 (m)음소거00:00/00:59실시간설정전체 화면 (f)해상도자동 480p자막사용 안함재생 속도1.0x (기본)해상도자동 (480p)720pHD480p270p144p자막설정사용 안함옵션글자 크기배경색재생 속도0.5x1.0x (기본)1.5x2.0x죄송합니다. 문제가 발생했습니다. 다시 시도해 주세요.도움말음소거 상태입니다.도움말라이센스고화질 재생이 가능한 영상입니다.설정에서 해상도를 변경해보세요.더 알아보기00:00접기/펴기금성식당 맛도리 후기♥︎청주 가경동 맛집 금성식당#이베리코꽃목살#생갈비#금성식당#가경동맛집#가경동고기집",20250518
