title,content,date
청주 오송역 근처 왕친절한 갈비찜 맛집 본미옥,"안녕하세요 짱구서냉 입니다.건강한 한 끼, 그리고 갈비찜에 진심인곳 바로 '본미옥'인데요! 청주 오송 쪽에서는 이미 꽤 유명한곳이기도 하죠. 여기 진짜 찐입니다.장소, 분위기, 그리고 음식까지.왜 이렇게 인기 있는지 알겠더라고요!​저처럼 청주 근처의 맛집을 찾고 계시는 분들께 도움이 되고 싶어서 오늘 방문 후기를 준비했어요.위치 & 주차장50m© NAVER Corp.더보기/OpenStreetMap지도 데이터x© NAVER Corp./OpenStreetMap지도 컨트롤러 범례부동산거리읍,면,동시,군,구시,도국가본미옥 청주점충청북도 청주시 흥덕구 오송읍 오송생명3로 65-26 1층 102호본미옥은 청주 오송역 근처에 자리 잡고 있어서교통 접근성이 아주 좋아요.차로 이동한다면 오송역에서 5분도 채 안 걸리는 거리에 있어요. 네비게이션을 따라오면 큰 어려움 없이찾을 수 있답니다. 매장 바로 앞에 주차공간이 마련돼 있어서 따로 주차 걱정은 안 하셔도 돼요.주차 자리가 꽉 찼을 경우엔 근처 공영 주차장도 있으니 참고하세요. 주변에는 오송호수공원도 가까워서 식사 후 산책하러 가기도 딱 좋더라구요.특히, 공원 풍경이 좋아서 덤으로 힐링까지!오송역 근처에서 맛집을 찾는다면이곳이 딱 제격이에요.영업시간​토10:00 - 21:0014:30 - 17:00 브레이크타임20:30 라스트오더일정기휴무 (매주 일요일)월07:00 - 21:0014:30 - 17:00 브레이크타임20:30 라스트오더화07:00 - 21:0014:30 - 17:00 브레이크타임20:30 라스트오더수07:00 - 21:0014:30 - 17:00 브레이크타임20:30 라스트오더목07:00 - 21:0014:30 - 17:00 브레이크타임20:30 라스트오더금07:00 - 21:0014:30 - 17:00 브레이크타임20:30 라스트오더메뉴본미옥은 설렁탕과 냉면이 대표 메뉴 라고 합니다.특히, 자가제면으로 만든 함흥냉면은 많은사람들에게 사랑받고 있는 메뉴래요,고기 러버인 저는 오늘도 고기를 시켰습니다.갈비찜 대짜리를 말이죠.제가 일이 끝나고 방문하는거라서 마감시간이살짝 촉박하여 사장님께 부탁하여가는도중에 전화로 주문을 하였는데방문하니깐 갈비찜이 바로 나왔어요.갈비찜이나 갈비탕 못하는곳은 아시죠 다들살이 뼈에서 쏙 빠지지 않는것을요..하지만 본미옥은 집게로 갈빗대를 들자마자그냥 ~ 쏙 빠지는것 아니겠어요.. 또한고기질감도 엄청 부드럽고 담백하니 먹는 내내와 진짜 여기 갈비찜도 잘하네 냉면맛집인데갈비찜도 너무 잘하니깐 완전 럭키비키 자나?오늘 저녁은 본미옥 갈비찜 어떠세요?분위기매장에 들어섰을 때 느낀 첫인상은'깔끔하고 정돈된 분위기네'였어요.가게 내부는 오픈형 구조로 되어 있고,테이블 간 간격도 넉넉해서 편하게 식사할 수 있었어요.특히 점심시간이 한창 바쁠 때였지만북적거림 없이 안정적인 분위기가 인상적이었답니다.그리고 한쪽에 깔끔하게 정리된 조미료와물 셀프바가 있어서 불편함 없이 이용 가능했어요.​웨이팅할 걱정도 크게 없을 정도로넓은 공간도 마음에 들었습니다.여기저기 포인트로 나무와 따뜻한우드톤의 인테리어가 조화를 이뤄고급스러운 느낌마저 들었어요.전반적으로 깔끔하고 밝은 분위기가 음식 맛에대한 기대감을 더 높여줬습니다.맛평가Previous imageNext image제가 주문한 갈비찜은 고기도 부드럽고 고기의신선도 또한 훌륭했습니다. 너무 짜거나 달지도 않고담백하니 계속해서 당기는맛 이었어요.​고기의 양 또한 넉넉하게 들어 있었어요.갈빗대 또한 모두 큼직큼직해서식사 시간 내내 너무 만족함 충만하게 먹을수 있었어요.총평Previous imageNext image본미옥은 청주 오송을 대표하는 맛집 중 하나로,설렁탕부터 자가제면 함흥냉면까지 꽉 찬 맛을경험할 수 있는 곳이에요.​편리한 위치와 깔끔한 매장 내부,그리고 음식 그 자체의 퀄리티까지,여러모로 매력 넘치는 식당이라는 생각이 들었습니다.0초0초광고 후 계속됩니다.다음 동영상subjectauthor취소오송역맛집재생0좋아요0좋아요공유하기재생 (space/k)재생00:510:00:00재생 (space/k)재생음소거 (m)음소거00:00/00:51실시간설정전체 화면 (f)해상도자동 480p자막사용 안함재생 속도1.0x (기본)해상도자동 (480p)1080pHD720pHD480p270p144p자막설정사용 안함옵션글자 크기배경색재생 속도0.5x1.0x (기본)1.5x2.0x죄송합니다. 문제가 발생했습니다. 다시 시도해 주세요.도움말음소거 상태입니다.도움말라이센스고화질 재생이 가능한 영상입니다.설정에서 해상도를 변경해보세요.더 알아보기00:00접기/펴기오송역맛집오송역맛집#오송역맛집청주 방문 계획이 있으시거나 오송역 근처에서 맛집 검색 중이라면, 본미옥 꼭 한 번 들러보세요.​​",20250614
[청주식당/오송읍]호민객잔 - 방송에도 나온 오송 중화요리... ,"[청주식당/오송읍]호민객잔​​​​주말에 들른 중식당호민객잔.원래는 간단히 짜장면이나 먹고 가려던 참이었는데, 내부 분위기도 좋고,메뉴도 다양해서 제대로 한 끼 먹고 왔어요.알고 보니‘생방송오늘아침’ 방송에도 나온 맛집이더라고요!방송에 나온 데는 이유가 있다더니, 정말 만족스러운 식사였답니다.​​​​​​​🍜 방송에 소개된 중식당, 신뢰감 상승입구에서부터 눈에 띄는 건MBC 방송 출연 인증 현수막!‘청주MBC 생활력’에 11월 28일, ‘MBC 오늘아침’엔 12월 6일 방송된 곳이라 그런지 벌써부터 기대감이 생기더라고요. 29년 경력의 주방장님이 직접 요리하신다니 맛도, 정성도 남다를 수밖에요.​​​​​​​​호민객잔주소 :충북 청주시 흥덕구 오송읍 오송생명8로 214 1층 호민객잔전화번호 : 043-231-9929​​이용시간월 - 일 11:00 - 21:00마지막 주문 20:30토요일 정기휴무​​​​🏠 넓고 깔끔한 내부, 단체모임도 가능할 듯!내부는 굉장히 넓고 좌석 간 간격도 여유로워서 쾌적하게 식사할 수 있었어요. 자연광이 잘 들어오고 블랙&우드톤의 인테리어도 세련된 느낌. 평소 조용한 분위기를 선호하는 분들이나가족 모임, 회식 장소로도 손색 없을 것 같았어요.TV에서는 야구 경기도 틀어줘서 스포츠 좋아하시는 분들도 좋아하실 듯!​​메뉴판​​​📋 메뉴판 살펴보기 – 식사부터 요리, 주류까지 다양!식사류로는볶음밥, 잡채밥, 해물덮밥, 유산슬덮밥 등 총 12종요리류는깐풍기, 류산슬, 멘보샤, 양장피, 사천탕수육, 고추잡채 등 정통 중식 메뉴 총출동코스요리는 인원수에 따라 A~C코스로 나뉘며,**쉐프특선 코스(1인 45,000원)**도 있어 고급 모임에도 어울릴 것 같아요.주류도소주, 맥주, 고량주, 연태고량, 공부가주, 마오타이 황금주까지 구비되어 있어 회식 장소로도 Good!​​​​​​​​🥢 반찬도 정갈하고 셀프 시스템으로 편리해요기본 반찬으로는단무지와 양파볶음이 제공되는데,테이블 옆에셀프바가 따로 있어 추가로 자유롭게 이용할 수 있어서 정말 편했어요.​​​​0초0초광고 후 계속됩니다.다음 동영상subjectauthor취소호민객잔재생2좋아요0좋아요공유하기재생 (space/k)재생00:100:00:00재생 (space/k)재생음소거 (m)음소거00:00/00:10실시간설정전체 화면 (f)해상도자동 480p자막사용 안함재생 속도1.0x (기본)해상도자동 (480p)1080pHD720pHD480p270p144p자막설정사용 안함옵션글자 크기배경색재생 속도0.5x1.0x (기본)1.5x2.0x죄송합니다. 문제가 발생했습니다. 다시 시도해 주세요.도움말음소거 상태입니다.도움말라이센스고화질 재생이 가능한 영상입니다.설정에서 해상도를 변경해보세요.더 알아보기00:00호민객잔​​​​​🍜 우리가 주문한 메뉴 – 짜장면, 삼선짬뽕, 깐풍기 전부 만족!이날 저희가 주문한 메뉴는짜장면,삼선짬뽕, 그리고깐풍기였어요.짜장면은 말할 것도 없이 기본에 충실한 맛. 윤기 자르르한 소스에 고기와 양파가 푸짐하게 들어가 있고,면발도 탱탱해서 호로록 먹는 재미가 있더라고요.​​​​​​삼선짬뽕은 해물이 정말 듬뿍 들어가 있어서 만족도가 높았어요.홍합, 오징어, 새우 등 신선한 해물에 불맛 가득한 국물까지 더해져서,너무 맛있게 잘 먹었습니다.​​​​​​​​그리고 이 날의진짜 주인공은 단연 깐풍기! 사진만 보면 ‘그냥 깐풍기인가?’ 싶을 수도 있는데…실제로 먹어보면 완전 반전!튀김옷이바삭! 소리 날 정도로 완벽하게 튀겨졌고,속 고기는 촉촉하고 부드럽게 잘 익었어요.무엇보다양념이 자극적이지 않고 간이 딱 좋아서 계속 손이 가는 맛이더라고요.솔직히 말해서 지금까지 먹어본 깐풍기 중에서도 손에 꼽을 정도로 맛있었어요.깐풍기 맛집으로 인정!​​​​​​📝 총평 – ""오송 중식의 품격, 호민객잔에서 느끼다""‘호민객잔’은 단순한 동네 중국집이 아니라 고급 중화요리의 느낌까지 살린 중식 전문점이었어요.합리적인 가격에 맛도 훌륭하고, 넓고 쾌적한 매장, 방송에 소개된 신뢰감까지 더해진 곳이라 누구에게든 자신 있게 추천할 수 있을 것 같아요. 다음에는 멘보샤랑 유린기를 도전해보려고요 😊​​:)​​​#청주맛집#오송맛집#오송중국집#오송깐풍기맛집​#청주오송맛집#오송고기맛집#호민객잔#오송중식#청주중국집#오송짜장면#오송짬뽕#청주짬뽕맛집#MBC방송맛집#오송호민객잔​​​​50m© NAVER Corp.더보기/OpenStreetMap지도 데이터x© NAVER Corp./OpenStreetMap지도 컨트롤러 범례부동산거리읍,면,동시,군,구시,도국가호민객잔충청북도 청주시 흥덕구 오송읍 오송생명8로 214 1층 호민객잔​",20250612
"[고과장] 청주 오송 정육식당 정육점 후기, 이제 육회 배달 안... ","#내돈내산​오송 2산단에는고과장이라는 정육 식당이 있는데요!육회와 육사시미를 아주 좋아하는데음식점에 가서 먹거나 배달 시켜 먹으면양도 적고 비싸서만족스럽지 못했어요​그러다 갑자기 생각난우리 동네 정육점 고과장!​​저렴한 가격으로만족스러운 양의 육회와 육사시미를즐길 수 있었답니다~!고과장🧭 충북 청주시 흥덕구 오송읍 오송생명 7로 160☎️ 0507-1476-6710⚠️ 주차장 없음❗️단체 이용 가능, 포장 가능, 아기 의자최근에 확장한 고과장은한우와 한돈을 취급하는 정육 식당이에요​신선한 고기를바로 저렴하게 먹을 수 있는 장점이 있어요❗️점심 메뉴❗️돈 듬뿍 김치찌개한우 스지 된장찌개김치찌개 정식, 제육볶음 정식물냉면/비빔냉면한우 수제 떡갈비육회 비빔밥남녀노소 좋아하는최고의 한식 메뉴들을점심 메뉴로 판매하고 있네요~!​가격대도 괜찮아 보여서주말이나 평일 점심 회식으로꼭 이용해 보고 싶어요찌개 거리, 국거리, 불고기 등필요한 고기를 말씀드리면바로 썰어 주셔서신선도가 좋습니다저희는 육회와 육사시미각 200g을 요청드렸어요​고기 써는 것을 기다리는 동안앉아 있으라고친절하게말씀해 주셨습니다!한돈, 한우 할 것 없이가성비가 다 너무 좋아요거기다가 술까지 저렴하니안 갈 이유가 없습니다!바로 옆쪽은여느 고기집과 다를 바가 없는데이미오송 맛집으로 소문났는지넓은 매장에 사람이 아주 많더라고요~​매장에서 식사 시상차림비가 추가되는 점 참고해 주세요~저희가 주문한육회와 육사시미입니다​육회 소스도 같이 넣어 주셔서 센스 굿~!​저게 다 해서2만 원 중반의 가격대라는 것이믿기지 않아요...(나 왜 지금껏 밖에서 사 먹었니..)육사시미는집에서 직접 소스를 만들어 보았어요~​꽤 그럴듯한 맛과 비주얼이 나와서만족스러웠습니다​(이번에는 일품 진로와 함께..)두툼하게 썰린 육회에넣어 주신 육회 소스를 넣고 살짝 버무려 주니윤기가 좔좔흐르는 게군침이 싹 도는 비주얼입니다밖에서 파는 냉동 육회보다맛도 훨씬 좋고양은 많고 저렴해서 대대 만족!육사시미는 말할 것도 없죠!​고기가 신선하고 물리지도 않았고가끔 질긴 힘줄 같은 게 씹히지만맛과 양은 너무나 만족스러웠습니다고과장충청북도 청주시 흥덕구 오송읍 오송생명7로 160 1층앞으로 저희는육회, 육사시미 밖에서 안 사 먹기로다짐했습니다..​왜냐!우리 동네에 고과장이 있으니까요~~정말 만족스러운 2차였어서아직 안 드셔 본 분들은저 믿고 한번 드셔 보셔요 ㅎㅎ​강추입니다!​​다음에는 매장 이용도 해보려고요~",20250611
청북 청주 오송역 KTX / 오송역 버스환승센터,"청북 청주 오송역 KTX & 오송역 버스환승센터여행 목적은 아니고 지인 부고로 충북 청주에 방문할 일이 생겨서 급작스럽게 KTX를 이용하게 되었습니다. 서울역에서 KTX타고 오송역 도착. 오송역 버스환승센터에서 청주 시내로 들어가는 일정이었어요.​​​​KTX를 이용하면 서울역에서 오송역까지 대략 50분 정도가 소요됩니다. 운임요금은 18,500원인데 900원 할인받아서 편도 17,600원입니다.​​​​여행하는 기분은 아니지만 충북은 아주 오랜만의 방문이라 창 밖으로 보이는 풍경이 새로웠습니다. 평일 점심 시간대라 그런지 이용하는 사람은 별로 없었네요.​​​​오송역은 '대전'과 '천안 아산' 사이에 위치하는데 충청북도 청주시 오송읍에 위치한 철도역입니다. 경부고속선과 호남고속선이 분기되는 곳으로 KTX와 SRT 등 고속 열차가 정차하는 곳이에요.​​​​오송역에서 청주역으로 이동하기 위해서는 주로 시내버스를 이용하는데요. 주로 511번 버스와 747번 버스를 이용합니다. 저는 503번을 이용했습니다.​​​​오송역 버스환승센터 이용방법KTX에서 내리면 오송역 3층에서 시작되기 때문에 '오송역 버스환승센터'를 이용하려면 1층으로 내려가야 합니다.​​​​2층에는 승차권을 구입할 수 있는 매표소 · 물품 보관함 · 코레일 라운지(식당) 등을 이용할 수 있어요. 라운지에는 쇼파도 있어 장시간 대기하는 분들은 2층 시설을 이용하면 됩니다.​​​​오송역 버스환승센터는 1층 7번 출구옆에 위치하는데요. 3층에서 에스컬레이터를 타고 1층으로 내려가면 됩니다.​​​​참고로 7번 출구 바로 옆에는 6번 출구가 있는데요. 바로 앞에 코레일에서 운영하는 주차장이 위치합니다. 철도 이용 고객은 30% 할인 받을 수 있으며 경차 · 친환경차 · 장애인 · 국가 유공자 50% 할인이 있으니 참고하세요.​​​​오송역 7번 출구를 나와 오른편에 버스환승센터가 위치하는데요. 청주 시내 뿐만 아니라 청주 공항 · 조치원  · 세종시 · 대전역 등으로 이동할 수 있습니다.​​​​저는 503번을 이용해서 청주 시내로 들어갔는데 시간은 대략 1시간 정도 걸렸네요. 도심내에서만 이동하는게 아니라 도심에서 도심으로 이동하는 버스라 이동 거리가 상당히 길었습니다. 버스마다 줄이 다르기 때문에 해당되는 버스 노선을 보시고(바닥에 쓰여있음) 줄을 서면 됩니다.​​​​서울역에서 청주 시내로의 이동은 급작스럽게 결정된 초행길이라 여러 가지로 헤맸던 기억이 납니다. 오송역이 규모가 크다보니 버스 환승센터를 찾는게 좀 힘들었는데요. 오송역 버스환승센터는 1층 7번 출구를 찾으면 됩니다.​​​​#오송역#오송역KTX#KTX#오송역버스환승센터#청주#충북청주오송역#청주시내#버스터미널50m© NAVER Corp.더보기/OpenStreetMap지도 데이터x© NAVER Corp./OpenStreetMap지도 컨트롤러 범례부동산거리읍,면,동시,군,구시,도국가오송역 (고속철도)충청북도 청주시 흥덕구 오송읍 오송가락로 123",20250608
청북 청주 오송역 KTX / 오송역 버스환승센터,"청북 청주 오송역 KTX & 오송역 버스환승센터여행 목적은 아니고 지인 부고로 충북 청주에 방문할 일이 생겨서 급작스럽게 KTX를 이용하게 되었습니다. 서울역에서 KTX타고 오송역 도착. 오송역 버스환승센터에서 청주 시내로 들어가는 일정이었어요.​​​​KTX를 이용하면 서울역에서 오송역까지 대략 50분 정도가 소요됩니다. 운임요금은 18,500원인데 900원 할인받아서 편도 17,600원입니다.​​​​여행하는 기분은 아니지만 충북은 아주 오랜만의 방문이라 창 밖으로 보이는 풍경이 새로웠습니다. 평일 점심 시간대라 그런지 이용하는 사람은 별로 없었네요.​​​​오송역은 '대전'과 '천안 아산' 사이에 위치하는데 충청북도 청주시 오송읍에 위치한 철도역입니다. 경부고속선과 호남고속선이 분기되는 곳으로 KTX와 SRT 등 고속 열차가 정차하는 곳이에요.​​​​오송역에서 청주역으로 이동하기 위해서는 주로 시내버스를 이용하는데요. 주로 511번 버스와 747번 버스를 이용합니다. 저는 503번을 이용했습니다.​​​​오송역 버스환승센터 이용방법KTX에서 내리면 오송역 3층에서 시작되기 때문에 '오송역 버스환승센터'를 이용하려면 1층으로 내려가야 합니다.​​​​2층에는 승차권을 구입할 수 있는 매표소 · 물품 보관함 · 코레일 라운지(식당) 등을 이용할 수 있어요. 라운지에는 쇼파도 있어 장시간 대기하는 분들은 2층 시설을 이용하면 됩니다.​​​​오송역 버스환승센터는 1층 7번 출구옆에 위치하는데요. 3층에서 에스컬레이터를 타고 1층으로 내려가면 됩니다.​​​​참고로 7번 출구 바로 옆에는 6번 출구가 있는데요. 바로 앞에 코레일에서 운영하는 주차장이 위치합니다. 철도 이용 고객은 30% 할인 받을 수 있으며 경차 · 친환경차 · 장애인 · 국가 유공자 50% 할인이 있으니 참고하세요.​​​​오송역 7번 출구를 나와 오른편에 버스환승센터가 위치하는데요. 청주 시내 뿐만 아니라 청주 공항 · 조치원  · 세종시 · 대전역 등으로 이동할 수 있습니다.​​​​저는 503번을 이용해서 청주 시내로 들어갔는데 시간은 대략 1시간 정도 걸렸네요. 도심내에서만 이동하는게 아니라 도심에서 도심으로 이동하는 버스라 이동 거리가 상당히 길었습니다. 버스마다 줄이 다르기 때문에 해당되는 버스 노선을 보시고(바닥에 쓰여있음) 줄을 서면 됩니다.​​​​서울역에서 청주 시내로의 이동은 급작스럽게 결정된 초행길이라 여러 가지로 헤맸던 기억이 납니다. 오송역이 규모가 크다보니 버스 환승센터를 찾는게 좀 힘들었는데요. 오송역 버스환승센터는 1층 7번 출구를 찾으면 됩니다.​​​​#오송역#오송역KTX#KTX#오송역버스환승센터#청주#충북청주오송역#청주시내#버스터미널50m© NAVER Corp.더보기/OpenStreetMap지도 데이터x© NAVER Corp./OpenStreetMap지도 컨트롤러 범례부동산거리읍,면,동시,군,구시,도국가오송역 (고속철도)충청북도 청주시 흥덕구 오송읍 오송가락로 123",20250608
