title,content,date
조선보리밥 청주 가경동 보리밥 청국장 무한리필 가성비 맛집,"조선보리밥충북 청주시 흥덕구 호암로 1340507-1473-0554​매일 11:00~21:00브레이크타임 15:00~17:00라스트오더 20:30​주차(무료)조선보리밥 가경점#조선보리밥#청주보리밥#청주가성비식당#가경동점심맛집#가경동가성비식당#가경동보리밥#청주꽁당보리밥#가경동생선구이#가경동쭈꾸미조선보리밥; 건강을 먹는 곳조선보리밥 가경점충청북도 청주시 흥덕구 호암로 134 2층+ 묵은지 청국장과 보리밥 정식이 유명한 한식당​+ 화덕으로 구운 고등어구이와 쭈꾸미 볶음은 별미​+ 모든 밥과 찬은 무제한 무한리필​+ 만원도 안되는 가성비 최고의 식당​+ 넉넉한 주차공간조선보리밥 가경점청주에 유명한 복남이네 꽁당보리밥그를 잇는 새로 오픈한 조선보리밥 ㅋㅋ보리밥이 비싼게 이해 안되는 저로썬굉장히 흡족했던 식당이였습니다.​주말 점심 기준, 웨이팅 심함(기본 30~40분)​성인 4명보리밥정식 4인(9,500*4)화덕고등어구이(6,500)화덕매운쭈꾸미(7,500)화덕쌈겹살(3,800)주문​*화덕쌈겹살 원래 가격은 5,500원이지만신메뉴 출시 기념으로 3,800원에 판매중< 메인 >묵은지청국장 보리밥정식 9,500묵은지청국장 쌀밥정식 9,500묵은지청국장 반반정식 9,500어린이정식(5세~9세) 5,500​< 곁들임 >화덕고등어구이 6,500화덕매운쭈꾸미 7,500조선궁중떡갈비 7,500화덕쌈겹살(고추장/간장) 5,500조선보리밥 가경점​​테블릿으로 주문&결제 완료시직원이 밥과 청국장을가져다주시고,빈그릇 12개가 함께 나오는데셀프바에서 원하는 반찬을 담아오면 되는 시스템​다 먹고 난 결론은,곁들임 메뉴는 굳이 안시켜도엄청 배부르게 먹을 수 있다.만원도 안되는 9,500원의 행복가능​이유는,반찬 가짓수가 굉장히 많고보리밥도 무한으로 리필이 가능하다는 것​정식만 시킨다면 성인 4명이 38,000원(밥+반찬 무한리필, 청국장, 숭늉 나옴)요즘 물가를 생각하면 눈물나게 착한 금액​요즘 식당들보면 제육이나 생선 등을끼워넣고 단가를 올려서1인당 15,000~18,000원에 파는곳이 많은데조선보리밥은 곁들임이 선택이라 좋았어요.물론 임대료나 인건비가 워낙 많이 올라서이해는 되지만 서민들의 주머니 사정도 마찬가지이기에...​​​​이렇게 놋그릇이 12개가 나옵니다.셀프바에 가면 그릇이 또 있어요.​​​​원하는 나물반찬들 담아오면 되는데도토리묵부터 장조림, 잡채.. 정말 다양하게 있고,비워지면 바로 바로 채워주시더라구요.​제가 좋아하는 버섯, 애호박, 고사리, 도토리묵,열무김치, 각종 나물들 한가득흑... 행복해요!​무제한이라고 먹지도 못할 양을 잔뜩 퍼오고다 남기면 정말 벌 받습니다 ㅎㅎㅎ​​​​파릇파릇 싱싱한 상추와 쌈장도 있어요.​​​​보리밥이 나오고테이블마다 놓여있는 100%참기름을 넣어줬어요.고소한 냄새 폴폴.​​​​묵은지청국장보리밥과 청국장은 단어만 봐도군침이 도는건 저만 그런건가요 ㅋㅋㅋ청국장을 너무 좋아하지만집에서 먹으면 냄새가 오랫동안....​너무 무겁지 않은묵은지가 들어가 새콤한 맛의 청국장이네요.맛은 좀 가벼워요(?) ㅎㅎ​​​​다양한 나물들 올리고고추장 한스푼~​​​​6,500원 고등어크기가 생각보다 커서 놀랐어요.화덕으로 구워 겉바속촉정말 촉촉하고 맛있었던 고등어구이​​​​쌈겹살은 특별한 맛은 없고할인된 금액이 아니라5,500원에 사먹었다면돈이 아까웠을것 같은 느낌​매운쭈꾸미는 이름값을 톡톡히 합니다.매워요...그렇게 매운맛만 찾아다니던 내가언제부터 맵찔이가 된것인가ㅠ.ㅠ개인적으로 좀 덜매웠으면 좋겠다는 생각​마지막 매운 속은숭늉으로 달래며 마무리~~~ㅋ​​​​Previous imageNext image조선보리밥은 후식코너도 정말 잘되어있어요.수박/망고 슬러쉬미숫가루, 보리과자, 아이스크림까지~​​​복남이네꽁당보리밥 웨이팅이 너무 길어서대체로 갔던 곳인데의외의 맛집 발견 ㅎㅎㅎ가격도 혜자스럽고 맛있습니다.​​50m© NAVER Corp.더보기/OpenStreetMap지도 데이터x© NAVER Corp./OpenStreetMap지도 컨트롤러 범례부동산거리읍,면,동시,군,구시,도국가조선보리밥 가경점충청북도 청주시 흥덕구 호암로 134 2층​",20250811
[청주 가경동] 가경동 고기맛집 가경 터미널 근처 맛집 고기맛집... ,"박달박가네 숯불껍데기영업시간16:00부터 24:00까지​정기휴무없음​주소충북 청주시 흥덕구 풍년로119번길 3 1층​주차가게앞 도로 주차​전화043-231-8477​​청주 여행에서 아이들과 갈수있는식당을 검색했고 고기도 먹음직스러워 보여도착한 박달 박가네 숯불 껍데기​​​가게내부검색했을때 고기만 보고 등받이가 없다는걸 못봐서깜짝 놀랬다😳​그렇지만 초딩과 유딩은잘 앉아있었다.​​​박달박가네 메뉴​일단 꼬들살 14,000원목항정 껍데기 14,000원박가네 껍데기 9,000원​계란밥 2개 4,000원​주문했다.​​​주문하니 숯불이 도착에어컨이 너무 빵빵해서불을 쬐는 딸램​왼쪽 꼬들살 오른쪽 목항정 껍데기개인적으로 꼬들살이 맛있고목항정 껍데기는 기름으 많았다.​​​박가네 껍데기는꼬들꼬들 부드럽다.​​​기본 반찬은 파절이 대신 콩나물 무침이었는데쌈에 같이 싸서 먹으니 맛있었다.​​​셀프바는 아닌듯한데마늘과 야채가 있다.​콩나물 추가는 따로 요청해야 한다.​​​​고기를노릇노릇 굽자​​​조금씩 구어서 한입 쏙 넣으니 꼬들꼬들​​야채에 싸서 먹어도 맛있다.​​​​아이들 줄 계란밥을 주문했다계란후라이2개, 김가루와 참기름이들어가 있어 고소하다.​​​꼬들살 추가 주문하고 김치를불판에 올렸다.​​​고기가 맛있어서 배불리 먹었다.😊​​​청주 맛집 인정​​​50m© NAVER Corp.더보기/OpenStreetMap지도 데이터x© NAVER Corp./OpenStreetMap지도 컨트롤러 범례부동산거리읍,면,동시,군,구시,도국가박달박가네숯불껍데기 청주가경점충청북도 청주시 흥덕구 풍년로119번길 3 1층​#청주가볼만한식당#청주고깃집#청주고기집#청주고기맛집#가경동맛집#가경동고기집#가경동회식#가경동고깃집맛집#청주아이랑고기#청주아이와고기#청주아이랑식당#청주아이랑식당추천#청주박달박가네숯불껍데기#청주막고기#가경동꼬들살#청주식당#커넥트현대청주식당",20250810
청주맛 가경동맛집 가경동고기집 부뚜막 삼겹살,"#청주맛집#가경동맛집#청주삼겹살#청주고기집#가경동고기집#청주가경터미널맛집#청주부뚜막#부뚜막​삼겹살이 먹고 싶어 찾은곳!가경터미널맛집 부뚜막에 다녀왔어요~!​50m© NAVER Corp.더보기/OpenStreetMap지도 데이터x© NAVER Corp./OpenStreetMap지도 컨트롤러 범례부동산거리읍,면,동시,군,구시,도국가부뚜막 본점충청북도 청주시 흥덕구 풍산로25번길 14 1층 부뚜막예약부뚜막 위치는, 롯데마트 앞쪽~  가경터미널시장에서 세븐일레븐 옆 건물이라서 쉽게~ 찾을수 있어요~!365일 6시 이전 손님에게는 소주나 맥주 1병이 무료라니!!!조금 일찍! 식당에 도착해서~ 술한병 받으세요! ㅎㅎㅎ 5천원~6천원 하는, 술값 생각하면, 한병 무료도 엄청 좋은 서비스같아요!​또~ 계란후라이와 아이스크림, 셀프바를 무한으로~ 이용할수 있어요~!저녁7시, 사람들로 북적북적!조금만 늦었음, 자리없었을뻔! ^^자리에 앉아 곧 기본찬을 세팅해주셨어요부뚜막세트메뉴가 있어서~ 2인세트로 주문해보았어요~삼겹살, 마블목살, 눈꽃항정살이 450g이 나오고, 김치찌개를 선택했어요~ ^^고기 숙성 냉장고도 보이네요~!옥수수콘치즈가 나오고, 파김치, 양념게장이 나왔어요~ 소금, 와사비, 와사비마요소스, 쌈장, 궁채, 콩나물무침, 파절이가 나왔어요~파절이 휙휙~ 섞어주고나니~ 고기가 나왔어요삼겹살, 마블목살, 항정살과 함께 새송이버섯, 팽이버섯, 양파, 꽈리고추가 나왔어요달궈진 불판위에 고기를 올려봅니다~손님은 왕! ^^ 친절하게~! 사장님의 열정적인 마인드가 느껴지네요~!두툼한 목살~ 적당한 기름기의 삼겹살~넘넘 맛있어보입니다~한상 푸짐한데~ 맥주가 빠질 수 없죠~!짠~!!!시원한 맥주가, 더위를 잊게 해주네요!노릇노릇 굽굽 굽굽~ 완전 맛난 부뚜막 삼겹살 목살 ㅋ술이 술술 들어가요깻잎에 파절이, 고기, 양파, 마늘, 고추, 김치까지~ 올려서 쌈싸먹어요~상추에, 고기올리고 궁채도 올리고~ 옥수수콘치즈도 올려서~ 쌈도 싸먹어요~0초0초광고 후 계속됩니다.다음 동영상subjectauthor취소청주터미널맛집 부뚜막재생0좋아요0좋아요공유하기재생 (space/k)재생00:420:00:00재생 (space/k)재생음소거 (m)음소거00:00/00:42실시간설정전체 화면 (f)해상도자동 480p자막사용 안함재생 속도1.0x (기본)해상도자동 (480p)720pHD480p270p144p자막설정사용 안함옵션글자 크기배경색재생 속도0.5x1.0x (기본)1.5x2.0x죄송합니다. 문제가 발생했습니다. 다시 시도해 주세요.도움말음소거 상태입니다.도움말라이센스고화질 재생이 가능한 영상입니다.설정에서 해상도를 변경해보세요.더 알아보기00:00청주터미널맛집 부뚜막김치찌개가 다 거기서 거기란 생각했는데와..부뚜막 김치찌개는 찐이예요!삼겹살 고기도 듬뿍넣어 끓이셨더라고요~어찌나 맛있던지~ 삼겹살도 좋은데 김치찌개도 술안주로 최고입니다!국물이 끝내줘요!양념게장도 살이 꽉 차 있어요 ^^​볶음밥 1개 주문!김치, 고기 잘게 썰고~ 밥올리고 볶아주어요맛난 볶음밥 완성!무한으로 먹을수 있는, 계란후라이가 있어~ 후라이를 하나 만들었어요~볶음밥위에 올려 같이 먹었지용!넘넘 맛난~~~ 볶음밥입니다~후식으로 아이스크림까지~^^♡한돈, 국산김치 사용하는 터미널맛집 부뚜막삼겹살맛집 찾으신다면요기에서 드셔보세요!",20250810
"청주 가경동 냉삼 맛집 대패삼겹살 5,900원 소주 맥주 2,000원... ","청주 가경동 냉삼 맛집제일쌈대패 가경점​안녕하세요다람쥐네하루입니다:)​오늘은가경동 냉삼맛집이자또간집인제일쌈대패가경점에 다녀왔어요!​지금 소주, 맥주가2,000원 절찬 이벤트중이라꿀정보 놓치지말자고요>_<​제일쌈대패가경점 상세정보주소 청주시 흥덕구 서현로 102-20 1층영업시간 매일 12:00-23:00(라스트오더 22:10)전화번호 0507-1430-5632주차정보 전용주차장 있음50m© NAVER Corp.더보기/OpenStreetMap지도 데이터x© NAVER Corp./OpenStreetMap지도 컨트롤러 범례부동산거리읍,면,동시,군,구시,도국가제일쌈대패 가경점충청북도 청주시 흥덕구 서현로 102-20 1층 103,104호예약#청주가경동맛집#가경동냉삼맛집#가경동대패삼겹살맛집#청주제일쌈대패외관​제일쌈대패 가경점은가경아이파크1차와MBC사이에 있어 동네 주민들에게는이미 유명한 냉삼맛집인데요!​식당 바로 앞에는전용 주차장이넓게 마련되어 있어서모임이나 단체방문에도문제 없을 것 같아요:)​내부사진​제일쌈대패 가경점 내부로 들어서면밝고 쨍한 조명이 반겨주는데공간이 더 깔끔하게 보이는 것 같아요.​테이블은4인 중심으로 구성되어 있고,좌석 간 간격도 여유롭고테이블 자체도 널찍해서편안하게 식사할 수 있답니다:)​그리고​어린이 놀이방도 있어요>_<​안에는 게임기, 뽑기장난감, 책까지작지만 알차게 준비되어 있어아이들도 시간가는 줄 모르고놀기 좋을 것 같아요:)​메뉴정보​제일쌈대패에서는 메뉴 주문 시참고해야 할 몇 가지 팁이 있는데요!​V기본 주문량은500g이상부터 가능고기 종류는 취향에 따라다양하게 구성할 수 있어요~​V고기 주문시, 기본적으로 샤브샤브 제공샤브샤브 안에 넣을 재료들을셀프바에서 마음껏 이용할 수 있어요~​V주류 이벤트 중이라맥주와 소주가 단돈2,000원>_<​셀프바​매장 중앙에 있는셀프바에요:)​깔끔하게 가득 채워진신선한 쌈 채소들이 눈에 쏙 들어오네요!​쌈 채소는 알배추, 깻잎, 상추, 케일,겨자채, 당귀, 청경채 등 있어요~​​또, 대패삼겹살에 곁들여 먹기 좋은파채와 명이나물, 양파절임, 파김치,고사리, 콩나물 등 다양했고,​샤브샤브 재료는 감자, 떡, 수제비,만두, 버섯, 숙주나물 등 군더더기가 없네요~청주가경동맛집 가경동냉삼맛집가경동대패삼겹살맛집 가경동모임​​주문메뉴: 대패삼겹살 5인분, 계란찜, 공기밥2개​셀프바에서 쌈채소부터 곁들임찬까지야무지게 준비해서 한상 가득 채웠네요>_<​​샤브샤브에는 좋아하는 단호박과유부 넣어서 즐겨 볼게요~​​몽글몽글 계란찜도 미리 시켜놓아야빨리 식어서 우리 귀염둥이들맛나게 먹지요>_<​​저절로 맛있게 구워지고 있는?대패삼겹살들>_<​떡사리와 햄사리, 감자까지지글지글 맛있어져라~​​파채에 휘뚜루마뚜루 싸서한입만~~~~크 이맛이에요 ㅎㅎㅎ​대패는 얇은 만큼 후다닥 익어서빨리 먹기 넘 좋은 것 같아요~​​저는 쌈밥집에 오면 종류별로쌈 하나씩 다 먹어보는데,​왠지 건강해지는 기분에쌈마다 맛이 다양해서입안에서 씹는 즐거움을제대로 느낄 수 있어 좋아요:)​요즘 새로 알게된 맛인데쌈에 파인애플 넣어 먹으면왜 맛있을까요 ㅎㅎㅎ​​아이들 좋아하는 바삭한 감자튀김이랑소떡소떡도 만들었어요~​인기폭발해서 고기보다 많이 먹은듯ㅎ_ㅎ​​이건 으른들이 좋아하는거 ㅎㅎㅎ​낮부터 왠 술이냐 하겠지만맥주 소주2,000원인데안 먹으면 왠지 손해인 것 같쥬>_<​​셀프바에 별도로 계란도 있어서셀프볶음밥할때 같이 넣어 먹었어요~​오늘도 다람쥐아빠볶음밥 필살기중 ㅎㅎㅎ​​샤브샤브에 김치랑 칼국수 사리 넣으면바아로 김치칼국수 당첨>_<​너무 먹잘알이라계속 살 못빼는 것 같네요..ㅎ_ㅎ​​식사 후에는 깔끔하게커피와 아이스크림이무료로 제공되니 놓치지 말고후식도 즐겨보세요~​총평​아이들과 외식을 계획 중인 가족이나단체 모임장소를 찾는 분들은부담없는 가격대에여러가지 메뉴를 즐길 수 있는제일쌈대패 가경점에 꼭 방문해보세요>_<#가경동모임#제일쌈대패가경점",20250808
청주 가경동 맛집 말복 오리백숙 가경장수촌,"​가경장수촌​📍주소충북 청주시 흥덕구 2순환로1340번길 9​⏰영업시간10:30 ~ 21:30(14:30~17:00 브레이크타임)​📱예약문의043-237-8040​​✅ 단체예약 가능✅ 주차장 넓음50m© NAVER Corp.더보기/OpenStreetMap지도 데이터x© NAVER Corp./OpenStreetMap지도 컨트롤러 범례부동산거리읍,면,동시,군,구시,도국가본가장수촌 청주가경점충청북도 청주시 흥덕구 2순환로1340번길 9​​든든하게 배채우러 다녀온 가경장수촌인데본가장수촌  청주가경점..?으로 찍고 가면된다가족외식이나 회사회식장소로 이만한 메뉴가 없다고기굽느라 정신 없지도 않고 덥지도 않고예약해놓고 그 시간에 방문하면 바로 먹을 수 있어서 딱 좋아​회식이라면 더 짧은시간에 끝내고 집 갈 수 있으니오히려 좋아?​​외관​​​​​​​​이날 날씨가 너무 좋았다맑은 햇살 받으면서 들어가기!나름 일찍 방문한 거였는데도 손님들 꽤 많았다​이른 저녁 드시는 분들이 많은 듯​​​실내​​​손님 없는 부분만 피해서 찍긴 했는데가게가 엄청 넓다3-40명 대형모임장소로도 가능할 듯회식이든 가족이든 손님 연령대도 다양하고 많았다​더구나 매장은 너무나 시원해밖에서 들어올 때부터 아 시원해라는 말이 저절로 나옴​​​​예약시간보다 30분 정도 일찍 도착한건데도이미 손님들도 많았다​​​​자리셋팅​​​​한방오리누룽지백숙으로 주문했다최소 한시간 정도는 걸리기때문에백숙 먹을거면 미리 예약주문 필수!​​​기본셋팅​​​기본셋팅​​​​엄청 큰 고추아삭이 고추랑은 다른 느낌읯그냔 고추였는데전혀 맵지 않다​겉절이는 말해 무엇하냐마는 백숙이랑 먹기에 딱 좋을 만큼아삭하고 매콤하니 맛남​​​​깍두기와 동치미 무우는 먹기 좋은 사이즈로 잘라먹기어느 하나 버릴 게 없다동치미 국물은 달달하니 입맛 돋우기 딱 좋음​​​한방오리누룽지백숙​​​조금 일찍 도착했음에도 백숙 바로 나왔다압력솥 같은곳에 요리하는거라 오히려 일찍 나오니 더 좋다차가 덜 밀리는 바람에(?) 기다릴거 감안하고 온건데오히려 기다리지 않고 바로 먹을 수 있어서 굿​​​​​누룽지도 같이 나왔다살코기랑 같이 먹어도되고 살코기 좀 먹다가 죽 먹어도되고원하는대로 !​​​​0초0초광고 후 계속됩니다.다음 동영상subjectauthor취소청주 가경동 맛집 말복 오리백숙 가경장수촌재생0좋아요0좋아요공유하기재생 (space/k)재생00:070:00:00재생 (space/k)재생음소거 (m)음소거00:00/00:07실시간설정전체 화면 (f)해상도자동 480p자막사용 안함재생 속도1.0x (기본)해상도자동 (480p)1080pHD720pHD480p270p144p자막설정사용 안함옵션글자 크기배경색재생 속도0.5x1.0x (기본)1.5x2.0x죄송합니다. 문제가 발생했습니다. 다시 시도해 주세요.도움말음소거 상태입니다.도움말라이센스고화질 재생이 가능한 영상입니다.설정에서 해상도를 변경해보세요.더 알아보기00:00청주 가경동 맛집 말복 오리백숙 가경장수촌​​죽은 방금 나온거라 보글보글 아직도 끓는 중​​​​죽이랑 같이 세트!​​​​창가자리 앉으니 뭔가 야외같고 더 맛있는 느낌!​​​​3대가 함께 할 수 있는 보양식마침 우리 옆쪽테이블에 할아버지랑 부모님 그리고 애기가 같이와서 3대가 먹고 있었는데애기가 좀 칭얼대니 파티션 쳐주셨다알아서 센스있게…​누룽지백숙이 고단백 저열량 영양식이라고 하니다이어터들에게는 희소식​그리고 이번엔 안 먹었는데 본가장수촌의 쟁반메밀막국수 맛있다!여럿이 방문하는거라면 메밀막국수 꼭 먹어보기우리는 죽 먹고 배가 불러서 못 먹었지만​​​사이드메뉴​​​​그 외 술한잔 하러 온거라면안주 곁들이거나 아이들 먹을거리로왕새우튀김도 있고전병만두 닭발은 매콤하니 술안주로 먹기!​​​​고춧가루와 가자미를 제외하고는 모두 국산 사용​​​​닭백숙과는 살결이 조금 다른 오리백숙약간 살결이 좀 더 거친(?) 느낌이지만막상 먹어보면 식감 부드럽다제대로 안 삶으면? 질길 것 같은 비주얼인데너무 부드럽게 잘 씹힌다​​​​소금에 콕 찍어서 김치랑 같이 먹기​​​​살짝 느끼?할 때 쯤 콜라샤워시원하니 너무 맛있다​​​​죽 먹을 때 누룽지 꼭 같이 먹기미리 누룽지 넣어서 끓여진거라 쫀득하니 맛있다평소 생각하던 바삭한 누룽지랑은 또 다른 느낌이다​​​​녹두랑 이것저것 많이 들어간 영양만점 죽이랑오리 살코기올리고 김치 얹어서 냠냠죽 한그릇 금방 다 먹어버렸다​​​후식​​​후식은 커피와복숭아아이스티매실아이스티더부룩한 느낌이라면 매실아이스티 추천소화에 도움주는 매실액​​​​한모금 먹어주고 마무리!​​​​메뉴는 조금씩 차이나긴하지만!그리고 가자미미역국과 조개미역국 판매하고 있으니혹시 생일기념으로 미역국 외식하려고 식당 찾는다면#청주미역국#청주미역국맛집가경장수촌 방문해보기​​​주차장​​​주차장 엄청 넓으니 참고​든든하게 너무 잘 먹고 온 청주 몸보신 전문점(?)백숙 전문 가경장수촌​​​#청주몸보신#청주닭백숙#청주오리백숙#청주모임장소#청주오리수육#청주복날",20250806
청주 가경동 빠빠드 의외의 피자 맛집 리뷰,"청주에서 놀만한 곳은정해져있는 것 같더라고요.​그중에서 오늘은 가경동 맛집빠빠드 리뷰입니다!가경동 파파드50m© NAVER Corp.더보기/OpenStreetMap지도 데이터x© NAVER Corp./OpenStreetMap지도 컨트롤러 범례부동산거리읍,면,동시,군,구시,도국가빠빠드충청북도 청주시 흥덕구 경산로36번길 3 1층​파파드인줄 알았는데알고보니 빠빠드였어요.​​청주 맛집 검색하면 상단에빠빠드가 나오더라고요.​심지어 학교 에타에서도 추천하는 맛집 .. !​​​저렴한 가격에 양도 많은데심지어 맛까지 있어서 인기있는 것 같아요.웨이팅을 걱정하면서 갔는데,역시나 웨이팅을 했답니다.웨이팅 썰풀기, 아쉬웠던 점​저희가 갔을 때다양한 연령대의 손님들이식사중이더라고요.​테이블 자리는 만석이었고바테이블 자리가 있었는데거기 앉겠냐고 물어보셨어요.​​각종 집기들이 줄지어 있고그다지 정돈된 느낌도 아니었는데거기로 안내를 해주셔서 당황 ;;;​이 부분은 좀 아쉬웠어요.​​당황해서 일행이랑 눈빛 교환하고 있는데다른 테이블 손님들이다 먹었다고, 곧 나간다고 이야기 해주시더라고요.​평소 웨이팅이 어떻게 이루어지는지는 모르겠으나,제가 방문했을 때에는 상당히 아쉬운 대처였습니다.​빠빠드 메뉴​파파드는 양식 전문 식당이에요.메뉴별로 원산지 표기가 잘 되어 있네요.​​주문은 테이블오더로 했습니다.선결제 시스템이었어요.​저희는 피자, 파스타, 필라프한 개씩 주문했어요.​​기본적으로 앞점시, 포크, 숟가락이 세팅되고종이컵을 주십니다.플라스틱 컵이라도 주었음 더 좋았을 것 같아요.​​청주에서 여러 식당을 다녀보며 느낀건데음료를 주문하면 뚱캔이 아니라페트가 나오더라고요.​개인적으로 마음에 드는 청주의 문화(?)미트토마토파스타 11000원​미트토마토파스타가 제일 먼저 나왔어요.딱 봐도 양이 많아보였어요.​​특이한 점은파스타 위에 소세지가 올라가 있더라고요.토마토 베이스 파스타에 소세지 조합은나폴리탄 밖에 안 먹어봐서 색달랐어요.​김치필라프 11000원​김치필라프도 같이 나왔어요.역시나 위에 소세지가 올라가 있습니다.​양식당 와도 김치는 포기 못하는 한국인들 ㅋㅋ​​​필라프도 양이 정말 많았어요.1인 1메뉴면 충분히 배부르게 먹을 것 같아요.​​​아쉬운점 22 ...반숙이 촤르르 흐르는 반숙이 아니고편의점 반숙란 재질이에요.​넘나 아쉬운 것 ,,,​토마토&루꼴라피자 19000원​주문한 메뉴 중 가장 비쌌던토마토 루꼴라 피자입니다.​한 판 사이즈가 그렇게 크지는 않아요.​​그런데 도우가 정말 정말 맛있었어요.약간 화덕에 구운 피자 느낌이었어요.​보통 피자 꼬다리는 맛 없어서 남기는데,여기서는 싹싹 먹고 나왔어요.​​피자 꼬다리에 치즈가 가득 들어서흠 비쌀만하군 이라고 생각했어요.​​​치즈 듬뿍 피자라서 먹다보면 살짝 물릴 수 있는데그때는 타바스코 뿌려서 변주를 주었답니다.​총평앞에서 이야기했던웨이팅 관련 이슈로 첫 인상은그렇게 좋지 않았어요 ㅎㅎ​그런데 음식이 정말 맛있어서,식당 나올 때는 웃으면서 나왔습니다.직원분들도 친절하셨어요.​데이트할 때 가기 좋은 식당인 것 같은데,피자 + 파스타 조합으로 주문 추천드립니다.​#청주피자#파파드#가경동맛집#청주맛집#피자맛집#청주데이트#가경동피자#웨이팅맛집#청주핫플#피자플레이스",20250806
