title,content,date
청주 오송역 인근 중국집 요리 잘하는 집인 아리대반점,"청주 잘 갈일이 없던 그런 동네임에도 청주 오스코쪽으로 8월 하순으로 넘어가는 시점에 가게 될 일이 있었고 그때 주변 식당들 중에서 점심 식사하러 들어가게 된 곳이었는데 아리대반점이 바로 그곳이었다.오송역이랑도 가깝고 청주 오스코랑도 가까운 그런 위치에 있던 곳인데 여기가 중식요리를 잘하는 집이었던 것이다. 청주 자체도 처음이었는데 청주에서 생애 처음으로 갔던 식당이 중식요리 잘하는 그런 집이었던 것.그래서 여기서 처음이자 유일하게 될 청주포스팅으로써의 맛집인 아리대반점에 대한 설명은 밑에서 더 이어가겠다.50m© NAVER Corp.더보기/OpenStreetMap지도 데이터x© NAVER Corp./OpenStreetMap지도 컨트롤러 범례부동산거리읍,면,동시,군,구시,도국가아리대반점충청북도 청주시 흥덕구 오송읍 연제만수길 59아리대반점주소 : 충청북도 청주시 흥덕구 오송읍 연제만수길 59영업시간 : 10:30 - 21:00(20:10 라스트오더)매주 수요일 정기휴무연락처 : 043-236-2909단체이용, 포장, 배달, 예약, 주차가능외부모습외부모습은 이렇게 되어 있다. 물론 뒷문으로도 들어가게 되는 경우도 있다.그리고 이렇게 보여도 주차는 가능하다는 사실.....(관광버스도 주차 하려니까 되는 그런 곳이었다. 그렇지만 주차공간 여유롭고 그런건 아니고 뒷편에 2대정도 가능한 수준)규모는 일단 적당한 편이었다.내부모습내부모습이고 자리마다 테블릿이 있었다. 근데 테블릿 모양이 조금 개성넘친다?자리 채워지기 전에 후다닥 찍은 모습....누군가 등장직전에 찍어준 덕에 그나마라도 이렇게 건진거다. 여기 보이는건 셀프바.반찬 더 덜어먹을 수 있는 그런 곳이었다.내부모습 다양하게는 못건지긴 했지만 얼추보면 그래도 평범해보이던 그런 곳이었다. 하지만 맛은 평범하지만은 않았다.주문메뉴일단 메뉴판은 이랬다. 저기사 사천짜장이 보이길래 바로 그걸로 픽.살짝(?) 타이밍 놓치고 늦게찍은 군만두.그리고 나온 사천짜장. 혹시 사천짜장 맛보신 분들 있을까 싶다. 사실 서울쪽에서도 한두번정도는 이런 비주얼의 사천짜장을 맛보곤 했는데 그때도 좋은 인상이었고 해서 여기서 보이길래 바로 시킨 것이다. 그야말로 이열치열 도전기. (참고로 이때 8월달)반찬이랑 같이 해서 담아본 사진. 양파들이 잔뜩 올려진 가운데 보이는 새우....... 보통 짜장이라고 한다면 춘장이 들어간 모습 상상하겠는데 이건 붉으스럼한 그런 게 올라가 있다보니 베리베리 핫 이런 식이었다.맛은 어땠느냐.... 맛있었다. 맛있게 매웠을뿐. 먹는 순간에는 맛있었던게 너무 괜찮았다. 역시 이맛이야 라고 속으로 외치면서 먹었는데 예전에 맛본 그 느낌을 그대로 느낄 수 있던 것이다. 하지만......... 그 댓가로 뱃속에서는 대화재가 발생했다고 한다.....지금 이사진을 보고 있자니 왜 더 안먹었나 후회가 올라올 정도였는데 이때도 더 먹을까 했지만 시간이슈 + 뱃속에서 발령된 진돗개하나 상황때문에 여기서 굴복......(진돗개하나 발령이 뭔뜻인지 모르는 분들을 위한 간단설명 - 전면전 발발에 주로 발령되는 것)사실 뭣모르고 곱빼기로 시킨 것도 있으니 이건 뭐........ 다음번에는 사천짜장 먹게되면 곱빼기 도전한답시고 까불지만 않으면 좋을거 같을 뿐.그래도 맛있게 잘먹은 건 사실이다.마무리청주 오스코도 개장한지 얼마 안된 그런 전시홀이고 해서 앞으로는 많이 주목할 만한 그런 장소이기도 했던게 오스코 주변상권이었다. 게다가 오송역이랑도 가까우니 이정도면 더 말할 것도 없겠다. 오송역 근처에서 식사해야 겠는데 중식이 땡긴다고 한다면 무조건 가라고 하고 싶다. 그정도로 괜찮았던 인상을 받을 수 있었던 그런 곳이었다.​​​​​#청주중식집#오송역맛집#오스코맛집#오송역중식집#오스코중식집#아리대반점#사천짜장",20251028
청주 오송역 맛집 오송 호수공원 맛집 본미옥 메뉴 가격... ,"​안녕하세요 :)​오늘 나규남매는 일본 여행가요!!​이나의 다섯번째 해외여행 그리고​이규의 두번째 해외여행인데 목적지는​코로나펜데믹 이전 가봤던 그리고 한적하니​너무 좋았던 기억이 있는 기타큐슈에요 ㅋㅋㅋ​차량 사고 이슈로 이번 여행은 ktx타고 오송역가서​버스로 청주공항 가는 일정인데 점심은 오송역 맛집​오송 호수공원 맛집 본미옥 아이들 데리고 다녀왔어요50m© NAVER Corp.더보기/OpenStreetMap지도 데이터x© NAVER Corp./OpenStreetMap지도 컨트롤러 범례부동산거리읍,면,동시,군,구시,도국가본미옥충청북도 청주시 흥덕구 오송읍 오송생명3로 65-26 1층 102호본미옥​충북 청주시 흥덕구 오송읍 오송생명3로 65-26매일 07:00~21:00​B/T 14:30~17:00​L/O 20:30​매주 일요일 휴무​아기의자 ⭕️​민생회복소비쿠폰 ⭕️2~3 가능한 전용주차장 ⭕️​홈플러스익스프레스 건물​1시간 무료 주차청주 설렁탕 맛집 청주 냉면 맛집 본가옥​직접 뽑은 자가제면으로 만든 냉면과​진한 사골의 맛을 느낄 수 있는 청주 흥덕구 맛집​오송역에서 차로 2~3분 거리 도보로 15분 거리에​아침 식사도 가능하니 오송역 근처 맛집으로 추천스​그리고 나규남매같이 청주공항 가시는분우​도보 10분거리 정류장에서 한번에 공항까지​가는 버스도 있으니 완전 개꿀이죠 ✌️ ✌️내부도 넓고 깔끔하죠​이른 시간부터 식사하는 손님도 3팀이나​사장님도 반갑게 맞아주셔서 기분 좋았어요청주 오송 함흥냉면 맛집 본미옥​100% 자가제면 업조에요​담백한 음식 외 얼큰한해장국도 개시​오송역 근처라서 아침 해장하기 좋음 :)메뉴판이에요 :)​여러 종류의 곰탕​자가제면 냉면​모듬수육​갈비찜 등등​다양하고 맛도리 메뉴들설렁탕 2인 22.0​갈비만두 7.0기본 상차림이에요​아기식기, 아기의자 있어서 편리하죠​오송역 근처 아이와 가기 좋은 맛집​설렁탕집에 김치가 절반은 먹고 들어가는데​김치부터 바로 맛보았어요 ㅋㅋㅋㅋ​비쥬얼 합격 맛도 합격짜잔​주문한 설렁탕 등장​국물이 아주 그냥 담백하죠그리고 고기 양도 넉넉스​아이들 데리고 가기 설렁탕, 곰탕​갈비탕 등 고기와 국물 조합 음식이 최고국물도 진짜 진해요​왜 사골국물을 판매하시는지 알 수 있음​국물이 보약 남김 없이 다 먹어야겠어요면도 국물에 담그고​이나가 면 러버라서 이나 몫​청주 설렁탕 맛집 오송 호수공원 맛집 추천그리고 밥과 고기, 버섯 마지막 김치​맛이 없을 수 없는 맛집이에요 ✌️​아이들도 너무 잘 먹어요 :)이제는 만두 타임​고기, 김치, 갈비 만두 판매하고 있고​나규남매네는 갈비 만두로 주문했어요​아이들과 함께 먹기 좋은 갈비만두죠만두의 윤기....ㅎㅎㅎ​냉면이다 설렁탕에 만두는 꿀조합​일본 여행 가기전 오송역 근처 맛집 본미옥에서​배불리 식사하고 걸어서 공항가는 버스타러 고고식당에서 정류장까지 넉넉히 10분 컷​그럼 여행 떠나볼게요 🇯🇵🇯🇵청주 오송 설랑탕 맛집으로 여름​자가제면 냉면도 별미에요 :)#청주설렁탕#청주냉면#오송호수공원맛집#오송역맛집#흥덕구맛집#오송역설렁탕맛집#오송역냉면맛집#오송역갈비찜맛집#오송호수공원갈비찜맛집#오송호수공원냉면맛집",20251023
청주 오송역 맛집 [만만재] 점심시간전 이미 만석 시원한... ,"​​​안녕하세요~구름이맘입니다.청주에 여행온 김에뜨끈한 국물이 먹고 싶어 폭풍검색 한 곳청주 오송역 맛집 [만만재]​만두와 국물이 기가막히다고 해서찾아왔습니다.​​​​​​​자가제면집청주 오송역 맛집 [만만재]식당 문을 열자마자 퍼지는황태육수의 고소한 향!이건 이미 “국물 맛집”임을 예고하고 있죠.여기만만재는 매일 직접 빚은수제만두,그리고자가제면 칼국수면을사용하는 게 포인트라네요.​​​​청주 오송역 맛집 [만만재]이집은 오픈런을 해야 하나봐요.11시오픈인제 제가 11시30분쯤 갔는데거의 만석이에요~​​네이버 지도만만재naver.me​📍매장정보주소:충북 청주시 흥덕구 오송읍 오송생명14로 339 1층 101호전화번호:0507-1353-6839영업시간월~금 11:00 - 20:00(브레이크타임 14:30 - 17:00)토요일 11:00 - 14:30일요일 정기휴무🚗주차안내11:30~14:00 점심시간에는 주차단속 유예!매장 앞 도로에 주차 가능 👍​50m© NAVER Corp.더보기/OpenStreetMap지도 데이터x© NAVER Corp./OpenStreetMap지도 컨트롤러 범례부동산거리읍,면,동시,군,구시,도국가만만재충청북도 청주시 흥덕구 오송읍 오송생명14로 339 1층 101호​​​​저는칼만둣국, 친구는떡만둣국,그리고고기만두를 추가로 주문했습니다.음식 나오자마자 사진 찍기 바쁘고,코믹하게 말하자면“국물 뜨기 전에 사진 찍느라 식을까 봐 손 떨림 주의”깍두기, 겉절이 ,양파장아찌 말이 필요없습니다.​​​​첫 숟가락 딱!“어머, 이건 해장용 아닌가요?”황태육수의 깊고 시원한 맛이속까지 쏙~ 들어옵니다.깔끔한데 감칠맛이 진하게 남는 게,마치 속이 맑아지는 느낌이에요.면은 자가제면이라 그런지 쫄깃쫄깃!국물에 오래 있어도 퍼지지 않고 끝까지탱글하게 살아있어요.이거 진짜 손맛 제대로입니다.​​​​친구가 주문한떡만둣국은 쫀득한떡 덕분에 식감이 더 재밌어요.떡이 육수를 머금어서 한입 한입이 진하고 따뜻한 맛!국물도 칼만둣국과 동일하게시원한 황태베이스라 만족도 짱!!​​​​칼만둣국에 들어간 김치만두는적당히 매콤하고 개운하게맛을 잡아줘요.매운맛이 아니라, 김치의 시원한 산미가육수의 구수함이랑 섞여서한입 먹을 때마다‘얼큰+시원’이 동시에 터지는 느낌이에요.​​​​청주 오송역 맛집 [만만재]의 칼만둣국은입안이 느끼할 틈이 없고,국물과 김치만두가 만나니까 완벽한 궁합이더라고요.특히 김치만두 속에 잘게 썬 배추김치가아삭하게 씹히는데,그 식감이 또 별미예요.​​​​​​​​만두는 또 다른 감동이에요.옛날에 할머니가 해주시던집만두 맛그대로!피는 얇고 쫄깃,속은 꽉 차 있고 육즙이 흘러나옵니다.한입 먹자마자“이건 진짜다…” 싶었어요.고기, 당면, 부추가 어우러져서담백+고소+촉촉삼박자가 완벽칼만둣국 안에 들어간 김치만두도 훌륭했지만,따로 주문한 고기만두는 더 크고,한입 먹으면 “국물 대신 육즙 폭발”이에요.​​​​​솔직히만두 하나만으로도 방문할 가치 충분!국물보다 먼저 감탄이 나온 게 바로 만두였어요.먼저고기만두부터 —만두피가 얇고 살짝 투명해서안에 속이 비칠 정도예요.한입 베어물면 따끈한 육즙이 ‘톡’ 터지는데,그 속엔 다진 고기와 당면, 부추, 두부가촘촘하게 들어있어요.​고기의 풍미가 진하게 느껴지면서도전혀 느끼하지 않고,부추 향이 은은하게 퍼지니까 입안이 깔끔해져요.그냥 ‘속 꽉 찬 집만두’가 아니라,할머니 손맛+정성 한 스푼+육즙폭탄삼합 그 자체​​​​​마치고기만두는 포근한 겨울이불 같고,김치만두는 알싸한 봄바람 같은 맛이라고 할까요?결론은?“고기만두는 밥반찬용, 김치만두는 해장용,둘 다 국물친구!”이 조합이면 칼만둣국이든 떡만둣국이든완벽합니다.​​0초0초광고 후 계속됩니다.다음 동영상subjectauthor취소황태육수가 끝내주는 만만제 칼만둣국,떡만둣국재생1좋아요0좋아요공유하기재생 (space/k)재생00:270:00:00재생 (space/k)재생음소거 (m)음소거00:00/00:27실시간설정전체 화면 (f)해상도자동 480p자막사용 안함재생 속도1.0x (기본)해상도자동 (480p)720pHD480p270p144p자막설정사용 안함옵션글자 크기배경색재생 속도0.5x1.0x (기본)1.5x2.0x죄송합니다. 문제가 발생했습니다. 다시 시도해 주세요.도움말음소거 상태입니다.도움말라이센스고화질 재생이 가능한 영상입니다.설정에서 해상도를 변경해보세요.더 알아보기00:00접기/펴기황태육수가 끝내주는 만만제 칼만둣국,떡만둣국​​청주 오송역 맛집 [만만재]에식사 중간중간 손님들이 계속 들어오는데,다들 “칼만둣국 두 개요~”, “만두 추가요~”외치시는 거 보니이 동네 사람들 사이에서도진짜점심 맛집으로 자리 잡은 듯했어요.​​​요약하자면✅ 황태육수의 깊고 시원한 국물 맛✅ 매일 직접 빚는 수제만두의 정성✅ 쫄깃한 자가제면 칼국수✅ 점심시간엔 자리 경쟁전!✅ 주차 스트레스 없이 도로 주차 가능​​​다음에 또 오송역 근처 오면 무조건 재방문각입니다.시원한 국물 생각날 때, 든든한 한 끼 원하신다면청주 오송역 맛집 만만재, 이 집 강추합니다.",20251022
리뷰] 청주 오송역 맛집 추천! 오리 주물럭 맛집 호식당... ,"​안녕하세요, 언더불독입니다.청주시 흥덕구 오송읍에 위치한오리 주물럭전문점호식당을 소개합니다!🐮호식당🐷​⏱️위치정보충북 청주시 흥덕구 오송읍 오송생명5로 184-6 1층 101호일부호 호식당(도로명)충북 청주시 흥덕구 오송읍 연제리 722(지번)​⏰️영업시간11:00 - 22:00(15-17시 브레이크 타임, 매주 일요일 정기휴)​📞전화번호0507-1305-2155​🚘주차정보주차장O​✨️기타정보대기공간, 단체O, 유아의자O호식당충청북도 청주시 흥덕구 오송읍 오송생명5로 184-6 1층 101호일부호 호식당​주차호식당 위치는 오송 홈플러스익스프레스 바로 우측에 위치하고 있습니다.주차는 건물 2층에 1시간 무료주차 가능합니다.호식당에서 식사학 주차 등록을 하거나 홈플러스 이용을 하면 주차 정산 가능합니다.외관호식당 외관입니다.홈플러스 건물에 위치했고 바로 옆에 있어 찾기 쉬웠습니다.내부호식당 내부 사진입니다.오리 고기를 맛있게 먹는 방법과 원산지 표지판이 있습니다.국물이나 양념이 튀는 것을 방지하기 위한 일회용 앞치마도 비치되어 있습니다.호식당 셀프 코너입니다.셀프 코너에서 부족한 반찬을 추가로 먹을 수 있습니다.호식당 매장 내부 모습입니다. 매장이 밝고 넓습니다.​메뉴호식당 메뉴입니다.백반 메뉴는 1인분 주문 가능하고 뚝배기로 제공됩니다.2인분 부터 전골 형태로 제공됩니다.모든 메뉴 포장 및 배달 가능하고, 도시락도 판매하고 있으니 배달 어플 주문시 참고하시기 바랍니다.주문한 음식호식당 오리 요리 주문시 기본 상차림입니다.육전까지 나왔는데 육전이 정말 맛있었습니다.오리 주물럭이 나왔습니다!13~15분 정도 익히고 먹어야 합니다.떡들은 양념이 흘러 내리는 것을 방지하는 역할을 합니다.파채는 다 익기 전 마지막에 넣어서 볶아 먹으면 됩니다.완성된 오리주물럭의 모습입니다!매콤 달콤한 양념이 오리고기 속에 잘 배어 들어 맛있었습니다.여기에 김가루 넣고 볶음밥 넣어 먹으면 맛있습니다.저는 이번에 배가 불러 못했지만 다음에 방문시 시도할 예정입니다.청주 오송에서 맛있게 매운 오리주물럭 집을 발견해서 좋네요.​호식당은 오리고기 요리 전문점이기도 하지만 한식 전문점입니다.추가로 돼지고기 김치찌개를 주문했는데 우리가 흔히 생각하는 맛있는 김치찌개 맛이었습니다.김치찌개 안에 돼지고기 가득 들어 있고, 묵은지의 깊은 맛이 김치찌개 맛을 살려 주었습니다.추가정보호식당에서 호두과자를 판매하고 있습니다.천안 호원당이라는 브랜드로 호두 과자 안에 앙버터가 들어가는 것이 특징입니다.인기가 많아 예약 대기중인 상품도 있었습니다.저는 레몬딜 호두과자를 구매했습니다.냉동고에서 보냉팩으로 정성스럽게 포장하여 주셨습니다.상자를 열자 유산지로 덮여 있고,우측 상단에 맛있게 먹는 방법이 적혀 있습니다.당일 섭취, 냉동 보관, 30분 해동 섭취를 하면 됩니다.생긴 것도 아기자기 하게 귀여운데호두 과자 안에 앙버터가 들어가 있어 고급 스러운 맛이 났습니다.레몬딜이 함유 되어 상큼한 레몬향이 첨가된 앙버터 호두과자 맛입니다.지인들에게 선물로 구매하는 것도 괜찮을 정도로 맛있었습니다.총평청주 오송의호식당은 오리 주물럭 전문점으로, 신선한 재료와 정갈한 상차림이 돋보이는 곳입니다. 매콤달콤한 양념이 오리고기 속에 촘촘히 스며든 주물럭은 쫄깃하고 부드러워 계속 젓가락이 가는 맛입니다. 기본 반찬부터 육전이 제공되고 깊은 맛의 돼지고기 김치찌개까지 맛있었습니다. 식사 후 볶음밥을 더하면 완벽한 마무리! 함께 판매하는 천안호원당 앙버터 호두과자는 상큼한 레몬딜 향이 매력적이며 선물용으로도 훌륭합니다. 밝고 넓은 매장 분위기, 무료주차, 셀프코너까지 갖춘 편리한 식당으로 가족 외식, 회식 모두 추천드리는청주 오송 오리맛집 호식당입니다.50m© NAVER Corp.더보기/OpenStreetMap지도 데이터x© NAVER Corp./OpenStreetMap지도 컨트롤러 범례부동산거리읍,면,동시,군,구시,도국가호식당충청북도 청주시 흥덕구 오송읍 오송생명5로 184-6 1층 101호일부호 호식당#호식당#오송역맛집#오스코밥집#오스코도시락#오스코회식#오송역밥집#오송역백반#오송역회식#호두과자전액기부#착한가게#청주맛집#오송맛집#오송호식당#오송오리맛집#청주오리주물럭#청주오리맛집#오송역맛집#오송백반#오송도시락#오송회식장소#오송한식맛집#청주한식맛집#청주주물럭맛집#청주밥집#오송밥집#호원당호두과자#앙버터호두과자#언더불독#레몬딜호두과자#호원당",20251018
오송역 주차장 요금 코레일 라운지 식당 맛집 카페,"오송역 주차장 주차요금오송역 코레일 라운지오송역 식당, 맛집, 카페오송역50m© NAVER Corp.더보기/OpenStreetMap지도 데이터x© NAVER Corp./OpenStreetMap지도 컨트롤러 범례부동산거리읍,면,동시,군,구시,도국가오송역 (고속철도)충청북도 청주시 흥덕구 오송읍 오송가락로 123​​​​​​1. 오송역​​세종과 가장 가까운 KTX역이라 종종 방문하는오송역​​청주 오송역은 국내 유일의 고속철도 분기역으로 지난 한 해 이용객이 역대 최고치를 기록했다고 해요​​세종시의 핵심 교통수단인 BRT(간선급행버스 체계)는 현재 모두 7개의 노선을 운영하고 있어 20~30분 정도면 오송역에 도착하긴 하지만 그래도 자차만큼 편한 건 없죠​​​​​2. 오송역 주차장​오송역 주차장은 코레일에서 운영하는A(346대), C(88대), D(480대)주차장과​​민영 주차장인B(437대), E(470대), K(246대)주차장이 있어요​​오송역 주차장 주차요금​A, C, D 주차장30분까지 1,400원10분 당 700원1일 주차 10,000원​B 주차장30분까지 1,500원30분 당 1,500원1일 주차 13,600원​E 주차장30분까지 2,000원15분 당 1,000원1일 주차 12,000원​K 주차장30분까지 1,000원15분 당 500원1일 주차 7,000원코레일이 운영하는A, C, D는철도이용객 30%, 경차, 친환경차, 장애인, 유공자 50% 할인​민영 주차장인B, E는철도이용객 30%, 경차, 장애인, 유공자 50% 할인​​​​지도를 보면 C 주차장이 가장 가깝지만 88대밖에 주차할 수 없고​​K 주차장은 주차요금이 가장 싸지만 가장 멀리 있습니다오송역 B 주차장 뒤쪽 음료 한 잔(6,000원)만 구입하면 당일 주차요금이 무료인드롭탑 오송역언더패스점주차장이 있어요​​오송역 주차장으로 대부분 C 주차장과 드롭탑주차장을 이용하시는 것 같은데요​​​​개인적으로 C주차장과 드롭탑 주차장은 만차인 경우가 많아​​개인적으로 주차대수도 여유롭고 다리 아래라 사계절 내내 주차하기 좋은B 주차장을이용하는 편입니다​​​​​3. 코레일 라운지 식당 맛집 카페​​오송역 2층에 코레일라운지가 생겨​​기차 타기 전 여유롭고 편하게 휴식을 취할 수 있어요라운지 07:00~22:00푸드코트 20:30 마감​​​​라운지김밥, 푸드스탑, 진면방, 실크테라, 젤라또, 할리스커피 등​​오송역 맛집, 오송역 카페 등이 있어 간단한 식사와 음료를 즐길 수 있는데요​​​​폭신한 소파공간부터 혼밥하기 좋은 바테이블 그리고 창가 쪽 수많은 테이블까지​​편안하게 식사와 커피 한 잔 등 휴식을 취할 수 있어서 오송역 갈 때마다 방문하는 것 같네요​​​​곧 오픈할 2층의 삼송빵집을 비롯 샌드&커피 카페도 있고​​​​3층에는 토리만주, 엔제리너스, 호두과자, 복순도가, 롯데리아, 던킨도넛 등의​​오송역 식당, 오송역 맛집, 오송역 카페 등이 있습니다​​​​그 외 편의시설로 2층의 꽃집, 약국, 편의점도 있지요​​​​​4. 총평​​항상 붐비는 오송역 주차장에 대해 알아보았는데요​​코레일이 직접 운영하는 A, C, D 주차장은 코레일 앱에서 실시간 주차현황을 조회할 수 있어요​​​​주차정산도 가능하니 활용해 보세요​​​​",20251005
