title,content,date
속리산 문장대 / 문광저수지 / 남도식당,"2024.10.19​예전부터 가고 싶었던 속리산 등반법주사 코스로 천왕봉~문장대 돌려다가 너무 힘들 것 같아서문장대코스 선택!​문장대코스만 돌고오면 아쉬워 점심먹고 은행나무로 유명한문광저수지까지 정복!​​10km© NAVER Corp.더보기/OpenStreetMap지도 데이터x© NAVER Corp./OpenStreetMap지도 컨트롤러 범례부동산거리읍,면,동시,군,구시,도국가문장대경상북도 상주시 화북면 장암리남도식당경상북도 상주시 화북면 문장로 1703-1 남도식당문광저수지충청북도 괴산군 문광면 양곡리 16​시간일정09:54속리산 문장대13:40남도식당(식사)15:00문광저수지​1. 속리산 문장대문장대경상북도 상주시 화북면 장암리​​문장대로 가는 가장 빠른코스는 여기 '화북탐방지원센터' 찍고 가면 됨화북탐방지원센터경상북도 상주시 화북면 장암리​시간일정09:54화북탐방지원센터 출발11:30문장대 도착13:10화북탐방지원센터 도착등린이 기준 왕복 3시간 15분 소요 (쉬는시간 5분 x 4 포함)​​​주말이라 주차료 5,000원 지불 후 주차장으로 이동​​대형주차장(버스)을 지나​​소형주차장 도착50대는 댈 수 있을 듯토요일 09:00 기준 널널했고, 14:00도 널널했음​​탐방지원센터랑 화장실 있음마지막 화장실이니 무적권 들리기​​지도 한번 쓱~ 봐주고​​주차장에는 벌써 단풍이 떨어지고 있었음​원래 혼자 09시 출발이었는데, 급 선배 쪼인요청으로 09:54분 출발​​등산 전 한컷언제 저길 올라가지..​​마지막 화장실이라고 다시 알려주는 친절한 속리산​​통제시간도 한번 슬쩍 봐주고​​​비 오는날 산행은 처음이라 설레는 마음으로 출발이때만 해도 이렇게 많이 올 줄은 몰랐지​​열심히 표지판을 따라 으쌰으쌰​​쉴바위를 지나​​법주사, 문장대 합류코스 도착​​벌써 산 위쪽은 단풍이 새빨갛게 물들었다아직 많이 부족하지만 등산할 때 항상 느끼는게 있다​우리가 살아가는 땅에서는 보이지 않는 많은 변화들이 산에서는 진행되고 있다평소 내가 보고 느끼는 것들이 전부가 아니며, 세상 어딘가에는 그 나름대로 또 다른 세상과 사람들이 있다좁은 시야에 갇히지 않게, 항상 많은 사람들과 많은 대화를 해보려고 노력하자​올라가는 건 힘든 과정이지만, 내려가는 건 한순간이다항상 조심히 살자​올라갈 때는 헉헉대며 땅만 보고 오르기 바쁘지만, 내려갈 때야 비로소 주위 풍경이 보인다익숙함에 속아 소중함을 잃지 말고, 평소 내 사람들에게 감사함을 표시하고 최선을 다하자​​첫 우중산행정상에서 청명한 하늘과 아름다운 풍경을 보지 못할 것임을 예상했다.반대로 올라가며 빗물이 만든 맑은 계곡소리와 뿌연 안개가 낀 조금은 몽환적인 분위기가 좋았다.무엇이든 한번에 얻기는 어렵다​​드디어 도착한 문장대인증샷 찍으려는 사람들이 한가득이다.​​나도 살포시 한장​​엄청난 각도의 계단을 타고 전망대를 올라가본다​​엄청난 광경으로 유명한 문장대이지만역시나 예상했던대로 아무것도 보이지 않는다아름다운 풍경을 기대하며 등산을 하게 되지만, 통제할 수 없는 '날씨'라는 변수로 인해 아쉬웠던 적이 한두번이 아니다.덕유산, 소백산, 이제 속리산도 추가​반대로 생각하면 좋은 경험이었다고 생각하며, 다음에 또 와보면 되겠다​​아쉬운대로 구름속에서 한컷​​정상에서 간단하게 요기​​안개속을 향해 하산하고 있는 김관..​아무것도 만지지 않았는데, 왜이렇게 쪼개졌지;​등린이들도 충분히 가능한 산난이도는 ★★☆☆☆​​2. 남도식당원래 가려던 식당들이 죄다 문을 닫아 반강제?로 갔는데너무 친절하고 맛있었던 식당나중에 누구랑 문장대 또 오면 다시 데려가고 싶은 식당연탄불향 제대로인 석쇠불고기 꼭 드세여​[속리산 문장대 맛집] 남도식당 / 석쇠불고기.. : 네이버블로그[속리산 문장대 맛집] 남도식당 / 석쇠불고기 맛있는 집속리산 등산 후 송어회, 예향, 효리네밥상 고민하다가 많이 문 닫아서 들렸는데 너무 친절하고 맛있었던 집...blog.naver.com남도식당경상북도 상주시 화북면 문장로 1703-1 남도식당​​3. 문광저수지​전국적?으로 유명한 은행나무 명소인 문광저수지사실 아직 물들지 않은 걸 알면서도, 미래의 내 가족과 다시 올 것을 대비하여 주변 유명 관광지는 먼저 들려 선행학습 해놓는 편사진찍고 한바퀴돌고 1시간 정도면 충분!선배 소개팅으로 대구 언능 보내고 혼자 거닐었다​문광저수지충청북도 괴산군 문광면 양곡리 16​가는날이 장날이라고 축제기간이다​​축제기간이라 간단한 음식도 팔고 어르신들 노래자랑도 하고 계신다이런 로컬 축제를 올 때마다 어르신들을 많이 보게 된다막걸리를 곁들이며 흥겹게 놀고 계신다'저기 어르신들도 모두 열렬히 노력하신 젊은 시절이 있었겠다' 생각이 든다.평소 맡을 수 없었던 사람 냄새가 흠뻑 나서 좋다​​화장실도 깨끗하게 잘 관리되고 있었음​​안내도 살짝 봐주고​​저수지 입구에 사진 프레임이 있어 한장 찰칵뭐가 좋아서 저렇게 찐 웃음을 짓고 있었지?​​한눈에 보이는 문광저수지의 은행나무길​​아직 만개하지 않았지만 그 나름대로 변곡점의 맛이 있다​​워낙 풍경이 이뻐서누추한 피사체라도 괜찮게 보이는 마법​​점프샷 지속적으로 실패한 김관..​0초0초광고 후 계속됩니다.다음 동영상subjectauthor취소[속리산 문장대 등 여행] 속리산 문장대 / 문광저수지 / 남도식 (1)재생10좋아요0좋아요공유하기재생 (space/k)재생00:050:00:00재생 (space/k)재생음소거 (m)음소거00:00/00:05실시간설정전체 화면 (f)해상도HD720p자막사용 안함재생 속도1.0x (기본)해상도1080pHD720pHD480p270p144p자막설정사용 안함옵션글자 크기배경색재생 속도0.5x1.0x (기본)1.5x2.0x죄송합니다. 문제가 발생했습니다. 다시 시도해 주세요.도움말음소거 상태입니다.도움말라이센스고화질 재생이 가능한 영상입니다.설정에서 해상도를 변경해보세요.더 알아보기00:00접기/펴기[속리산 문장대 등 여행] 속리산 문장대 / 문광저수지 / 남도식 (1)0초0초광고 후 계속됩니다.다음 동영상subjectauthor취소[속리산 문장대 등 여행] 속리산 문장대 / 문광저수지 / 남도식 (2)재생10좋아요0좋아요공유하기재생 (space/k)재생00:040:00:00재생 (space/k)재생음소거 (m)음소거00:00/00:04실시간설정전체 화면 (f)해상도HD720p자막사용 안함재생 속도1.0x (기본)해상도1080pHD720pHD480p270p144p자막설정사용 안함옵션글자 크기배경색재생 속도0.5x1.0x (기본)1.5x2.0x죄송합니다. 문제가 발생했습니다. 다시 시도해 주세요.도움말음소거 상태입니다.도움말라이센스고화질 재생이 가능한 영상입니다.설정에서 해상도를 변경해보세요.더 알아보기00:00접기/펴기[속리산 문장대 등 여행] 속리산 문장대 / 문광저수지 / 남도식 (2)​​포도존도 여러곳 있음​​저수지 한바퀴 30분 정도 천천히 돌아주고 귀가​​​어쩌다보니 시간이 생겨 간 속리산, 문광저수지날씨는 좋지 않았지만, 그 나름대로의 고생하는 재미가 있었다.​★문광저수지 은행나무★​​​​",20241025
트레킹 여행  문경새재  문광저수지은행나무길,"♤ 트레킹 여행 일곱째 날 10월 22일 ♤​수안보에서 1박을 하고 오늘은 두 곳을 가기 위해 아침을 먹고 출발하기로 했다.​본가 할매 숨두부. 올갱이해장국. 꿩만두#올갱이해장국과#꿩만두를 먹었다.고향이 충주인지라 어릴 때 올갱이는 많이 먹었더랬다. 아욱에 올갱이를 넣어 끓여 먹으면 밥 한 그릇은 뚝딱이다. 지금은 식당에서나 맛볼 수 있어서 별미 음식이나 다름없다.꿩만두는 사실 그렇게 추천하지 않는다. 담백하기는 하나 모르고 먹으면 꿩만 두인지 고기만두인지 잘 모름. ㅎ여튼 수십 년 만에 추억의 맛을 보았다고나 할까. ㅎ​문경새재 도립공원아침을 먹고#문경새재로 향했다.이런, 하필 이날이#사과축제기간이라니.오전부터 주차장의 차들이 넘쳐 났다. 축제에 온 사람들과 등산객, 관광객들로 넘쳐났다.#문경사과축제는 처음 구경해 본다. ㅎ​탐스런 사과가 주렁주렁~🍎🍎​전동차를 타고 제2 관문까지 가는 사람들이 많았다.홍보용 사과들~🍎#제1관문북적 한 곳을 얼른 벗어나 제1관문까지 왔다. 이곳 잔디 광장에서도 축제를 하느라 방송국에서 오고 난리다. ㅎ​제1관문을 나서자마자 오른쪽으로#여궁폭포#혜국사#대궐터#주흘산을 가는 방향이 나온다. 우리는 여궁 폭포만 구경하고 오기로 했다.그런데 가자고 한 나의 실수. 거의 산 중턱까지 올라야 했고, 경사가 장난 아니었다. 여기 갔다 오느라 기운을 다 빼버림~ㅎㅎ초입은 완만한 평길. 건너편에 큰 은행나무가 있는데 은행이 엄청 커서 구경하고 있는 나. ㅎ조금씩 계곡의 물이 보이기 시작하자 급 경사가 시작된다. 돌길이라 힘들어서 사진 찍는 건 포기. ㅎ드디어#여궁폭포😝이걸 보러 그 고생을 하며 왔던가!!! ㅎ역시 사진으로는 담기지 않는다. 길이가 굉장히 길고 바위 사이로 흐르는 물이 멋있었는데...0초0초광고 후 계속됩니다.다음 동영상subjectauthor취소여궁폭포재생2좋아요0좋아요공유하기재생 (space/k)재생00:290:00:00재생 (space/k)재생음소거 (m)음소거00:00/00:29실시간설정전체 화면 (f)해상도자동 480p자막사용 안함재생 속도1.0x (기본)해상도자동 (480p)1080pHD720pHD480p270p144p자막설정사용 안함옵션글자 크기배경색재생 속도0.5x1.0x (기본)1.5x2.0x죄송합니다. 문제가 발생했습니다. 다시 시도해 주세요.도움말음소거 상태입니다.도움말라이센스고화질 재생이 가능한 영상입니다.설정에서 해상도를 변경해보세요.더 알아보기00:00여궁폭포우리가 오고 나니 사람들이 줄줄이 구경하러 올라온다.ㅎ나이 드신 어르신들도 계시는데(아마도 가족 여행인가 보다.) 폭포 구경은 하셨으려나. 급경사에다 돌길이어서 오르기 쉽지 않았을 텐데. 여튼, 우리는 폭포를 구경하고 다시 1관문으로 내려가 새재 길을 걸었다.땀도 많이 흘리고 힘도 들고 해서 한동안 쭈욱 걷기만 했다.​지름틀 바우조령원 터 - 1관문과 2관문 사이에 위치한 고려와 조선조 공용으로 출장 가는 관리들에게 숙식을 위한 시절이었다.​#제2관문걷는 길에 볼거리들이 많아 심심찮게 걸을 수 있어 좋다. 그런데 그 많은 사람들은 다 어디 간 거야???ㅋㅋㅋ역시 축제에만 진심인 건가??ㅎㅎ원래는#제3관문까지 가려고 했는데 폭포를 갔다 오는 바람에 시간도 지체됐고, 여기서 내려가는 시간도 있어서  2관문까지만 걷고 다시 복귀하기로 했다. ㅎㅎ​내려와서#사극드라마셋트장을 구경하고,#문광저수지은행나무길로 향했다.참, 올 때 사과를 사 왔는데 대박 맛있다. 감홍이라는 사과인데 마트에서 사 먹는 사과랑은 진짜 비교도 안 될 정도다. 지인들한테 선물을 했더니 평생 먹어본 사과 중에 제일 맛있다고 아주 감탄을 하더라는. ㅎ문광저수지 은행나무 길코스모스는 끝물이라 거의 져버렸다.문광저수지 은행나무 길이 그렇게 유명하다는데 이번 가을은 우리가 빨리 온 건지 단풍이 늦게 드는 건지 아직은 모든 게 초록이 더 많다.사과랑 감만 가을을 맞는 듯하다. ㅎ​문광 저수지 한쪽 라인을 데크로 뚝방까지 걸을 수 있게 만들어 놔서 좋다. 데크와 뚝방쪽에서 보는 은행나무는 또 다른 느낌을 준다. 다만 노랗게 물들기 전에 보고 가는 것이 아쉽다. 지금쯤은 노랗게 들었을라나? ㅎ​여기도 가을이어서 인지 축제를 하는 것 같다. 먹거리와 여러 가지 상품들을 파는 부스들이 몇 개 있는데 평일이라서인지 오픈한 부스는 네 개뿐. 배를 싸게 팔아서 두 봉지를 사 왔다. 배도 사각거리면서 엄청 달다. 한 봉지 더 살 걸~ㅎㅎ​헤이 춘천 / 담가화로구이 춘천 퇴계점문광저수지 은행나무 길을 마지막으로 오늘의 트레킹은 여기서 마무리. 춘천으로 이동~🚘이동 시간이 길어서 저녁이 다 돼서야 숙소인#헤이춘천에 도착했다. 체크인을 하고 저녁을 먹으러#담가화로구이로 이동. 평일인데도 자리가 만석. 너~무 시끄러워 고기가 어디로 들어가는지도 모르게 먹음. ㅎ어쨌거나 오늘이 길면 길고 짧으면 짧은 트레킹 여행의 마지막 밤이다. 아쉽기도 하면서 집에도 빨리 가고 싶다. ㅎ​​내일은 남이섬으로 이동~🚘",20251025
충북 괴산 맛집 철갑상어회 먹고 문광저수지,"가을을 재촉하는 비가 촉촉~하게 내리던날충북 괴산으로 떠났던 가을여행!문광저수지에서초가을경치 한껏 담고 다시신나게 드라이브하면서멋진 인생샷도 찍었구요.여기까지 왔으니 이 지역의 명물먹거리도 빼놓으면 서운할거같아문광저수지 보고 바로 식사하러 갔던 충북 괴산 맛집!여기서 철갑상어회 한상 고급지게 잘 먹었답니다.​두천매운탕​☎️ 042.832.3210⏰️ 10:30 ~ 21:0050m© NAVER Corp.더보기/OpenStreetMap지도 데이터x© NAVER Corp./OpenStreetMap지도 컨트롤러 범례부동산거리읍,면,동시,군,구시,도국가두천매운탕충청북도 괴산군 칠성면 괴강로 308 두천매운탕​황금빛 노란 은행나무길을 기대하며 달려갔던날~비가 내려 더 운치있게 안개낀 모습을 보여준 문광저수지 은행나무길반영이 근사해서 이제 막 물들기 시작한 은행나무를 배경으로사진찍으며 잠시 분위기있게 거닐어도보구요. ^^저수지 바라보며 그네에 앉아 있으니이런 내모습도 이 경치속에 그대로 들어가있는듯했어요.아마 지금쯤 사방이 다 황금색으로 빛나는환상의 절경을 보여주고 있겠죠.모처럼 가을여행 잘 다녀온 괴산 문광저수지입니다.​위치 주차장충북 괴산군 칠성면 괴강로 308괴강삼거리 만남의광장 휴게소 아래층에 있슴!넓은 주차장 있슴.잠시 달려서 도착한 이곳은 만남의 광장~~이라네!알고보면 이 건물 1층에 있는 식당이문광저수지 근처 맛집인 두천매운탕입니다.모르고 지나가면 평범한 국도변 휴게소라 생각하고지나치기 쉽지만 여기서 한번 식사하면담에 또 찾아오게되는 곳이랍니다.1층 식당에서 식사한 담에 위층으로 올라가서커피 한잔해도 좋드라구요.아주 넓은 주차장이 있어 주차하기에도 편해요.바로 앞에 괴강이 유유히 흐르고있구요.건너편에 울창하게 숲이 우거져있어서맑은 날에 가보면 진짜 경치 근사한 곳이예요.​​이집은 향토음식경연대회에서은상을 입상한 경력이 있구요.괴산에서 인정한 괴산장수밥상 음식점이기도해요.이곳을 첨 찾아왔을때가 벌써 몇년전인데올때마다 맛있게 먹을수있어서 역시제대로 충북 괴산 맛집이구나 싶어요.가을을 맞아 노란 국화가 소담스럽게 피어있는입구 모습 인상적이예요.​식당앞에 기와지붕을 이고있는 수조가 있는데요.메기나 빠가사리 등 다른 생선들도있구요.오른쪽에는 다른데선 보기힘든 철갑상어도 있어요.괴산에서 회를 먹는다면 얼마나 맛있을까 싶지만요이집 철갑상어회 한번 먹어보면 아하~~무릎을 탁 ~치게 된다는 !!! ^^​​​식당내부식당에 들어서면 환한 대리석 바닥에사방에 유리장식장이 보여서 마치어느 궁전에 와있는듯한 느낌이 아주 이색적인 분위기!좀 클래식해보이는 의자와테이블이  좍~~줄지어 정돈이 잘돼있구요.테이블이 많은데 자리 간격이 여유있어서단체로 회식하러 오기에도좋은 충북 괴산 맛집.분위기는 언뜻 레스토랑 같은데 메뉴는일상적으로도 참 친숙한 회에 매운탕이라는거!^^이날 우리가 먹었던 철갑상어회는 좀 특별했지만요.​​메뉴판철갑상어회 大 150,000    中 120,000   小90,000쏘가리회/매운탕 싯가공기밥/수제비/라면서리 1,000철갑상어회는 먹으러오기 하루전에 예약필수!!!이건 바로 회떠서 먹기보다는하루정도 숙성시켜야 가장 맛있답니다.아무리 시간이 없어두 최소 5시간 전에는예약해야 먹을수있다고합니다!그냥 와서 바로 주문하면 못먹으니까 참고.철갑상어에는 콜라겐과 콘드로이친 황산이풍부하다고 하네요.매운탕만 먹기에 좀 아쉬운특별한 날에 먹으러 오기에 좋겠더라구요.​철갑상어회철갑상어회 한상 이렇게 잘 차려집니다.회 찍어먹을 소스도위생적으로 먹기좋게각자 따로 나와서 맘에들구요.초생강과 마늘 락교를 곁들이면한층  더 맛있게 먹을수있다네요.​​반찬으로는 이렇게 골고루 맛있는걸로잘 나오구요.막 튀겨낸 생선까스는 바삭한게입맛돌게 맛있었구요.노란 치자물들인건지 연근이아주 곱게 나오네요.사장님 음식솜씨가 무척 좋으신게여기서도 빛을 발하네요.​탱글하니 맛있었던 도토리묵 무침도.​​철갑상어회는 차가운 옥돌 위에 올려서 나옵니다.가운데 깻잎 위에 얹어나온건 특수부위인데요.생간과 부레 등골  등골집이예요.콜라겐이 많은 부위라서 소화가 잘 안되기 쉽상이라같이 나온 초생강 락교 등과 같이 먹으면훨씬 더 먹기 좋다구해요.철갑상어 간을 제외한 나머지는살짝 익혀서 나온답니다.​야들야들 ~자각자각~~씹히는 맛이 좋은 등골등골집도 특유의 씹는 맛이 좋구요.​철갑상어회 한쌈도 싸먹구요.같이 나온 간마늘에 쌈장 와사비 등골고루 입맛에 맞게 조합해서 먹기!충북 괴산 맛집 아니면 어디서 이런 걸 또 먹겠냐며이날 우린 아주 열심히 먹었답니다. ^^​​​쓸개즙에 소주를 부어서 담은쓸개주도 한잔 ~이정도면 뭐 거의 보양코스인데요. ^^​​회를 다 먹은 후에는 깔끔하고진득한 맛이 좋은매운탕도 먹어요.마치 진하게 고은 곰탕같이국물 한수저 떠먹으면입술이 촥촥 ~달라붙더라구요.역시 콜라겐 풍부한 음식 맞군요. ^^청양고추 들어가서 칼칼한맛까지더해져서 입맛에 잘 맞아꽤 많던 한냄비 다 먹었답니다.밥까지 말아주면 더할것없이 좋구.​또 한가지이건 철갑상어회를 주문하면나온다는메기구이조림입니다.메기구이 자체가 큼직해서 먹기도 좋으데여기에 맛있는 양념까지 끼얹어서철판위에서 지글지글 ~~ 따끈하게 나오니깐다 먹고 배부르다 하면서도또 먹게되더라구요.이 양념도 밥비벼 먹기에 제격이었단.이건 단품메뉴 주문안된다고해요~~!!!와~ 충북 괴산 맛집의 푸짐한 철갑상어회 한상 딱좋아요.​​식사 마치고 우리는 위층 카페에올라와서창밖경치 바라보면서분위기있게 커피타임 가졌어요.맛있는거 먹고 배도 부르겠다간만에 느껴보는 여유로움 참 좋던데요. ^^​​근처 가볼만한곳충북아쿠아리움괴산성당귀한 음식 잘 먹고 나와서 돌아봤던괴산 가을여행지로 찾기좋았던 곳들!식당에서 멀지않았던 아쿠아리움도 볼만하구요.좀더 달려서가면 한창 곱게 물들어가는 느티나무가서있는 고즈넉한 분위기의 괴산성당에도잠시 들렀어요.조용하게 돌아볼만했던 충북 괴산 당일치기코스잘 다녀왔네요.3km© NAVER Corp.더보기/OpenStreetMap지도 데이터x© NAVER Corp./OpenStreetMap지도 컨트롤러 범례부동산거리읍,면,동시,군,구시,도국가충북아쿠아리움충청북도 괴산군 괴산읍 쏘가리길 43천주교연풍성당충청북도 괴산군 연풍면 중앙로홍문2길 140초0초광고 후 계속됩니다.다음 동영상subjectauthor취소충북 괴산 맛집 철갑상어회 먹고 문광저수지 아쿠아리움까지재생23좋아요0좋아요공유하기재생 (space/k)재생00:460:00:00재생 (space/k)재생음소거 (m)음소거00:00/00:46실시간설정전체 화면 (f)해상도자동 480p자막사용 안함재생 속도1.0x (기본)해상도자동 (480p)1080pHD720pHD480p270p144p자막설정사용 안함옵션글자 크기배경색재생 속도0.5x1.0x (기본)1.5x2.0x죄송합니다. 문제가 발생했습니다. 다시 시도해 주세요.도움말음소거 상태입니다.도움말라이센스고화질 재생이 가능한 영상입니다.설정에서 해상도를 변경해보세요.더 알아보기00:00접기/펴기충북 괴산 맛집 철갑상어회 먹고 문광저수지 아쿠아리움까지#충북괴산맛집#두천매운탕#충북괴산맛집#괴산맛집#두천매운탕#철갑상어회#가을여행코스#괴산여행#문광저수지맛집#가을여행추천#괴산먹방#충북괴산#괴산횟집#충북아쿠아리움맛집",20241112
