title,content,date
괴산 문광저수지 근황 - 절정시기와 사진찍기 좋을 때는?,"올해에도 어김없이 충북의 대표 가을 명소로 유명한 괴산 문광저수지 은행나무길을 다녀와보았습니다. 현재 근황이 궁금하신 분들 그리고 언제 가면 좋을지 궁금하신 분들이 글을 봐주실 것 같은데요!올해 (20년 10월 17일) 다녀온 사진과 작년과 재작년 데이터를 공유드려 보도록 하겠습니다.​50m© NAVER Corp.더보기/OpenStreetMap지도 데이터x© NAVER Corp./OpenStreetMap지도 컨트롤러 범례부동산거리읍,면,동시,군,구시,도국가문광저수지충청북도 괴산군 문광면 양곡리 16​주소는 충북 괴산군 문광면 양곡리 16네비게이션에 치면 나오니 편합니다.​추가로 이곳을 가면서 들렸던 맛집과 함께가면 좋을 단풍명소까지 알려드리겠습니다.​이곳이 유명해지기 전이었던 지난 2011년부터 문광저수지의 단풍을 즐겼었는데요. 이제는 너무 많이 알려져 점점 제대로 된 사진을 찍기가 어려워지는 것 같습니다. 그래도 많은 연인분들 가족분들이 틈틈이 멋진 사진 담아내시는 걸 보면 대단하신 것 같아요. 문광저수지 은행나무길은 무려 79년에 300그루의 은행나무를 심은 것이 현재에 이르게 되었다고 하는데요.​우선괴산 문광저수지의 현재 근황을 영상으로 촬영한 것을 공유드립니다.​현재 근황 영상​영상으로만 보셔도 현재의 모습이 충분히 상상이 가시겠죠.?어제 (2020.10.17)도 토요일이라 사람이 정말 많았었는데요. 오늘도 엄청난 인파가 예상됩니다.아직 절정은 아니지만 코로나때문에 많은 분들께서 집콕에 지친 나머지 밖으로 많이 나오신 것 같습니다.​​불편했던 주차, 현재는?​​이곳을 다녀와보신 분들은 한결같이 느끼셨던 것이 주차의 불편함이셨을텐데요.주차장이 원래 없는 것은 아니지만, 충북의 가을 대표 관광지로 급부상하면서 턱없이 부족한 주차대수로 인해 저수지로 오는 길의 길가에는 불법주차가 난무했었고 심지어 주차난이 정말 심각했었는데요. 이 때문에 괴산군에서도 많은 고민을 하셨을거라고 생각해요. 경찰분들도 많이 돌아다니시면서 교통정리를 하려고 노력하셨었던 것이 눈에 선하게 기억이 납니다. 하지만 올해에는 많이 달라진 모습입니다.​저수지 근처의 나대지들이 주차장으로 탈바꿈되었습니다. (사실 전에는 뭐가 있었는지 모릅니다.^^)물론 나가는 곳도 마련을 해둠으로써 교통난 해소까지 된 상태로 불편했던 주차 문제가 상당히 완화가 되었습니다. 절정인 시기가 왔을 때에도 충분히 커버가 가능하리라 생각됩니다. 주차비용은 없습니다. 무료입니다. 향후엔 어떻게 변할지는 모르겠네요.예년에는 언제가 절정이었나?작년과 재작년,올해에 다녀왔던 날짜와 상태입니다.​2018년2018년 10월 18일(노록노록)2018년 10월 25일(절정)→ 2018년에는 10월 25일 절정이었습니다. 그보다 한 주 전에는 노록노록한 상태였었고 단풍은 급격히 들어가는 것으로 확인을 했습니다.​2019년2019년 10월 13일(초록초록)2019년 10월 27일(절정, 부분노록노록)→ 2019년에는 10월 중순, 초록초록했고 다시 찾은 10월 말에는 100%는 아니지만 절정에 가까운 모습이었습니다. +야경까지 있었습니다.​그렇다면 2020년은?☆2020년 10월 17일(노록노록)→ 2020년 10월 17일에는 아직 노록노록합니다. 지난주인 10/10일자에 블로그에 올려주신 블로거님들의 사진을 살펴보니 초록초록한 상태였습니다. 작년과 같은 상황이었고요. 현재는 빛을 강하게 받는 나무들은 샛노란색을 띄는 아이들도 있지만 상대적으로 볕이 적게드는 안쪽으로 들어가면 여전히 절정이 되려면 한 주 정도는 필요하겠다란 생각이 들었습니다. 아래 사진들과 위 포스팅을 보시면서 현재의 상황을 체크해보시고요. 대략적으로 언제쯤이면 초절정일지 생각해보고 방문하는 것도 좋겠습니다만,제 생각에는 돌아오는 주말이 가장 이쁜 시기가 될 것으로 보입니다.​​​안쪽 길 입니다. 볕이 적게드는 안쪽으로 갈수록 녹색을 띄고 있는 모습을 확인해 보실 수 있으십니다.토요일, 엄청난 인파가 몰렸죠 ^^여행이야기​​2주차장에 운이 좋게 은행나무길과 가까운 곳에 주차를 하고 은행나무길로 가는 곳에는 공원이 조성이 되어 있는데요. 이곳에는 각종 조형물로 포토존을 만들어두어 아이들 사진을 찍어주기에도 좋더군요.​​​은행나무길을 그림으로 표현하여 포토존도 마련해두어 많은 관광객 분들께서 이곳에서 인증샷을 많이 찍으시는 모습을 볼 수 있었습니다.​​​​꽃도 많이 심어두었는데, 일부만 꽃을 피웠고 다음주 이후가 되면 많은 꽃들이 필 것으로 예상됩니다.이곳은 빠르면 10분이면 사진만 후다닥 찍고 돌아갈 수 있지만 천천히 즐기시면 1시간 정도는 소요될 수 있습니다.은행나무길이 생각보다 엄청 긴 편은 아니라서 저같은 사진광들은 1시간^^빠르게 둘러보시고 가는 분들은 10~20분 사이면 충분히 즐기고 가실 수 있으십니다.​​​​​소금랜드로 가는 길의 중간중간에는 항아리를 이용한 조형물들이 많이 놓여 있습니다.​​​​곳곳에 거미줄과 거미가 도사리고 있으니 늘 주의하면서 걸어다니시길 바랍니다. 하루살이들이 많아서 이 거미는 몇년 뒤에 왕거미로 변해있을 것 같네요.​​​​아직 노록노록 하죠 ^^그럼에도 불구하고 저는 오늘이라도 가보셔도 좋다! 이렇게 판단하고 있습니다. 물론 내일부터 금요일까지 주중에는 사진찍기에 충분하지 않을까하는 생각을 합니다. 주중에는 사람도 많이 적기 때문에 시간이 되시는 분들은 주중을 활용하여 다녀오시면 좋을 것 같네요.​​​​곡선의 나무 데크를 지나가시면 괴산군 소금랜드 주차장이 나옵니다.​​​​입구 쪽으로 가면 은행나무길의 소개글이 나오는데요.1979년 양곡리 주민이셨던 분께서 300그루의 나무를 기증하시면서 현재의 은행나무길에 이르르게 되었다는 내용이 써져있습니다.덕분에 저희가 지금 이렇게 좋은 추억을 남기러 가볼 수 있는 것이겠죠. 감사드립니다 :)​​​​그리고 이쪽에는 대표적인 포토존이 마련이 되어 있는 표지판을 볼 수 있습니다.액자로 된 포토존은 늘 줄을 서야되는 사진 맛집입니다.​​​​포토존에서 괴산 문광저수지를 내려다보며 찍어본 사진입니다.조금 더 노랗게 변하고 망원렌즈가 있으신 분들이라면 충분히 더 좋은 사진을 찍어낼 수 있을 것입니다.​​​​괴산 문광저수지가 은행나무길로 유명해지기 전에는 새벽에 물안개와 저수지 안에서 자라는 수목의 반영 촬영을 위하여 자주 방문했었는데요.은행나무가 저수지에 반영되어 비춰지는 모습도 한 폭의 그림과 같습니다.​​​​반영이 아름답게 비춰지는 저수지 안에는 실제로 낚시를 즐기시는 분들도 계셨습니다.이곳에서 고기를 낚는 것도 재미겠지만 은행나무길을 거니는 관광객들의 모습을 보는 것도 또다른 재미로 느껴질 듯합니다.​​​​몇 번 써먹어보지 못했었던 지윤텍 짐벌로 와이프님이 영상 촬영을 도와주셨어요. 고마워!​​​​아이들은 저수지에 돌을 던지는 재미에 빠져 있었어요.신기한 것은 비슷한 나이대에 저도 그렇게 하고 놀았다는 것이죠. 저 나이엔 무엇이 그렇게 재밌고 신기한건지 과학적으로 분석이 필요합니다.ㅋ​​​​아들래미가 저수지에 오리가 있다고 알려줘서 오리가 살고 있는 것도 알았네요.아이들의 관찰력이란 어른들과 다른 무언가가 있는 것 같습니다.​​​​빛이 드는 곳에 앉아 계신 부부의 모습이 아름다워 한 컷 담았습니다.의자 옆에 조명이 있는 것을 보니 올해에도 아경을 하는가 봅니다. 작년에 괴산 문광저수지의 야경을 보면서 눈뽕을 제대로 맞아서 포스팅에 써두었었는데, 아무래도 그 글이 괴산군 공무원님들에게 닿질 않았었나보네요.​​​​어마무시하게 바닥에 떨어져 있는 은행, 여전히 나무에는 은행이 주렁주렁 매달려 있습니다. 똥냄새는 문광저수지가 드리는 선물이라고 생각하시면 좋을 것 같네요 ^^​​​​아직은 초록색 잎이 많은 모습을 볼 수 있습니다. 나무의 컨디션에 따라서 빠르게 물이 들어버리는 경향도 있어보이고 볕을 쎄게 받는 나무일수록 단풍이 짙게 들어있는 모습도 함께 볼 수 있었습니다.​​​​작년과 재작년 비슷한 시기에 방문을 한 결과 거의 비슷한 상태였는데요.그때와 다른점이 있다면 우리가 늘상 걸치고 있는 마스크입니다. 참 안타까운 현실이죠. 아직 코로나가 끝나지 않았으니 방역 수칙을 잘 지켜서 절정이 이르를 때, 폐쇄가 되는 일이 없었으면 좋겠다는 생각을 해봅니다.​​​입구에서 쭉 들어오면 갈림길이 나오는데요. 이곳이 가장 빛이 강하게 들어오는 곳이라 가장 샛노란 못습을 띕니다. 빛의 효과 때문에 더욱 그렇게 보이는 모습입니다.​​​​갈림길에 서서 입구 방향쪽으로 찍어본 사진입니다.이 아래쪽에는 정말 많은 은행이 있으니 조심하실 것을 권유드립니다. 여기까지 오셨으니 아래쪽을 걸으시며 충분히 사진도 찍으실 것을 권유드립니다. 은행이 있어서 안내려오시는 분들도 계시더라고요.​​​​요렇게 은행나무잎으로 프레임을 씌워서 사진을 찍어보시는 것도 좋습니다.​​​​이 샷은 사람이 많이 없을 때, 멀리서 찍으면 좋은 사진인데요. 나무들이 무성한 중간쯤에는 사람들이 너무 많아서 사진 찍기가 참 힘들었네요.매년 괴산 문광저수지에 방문하면 찍어보는 샷입니다. 올해는 썩 맘에 드는 샷은 아니네요^^​​​​틈틈이 사람들이 없을 때 잽싸게 사진을 찍어야 하는 것이 포인트라고 할 수 있겠네요. 예전에는 이렇게 힘들게 찍지 않았었는데...​​​이모와 조카,이날은 이모가 울 아들의 모든 사랑을 독차지 했었던 날, 뭐 사줬나..??​​​​매년 문광저수지 사진을 보면서 느끼는 것은 울 아들 참 많이 컸다... 라는 생각이 드네요. 이제는 이런 모습을 계속해서 담기 위해서라도 괴산 문광저수지는 매년 들리는 인생 여행지라고 스스로 룰을 만들어보고 있습니다.​​​노록노록한 문광의 모습.jpg​저수지에 비친 나무의 모습이 정말 아름답지 않나요.?​​​​갈림길을 지나 두번째 은행나무길 코스의 모습입니다.현재 딱 이정도의 상황입니다. 돌아오는 주말이 가장 절정인 시기로 생각되고 은행나무의 단풍이 피크이기도 하겠지만 정말 많은 분들이 방문하실 것이 예상되어 사진 찍기는 상당히 쉽지는 않을 거라고 생각이 되네요 ㅎ ... 그래서 평일에 시간이 되시는 분들은 꼭 평일에 방문하실 것을 추천드립니다.​​​​그네로 만들어 둔 포토존에서도 인증사진 남기시길 바래요.*눈이 부심 주의*반은 빛이 들어오고 반은 빛이 안들어옴 주의​​​​아이들을 데리고 문광에 오시는 분들의 마지막 관문이라고 생각됩니다.솜사탕 맛집.jpg​무려 10분이 넘는 시간을 기다려야만 했었던 문광맛집입니다.솜사탕이 햇빛을 받다보니 금방 쪼그라 들고요. 초파리들이 날라다니는 곳에는 주의가 필요합니다.​​​어쩔 수 없이 드셔야하는 상황이 온다면 빠르게 드시고 화장실에서 손을 닦고 움직이실 것을 권장드립니다.ㅋㅋ가격은 5천원입니다 ......​​​​로컬푸드 장터도 열리니 간단한 요기꺼리가 필요하신 분들은 이곳에서 구매하셔서 드시는 것도 좋겠습니다.​​문광저수지를 방문할 때 가보면 좋을만한 맛집제가 가장 처음으로 썼었던 문광저수지 근처 맛집으로는괴산에 있는대사리 만두가 있습니다. 이곳은 평범한 집만두이고요. 알맹이가 작아서 한입에 때려넣기 딱 좋은 곳입니다. 호불호가 갈린다는 단점이 약간 있는 곳입니다. 조미료의 자극적인 맛이 있는 곳은 아닙니다. 주차는 힘듭니다.​두번째로는증평에 있는 함지막 소머리국밥입니다. 해질무렵 방문하시거나 야간 개장을 할 때 방문하고 돌아가시면서 드시면 좋을 식당입니다. 은근히 추운 시기이거든요. 그때 뜨끈~뜨끈한 소머리국밥 한그릇 때려넣으면 온몸이 바르르 떨리면서 몸이 차분해짐을 느낄 수 있습니다. 주차는 식당근처에 넉넉하게 댈 수 있습니다.​세번째도 증평입니다. 중국요리집이고요.춘화루라는 중국요리 집입니다. 찹쌀탕수육과 숯불 간짜장이 맛있는 곳입니다. 문광저수지 가기 전에 드시면 좋을만한 곳인데, 중요한 것은 이쁘게 옷입고 갔다가 짜장이나 짬뽕 국물 튀기면 대략 난감 상황이 된다는 점. 주차장이 있어 편합니다.​네번째는 괴산입니다. 이번에 방문을 했던 곳인데요. 아직 포스팅은 쓰지 못했는데, 내일 쯤 글을 올릴 생각입니다. 충분히 만족하며 먹고 나올만한 중국요리 맛집입니다. 상호는괴산손짜장이고요. 주차는 가게 인근이나 괴산 산막이시장 공영주차장에 대실 수 있습니다.​위 음식점들의 링크는 아래 댓글에 남겨두도록 하겠습니다.​문광저수지와 함께 방문하면 좋을만한 단풍 명소사진을 취미로 가지신 분들이 주로 아는 포인트입니다. 그리고 대부분 새벽에 후다닥 찍고 가는 장소이기도 하고요. 평일에는 방문이 어려운 곳일 수 있습니다. 장소는'백봉초등학교'라는 곳입니다. 소규모 학생들이 다니고 있는 초등학교이고요. 실제로 아이들이 수업을 받는 곳이기때문에 평일 수업이 있는 시간에는 방문이 제한됩니다만, 아이들이 하교 후에는 들어가보실 수 있습니다. 그리고 주말 역시 가능하고요. 이곳도 꼭 들러보시면 상당히 만족하는 사진을 찍으실 수 있습니다.​역시 링크는 아래 댓글에 남겨두도록 하겠습니다.그 외 정보1.주차: 과거에는 불편했으나 현재는 넉넉한 주차 공간이 마련됨2.화장실: 있음. 하지만 많은 인파를 모두 수용하기엔 턱없이 부족함(작년에는 휴지가 없었으나 올해는 있었고 아마도 사람이 많이 몰리는 기간이나 평일에는 없을 수 있음으로 챙겨갈 것을 권장함.)3.챙기면 좋을 아이템: 셀카봉4.사진 잘나오는 의상: 케바케이지만 원색의 옷 또는 가을 의상5.카메라 렌즈: 광각, 망원6.슈퍼마켓유무 : 없음, 로컬푸드 판매장 있음.​그 외 궁금하신 것은 댓글로 남겨주시기 바랍니다 :-)그럼 좋은 사진 많이 담으시고요. 멋진 추억도 함께 담으시길 바라겠습니다.0초0초광고 후 계속됩니다.다음 동영상subjectauthor취소괴산 문광저수지 은행나무길 2020재생176좋아요4좋아요공유하기재생 (space/k)재생00:490:00:00재생 (space/k)재생음소거 (m)음소거00:00/00:49실시간설정전체 화면 (f)해상도HD720p자막사용 안함재생 속도1.0x (기본)해상도1080pHD720pHD480p360p270p144p자막설정사용 안함옵션글자 크기배경색재생 속도0.5x1.0x (기본)1.5x2.0x죄송합니다. 문제가 발생했습니다. 다시 시도해 주세요.도움말음소거 상태입니다.도움말라이센스고화질 재생이 가능한 영상입니다.설정에서 해상도를 변경해보세요.더 알아보기00:00접기/펴기2020년 괴산문광저수지 은행나무길 근황입니다괴산 문광저수지 은행나무길 2020#괴산문광저수지#문광저수지#괴산문광저수지은행나무길​​홍천 은행나무숲​올해는 홍천은행나무숲이 코로나로인해서 개방을 안한다고 하더라고요. 올해는 충북 괴산의 문광저수지를 방문해보시는 것은 어떨지요?​​",20201018
문광저수지 드라이브 #오늘일기,"​​​​주말,​딸아이 운전연습을 위해일일 특약보험에 가입한 뒤~드라이브에 나섰다.​오늘의 목적지는 괴산 문광저수지!^_^​​​​​노오란~ 단풍이 드는 가을에 가야 제격인 이곳을드라이브 겸 운전연습 겸으로찾아갔는데!!웬걸 !!!!!!!!!!!!!!뜨끈뜨끈한 여름임에도나름 조용하면서도 운치 있다!!!​​​​​가을엔 사람 바글바글인 이곳이어쩜 이리 한적할 수가!!덕분에 너무 좋았던 시간이었어.​초록 초록한 은행잎도 나름 매력 있더라~​​​​​아부지와 딸내미~딸내미 다리 길이 무엇!!^_^​이쁘다~ 이뻐!!!​​​​조용하고 고즈넉한 문광저수지 풍경~왠지 담엔 낚시하러 오고 싶구나~​​​​​선선한 바람맞으며조용히 산책하기 좋았던 시간~​딸내미는 운전하랴, 차에 기름 넣으랴바빴겠지만그래도 우리 모두에게는 나름의 힐링 시간이었던 듯싶다!​​​​​열심히 운전하다 보니 점심시간이... 지났다...어딜 갈까? 고민하다가 발견한막국수 맛집' 원조 중앙 탑막국수 오창점 '​​​​주차를 하고 식당 안으로 가려는 입구에이렇듯 시원한 분수가 우리를 반겨주고 있다~​완전 시원함!!!!​주변에 벤치가 있어시원한 물소리를 음악삼아두런두런 이야기 나누기도 좋을듯!대신 시원한 가을쯤?여름엔 너무 덥다!! ㅋ​​​​​생각보다 엄청 넓었던 식당!사람이 너무 많아서 깜놀...​다행히 점심시간이 살짝 지난 시간이라사람들이 많이 줄었다~​앉자마자 단일메뉴 막국수 주문!​반찬은 셀프바가 있어더 가져다 먹을 수 있게 되어있다.​​​​비빔 막국수와 만두 맛있더구만!​​​​​​​딸아이의 운전연습 덕분에얼떨결에 알게 된 막국수 맛집!!!​더운 여름 종종 이용하게 되지 않을까 싶다!담엔 쑤랑 꼭 가보자~​​​​​더운 여름 오늘의 일기 끝!​​​​​​​​​​​​​​",20210808
"중부 내륙투어...(송소고택 벚꽃, 문광저수지, 대정숲, 겸암정사... ",내용을 가져올 수 없습니다.,20170418
"괴산 문광저수지 부근에서 만난 시골 카페, 문광상회","수안보 근처에 부모님 별장이 있다보니 언제부턴가 대전에서 충주를 갈때면 원래 다니던 중부고속도로 경로가 아닌 대청호를 지나 괴산을 넘어가는 한적한 시골길을 애용하게 되었다. 신호등도 별로 없고, 통행량도 없고, 무엇보다 한적한 시골 풍경을 느끼면서 갈 수 있기에 고속도로 이용보단 10~20분 도착시간이 늦긴 하지만 운전에 대한 피로도도 훨씬 적은 편이다.​​사진, 글 / Fujifilm X-T30, 미뉘​_ 2021년 문광저수지 은행나무길 풍경​괴산에는 은행나무길로 유명한 명소가 하나 있다. 바로 문광저수지로 이미 SNS 상에서도 유명해져서 올해도 어김없이 많은 인파들이 몰렸다. 난 깜빡하고 충주가는 길에 이 길을 지나가다 정체를 만나게 되었고 말이다...!! 은행나무가 노랗게 물들면 문광저수지는 우회했어야 했는데.....​​사실 포스팅을 작성하는 지금 기준으론 은행잎들이 전부 떨어져 앙상한 가지만 남았다고 한다. 그 좋은 가을은 왜 이렇게 빨리 지나가는건지...지난 주말에도 별장에 갔다가 대전으로 돌아가는 길, 예전에 봐두었던 카페가 생각나 커피 테이크아웃도 할 겸 시골 마을로 들어섰다.​​와이프와 애기는 차에서 대기하는 동안 나 혼자 커피 주문하러 가는 길, 앞으로 당분간은 이런 일이 많겠지싶다.​​정말 무심코 지나치기 쉬운 카페 외관, 신촌가든이란 식당 바로 옆에 붙어있는 카페다. 신촌가든 가족분이 운영하시는 카페가 아닐까 혼자 추측해본다.​​이름에 걸맞게 커피 뿐만아니라 음료수, 아이스크림, 담배도 파는 곳사실 이 간판을 보고는 분위기보단 커피도 파는 슈퍼겠거니 했는데!!​​응, 아니야~!!​실내로 들어오니 분위기 무엇!?감성 있게 꾸며놓은 인테리어가 시선을 사로잡는다.​​생각지도 못한 카페를 만난 느낌이 이런걸까? 정말 가벼운 마음에 커피 포장해가려 했던 건데 말이다.​​게다가 로스팅도 직접 하는 곳인지 이렇게 문광상회 블랜드원드도 판매하고 있었다.​​난 카페라떼, 와이프는 토피넛라떼 주문​​테이크아웃을 하다보니 모양새가 막 눈에 띄고 그러진 않지만 카페라떼는 만족! 덕분에 대전까지 졸지 않고 잘 도착할 수 있었다.​​다음번에 다시 한번 들려봐야지 했던 시골 카페, 문광상회 커피상점​문광상회충청북도 괴산군 문광면 광덕길 34​",20211118
괴산 문광저수지(문광지)-(2020.03.27),오랜만에 금요일 휴가를 내고 병원을 다녀왔네요.이것저것 상담하고 진료를 마친 후 휴무로 집에있는 집사람과 집사람 고향인 괴산으로 떠나 봅니다.​시절이 시절인 지라  사회적거리두기를 실천해야하는 시기다보니 어디를 가도 눈치가 보입니다.잔뜩 흐려있는 하늘고속도로를 달려 괴산으로 향 합니다.두시간 가까이 시간을 달려 괴산의 허름한 식당에들러 점심부터 해결 하기로 ~~​집사람이 추천해 준 식당으로 나름 유명한 식당이랍니다간단한 반찬에능이 한우 소고기 국밥을 주문 합니다.  바깥 날씨가 서늘하니 뜨거운 국밥으로 속을 채워 봅니다처음 먹어본 국밥 맛   능이버섯향이 입안을 멤돕니다.​속을 채우고 나서 인근 문광저수지에 잠시 들러보기로평일이라 그런지 조사님들이 거의 없네요문광저수지를 지키는 견공 2마리관리소앞 포인트가 가장 좋아 보입니다.  잔교에 2명 좌대에 2팀이 낚시중관리소앞길을 쭈욱 따라가면 빨간색지붕이  인상적인 좌대 하나언젠가 시간을 내어 낚시 한번하러 와봐야 겠군요멋진 포인트에 위치한 좌대에서 혼낚중인 조사님분위기 좋네요가을이 되면 은행나무가 유명한 문광저수지파란지붕이 관리사무소..    이제 원래 목적지 였던 산막이 옛길로 출발 합니다투비 컨티뉴~~,20200328
