title,content,date
괴산 문광저수지 은행나무길 단풍 명소 관련 꿀팁,"가을을 즐기려는 분들이많이 찾으시는 정보  중 하나가단풍 명소이지 않을까 싶어요.​​충북 괴산에 있는 멋진 은행나무길을소개시켜 드릴까 해요.​저번주(24년 11월 9일) 기준으로방문한 사진을 기준으로단풍 상태가 어떻게 되는지식당 등 다양한 정보를 알려드릴께요.위치50m© NAVER Corp.더보기/OpenStreetMap지도 데이터x© NAVER Corp./OpenStreetMap지도 컨트롤러 범례부동산거리읍,면,동시,군,구시,도국가은행나무길충청북도 괴산군 문광면 양곡리 54-1주소 : 충북 괴산군 문광면 양곡리 54-1요금 : 무료​​충북 괴산에 위치한 은행나무길은'괴산군 소금랜드'와맞닿아 있어요.​'문광저수지'와도 맞닿아있어저수지와 은행나무길풍경이 정말 예술이랍니다.주차주차도 무료이기 때문에걱정하지 않으셔도 좋아요.​하지만 은행잎이 노랗게 물드는 가을에는주말에 정말 차량이 많답니다.​제가 빨간색으로 체크한 부분 보이시나요?두개는 주차장이고, 두개는 공터인데요.​도착하시면 안내해주시는 분들도많이 계셔서 주차로 인해서혼잡함은 조금 덜 한 편인 것 같아요.​제가 방문한 저번주에는정말 차로 갓길에도가득했던 기억이 있네요 ㅠㅠ​은행나무길정말 예쁘죠?​제가 방문했던 일자에는 은행잎이 많이떨어진 상태였어요.​저번주에 방문했다면 바람이 불면서은행잎이 촤르르 떨어지는 것이정말 멋있었다고 해요.​​아쉬웠지만,그래도 은행잎으로 노랗게 물든 산책길을걷는 것도 운치있고 좋습니다.​옆에 문광저수지(낚시터입니다 ㅎㅎ)와노란 은행잎, 높은 산새가 어우러져정말 멋졌어요.​​맛집사실 충북 괴산에는 슬프게도특별하게 맛집이 있지는 않아요..​아무래도 작은 시골 동네이다 보니관광객이 많지 않아서 그런가 싶습니다.​저는 은행나무 축제가 없을 때부터방문했었어요.​점점 더 해가 갈수록 사람들이 많아져서찐 관광명소가 되어버린 느낌입니다.ㅎㅎㅎ​카페문광저수지(은행나무길)와가장 가까운 카페 몇 곳을 소개해 드릴게요.​모두 차량으로 5분 거리에 있으니취향에 맞는 선택 해보세요!​내용과 상관없는 사진입니다.카페산책 :충북 괴산군 문광면 괴산로양곡3길 7-15 카페산책카페 단풍 : 충북 괴산군 문광면 모래재로원터2길 12-14 카페 단풍문광상회 : 충북 괴산군 문광면 광덕길 34축제매년 은행나무 축제를 열고 있는 괴산입니다.​올해 2024년에는 이상 기온으로날씨가 더워지는 기간이 길어졌기 때문에은행잎도 물드는 시간이 늦어졌어요.​​축제는 10월 19일부터 20일까지진행되었습니다.​제가 방문했던 11월 초에도음악이 흐르고 맛있는 간식과괴산군의 농산물을 판매하는 매장들도있어서 더 재미있게 즐길 수 있었어요.​​​단풍길이 생각보다 길고,문광저수지를 한바퀴 돌 수 있는 코스도준비되어 있답니다.​은행나무길을 시작으로 하는데요.문광저수지 물 위로데크가 있어서 걸어갈 수 있어요.​그 길은 강둑으로 이어지는데요.높은 곳에서 문광저수지와 은행나무를바라봐도 정말 멋져요.​​​제 생각에는 이번주면은행잎이 다 떨어질 것 같더라구요​그래도 은행잎을 치우지 않아서노오란 은행잎길이 정말 예쁘니걷는 것도 추천드립니다😀",20241113
괴산 문광저수지 맛집 백조식당 제육볶음 후기,"​​문광저수지 가기 전 들렀던 백조식당. 남편이 콩콩팥팥 보더니 백반 먹고 싶다고 해서 급하게 문광저수지 백반집 검색해서 나온 식당으로 ㄱㄱ!​​​​50m© NAVER Corp.더보기/OpenStreetMap지도 데이터x© NAVER Corp./OpenStreetMap지도 컨트롤러 범례부동산거리읍,면,동시,군,구시,도국가백조식당충청북도 괴산군 괴산읍 읍내로4길 6-8 백조식당​내가 찾은 곳은 백조식당. 식당 자체가 엄청 깔끔해 보이진 않지만 이런 곳이 또 찐 맛집일 수도 있는 거 아시쥬?​​​​​​주차는 식당 맞은편에 꽤 넓게 마련되어 있음. 식당 앞에는 주차금지기 때문에 꼭 주차장에 주차를 해주세용.​​​​​​입구에 으뜸 점포라고 적혀있음. 뭔지는 잘 모르겠지만 어쨌든 맛집 같아 보이는 효과. 괴산 사랑 상품권 결제 시 5% 할인도 해준다네요.​​​​​​가게에 들어서면 생선구이 파는 집이라 그런가 생선 구운 냄새가 진동을 한다. 나는 워낙 좋아하지 않는 냄새기 때문에 조금 불편했는데 예민하신 분들은 이 점 생각하고 가셔야 할 듯.​내부는 넓지도 좁지도 않은 정도. 테이블이 많아서 앉을 자리는 꽤 있었다. 점심시간이 조금 지난 평일 오후 시간인데도 생각보다 손님이 많았다.​​​​​​메뉴! 묵은지 김치찌개를 시킬까 제육 시킬까 고민하다가 역시 백반은 제육이지 하고 제육볶음 3인분 시킴.​​​​​​제육볶음을 시키면 이렇게 다양한 반찬을 주시고 먹음직스러운 제육볶음도 함께 주신다. 나는 쥐포인지, 물고기인지 아무튼 빨갛게 볶은 저 반찬이 맛있더라. 쥐포인가 싶어서 사장님께 여쭤봤는데 쥐포는 아니라 하심.​​​​​​제육 소스는 달달하면서 살짝 매콤한 맛도 느껴지는 무난한 맛이다. 내 입에는 너무 달았는데 남편 입맛엔 취향 저격이었는지 밥 다 먹고 공깃밥 하나 더 시켜서 먹음.​제육볶음 고기가 두툼해서 신기했고 두툼한 고기 치고 고기 누린내가 안 나서 좋았다. 간이 조금만 덜했다면 참 좋았을 텐데 약간 아쉬움ㅠㅠ 그리구 세명이서 먹기에 양이 꽤 많았음.​​​​​밥과 함께 나오는 김치찌개. 아무래도 이게 묵은지 김치찌개인 것 같은데 제육볶음이 아니라 김찌를 시킬 걸 그랬나 보다. 내 입맛엔 김치찌개가 훨씬 맛있었다. 김치가 시큼하니 내 스타일이었음. 김치찌개에는 돼지고기보다 참치 넣는 것을 좋아해서 조금 아쉬웠지만 그 나름대로 맛있게 먹었다.​문광저수지 들리면서 식사할 만한 곳 찾으신다면 백조식당 추천. 내 입엔 간이 좀 세서 짠 음식 못 드시는 분들에게는 비추합니다만 남편은 자기가 원하던 맛이라면서 문광저수지 맛집이라 써달라 함(ㅋㅋㅋㅋㅋ) 호불호 갈릴 수 있는 백반 맛집!​​​​​",20231031
2025괴산 양곡 은행나무 축제 문광저수지 은행나무길 둘레길... ,"2025,10,12(일)괴산여행2025괴산 은행나무 축제기간2025, 10, 18(토)~11, 16(일)먹거리장터/로컬푸드장터 운영장소 : 문광저수지 일원현재 단풍10~20%​2025 은행나무 단풍 절정시기추석 연휴가 지나고 나니 벌써 쌀쌀해집니다, 가을을 맞이하는 계절인가 봅니다,#가을단풍이 제일먼저 절정을 이루는 나무가#은행나무단풍입니다, 청주 근처에서 은행나무 단풍을 즐기려면#괴산여행#문광저수지단풍이 황금빛으로 물들어 장관을 연출하는 모습을 즐기는 것입니다​​<2025년 10월 12일(일), 10:00현재>#문광저수지단풍: 10~20%​문광저수지 은행나무 기본정보#단풍시기: 은행나무 단풍 10~20%단풍#단풍절정: 2025, 10, 30(±5)■ 문광저수지 단풍나무 : 200여 그루■ 문광저수지 은행나무길 : 2.5km문광저수지 주차장→문광저수지제방(전망대)→양곡정→산책로→목교→소금랜드 은행나무길→코스모스길(0.5km)→문광저수지주차장​​​​#2025문광저수지단풍축제○ 축제기간 : 10월 18(토)~11, 16(일)○ 축제장소 : 문광저수지 일원○ 축제내용 : 먹거리장터, 로컬푸드장터 운영○ 초대가수 : 공개되지 않음​#2025양곡은행나무축제#괴산은행나무축제주차장- 주차료 : 무료, 입장료 : 무료문광저수지충청북도 괴산군 문광면 양곡리 16문광저수지 은행잎 광장에서 출발합니다​추석 연휴기간이 너무 빠르게 흘러갔습니다, 그리고 맞이한 2025년 10월 12일(일), 청주에서 약 40여 분 소요되는#괴산가볼만한곳,#문광저수지명품, 은행나무길을 찾아 가을의 정취를 만끽하고자 찾아왔으나. 너무 일찍 찾아온 것 같습니다​​​​충북 괴산군 문광면 양곡리, 문광저수지#양곡은행나무길은 문광저수지 주변 약 250m 정의 길이에 300여그루 은행나무가 있어 가을이 되면 은행나무 잎들이 초록색에서 노란색으로 변하면서 장관을 이루는 충청북도 대표 가을명소입니다​​​​문광저수지 둘레길 2km트래킹은 문광저수지 은행나무길이라고 부릅니다, 둘레길을 걷노라면 문광저수지 낚시터가 유혹을 합니다, 물안개가 올라오는 낚시터에 앉아 붕어, 잉어 등을 잡으며 노랗게 물들어가는 단풍나무를 감상하며 가을을 즐기는것 또한 재미가 있을 것입니다​​​문광낚시터 전화번호(010-8622-4456, 입어료 : 전화문의)문광낚시터충청북도 괴산군 문광면 양곡리​​「얼쑤~괴산」 ,「괴산~좋다!」 들판을 수놓은 색깔 있는 벼로 논에 그림을 그려놓고 「유색벼 논 그림」축제도 개최하고 있어 또 다른 볼거리를 제공합니다, 날씨는 흐리지만 언제라도 청명함을 쏟아낼 듯 높고 푸른 하늘 아래, 노랗게 고개를 숙여가는 들녘은 풍요로움의 그 자체입니다,​​​18년째 관람객들에게 특별한 볼거리를 선사하고 있는 괴산군 문광면 신기리 일원 1만 3500여㎡의 문광저수지 논에 김홍도의 무동(舞童)의 모습을 동영상으로 담아놓습니다< 즐감하세요 >​​0초0초광고 후 계속됩니다.다음 동영상subjectauthor취소들판 수놓은 얼쑤~괴산 명물 유색벼 논 그림재생8좋아요0좋아요공유하기재생 (space/k)재생01:020:00:00재생 (space/k)재생음소거 (m)음소거00:00/01:02실시간설정전체 화면 (f)해상도자동 480p자막사용 안함재생 속도1.0x (기본)해상도자동 (480p)1080pHD720pHD480p270p144p자막설정사용 안함옵션글자 크기배경색재생 속도0.5x1.0x (기본)1.5x2.0x죄송합니다. 문제가 발생했습니다. 다시 시도해 주세요.도움말음소거 상태입니다.도움말라이센스고화질 재생이 가능한 영상입니다.설정에서 해상도를 변경해보세요.더 알아보기00:00접기/펴기괴산 문경저수지 논 그림은 괴산군의 특허 기술로 개발한 들판 수놓은 춤사위 ""얼쑤~괴산"" 초대형 논 그림들판 수놓은 얼쑤~괴산 명물 유색벼 논 그림#괴산명물#유색벼논그림#문경저수지논그림#괴산군특허기술​​문광저수지 제방에서 바라본 은행나무 광장입니다, 이제 막 단풍옷으로 갈아입으며 새단장을 서두릅니다, 가을철 물억새는 처음엔 갈색이나 점차적으로 은빛 꽃이 피면서 은빛 물결의 장관을 연출할 것입니다, 그리고 바람이 불면 물억새의 춤 솜씨가 가관이 아닙니다,​​​​문광저수지 둘레길 트래킹에서 유일한 쉼터인 양곡정을 지나갈 때는 마치 원시림을 걷는 기분입니다, 신선한 가을 바람을 만끽하며 그동안 쌓였던 스트레스가 해소되는 기분입니다, 양곡정에서 은행나무길 코스, 데크길을 걷습니다​​​문광저수지 둘레길을 걸으며 눈에 보이는 것은 수상좌대가 눈낄을 끕니다, 낚시를 하고 싶은 충동을 느끼게 합니다, 그리고 300여 그루의 은행나무가 노랗게 물드는 모습이 오전과 오후가 시시각각 노란색으로 색칠을 더해갑니다,​​​​가을 여행은 10월 중순이 넘어가면 단풍은 절정시기를 맞이합니다, 문광저수지 은행나무 단풍이 물들면 아름답기 그지 없을것입니다, 그러나 현재도 자연이 스스로 물들어가는 단풍을 보노라면 기분이 상쾌, 유쾌, 명쾌합니다​​​문광저수지 야생화 공원을 산책하면서 만개중인 코스모스길을 걸으며 데이트를 즐깁니다, 코스모스는 신(神)이 처음으로 만든 꽃이라는 전설이 있으며, 코스모스를 우리말로는 살사리꽃이라고 부른다는군요​​​​코스모스의 대표적인 꽃말은 소녀의 순정으로, 코스모스꽃을 보노라면 소박하면서도 순수한 아름다움과 순결함을 상징한다고 합니다, 코스모스는 핑크, 빨간, 하얀, 노란, 주황 등 색깔별 꽃말이 다양하고 합니다​​​​문광 저수지 은행나무길은 조성된지 약 40년이 넘으면서 양곡저수지와 함께 가을철 단풍으로 전국적인 풍경 사진 촬영 명소로 자리 매김을 하고 있다고 합니다, 묘목장사를 하던 양곡리 주민 김환인님께서 은행나무 200여 그루를 기증하여 마을 주민의 노력으로 조성되었다고 합니다​​​2025양곡 은행나무 축제가 개최되어 은행나무 단풍이 절정시기가 되면 다시한번 꼭 들리고 싶은 괴산 문광저수지입니다, 문광저수지 은행나무 둘레길 트래킹을 마치고, 문광저수지 주차장에서 약 10분(6.7km)소요되는#괴산시장맛집,#괴산풍일식당을 찾아갑니다​​괴산전통시장 풍일식당착한가격업소/중식당풍일식당충청북도 괴산군 괴산읍 읍내로15길 7​#괴산전통시장맛집, 풍일식당은 중화요리 맛집이라고 하여 찾아간 것입니다, 먹어보니깐 손으로 직접 만든 간짜장입니다, 간짜장 가격은 7,000원으로 착한 가격입니다,​​​​점심식사 후, 뷰좋은 카페에서 차 한잔의 시간을 보내고 싶었으나, 근처에는 소규모 카페가 있기에 그냥 참고 집으로 돌아와서 베란다카페에서 제누 스테비아 단백질 커피믹스로 대신합니다​​​​이상으로 충북#괴산문광저수지#은행나무길#문광저수지둘레길#괴산은행나무길트래킹을 걸으며 정보를 취득한#2025양곡은행나무축제,#괴산시장맛집#간짜장맛집#풍일식당점심식사 후기를 마칩니다​​​감사합니다",20251012
충북 괴산 단풍 명소 문광저수지은행나무길,"#충북괴산단풍명소#문광저수지은행나무길물새벽물안개주말에 동생들과 조카들까지 다 같이 단풍놀이 다녀왔답니다올해 단풍이 별로 라던데  문광저수지 은행나무는 예쁘게 물들었더라고요전국적으로 아주#유명한단풍명소#문광저수지#물안개올라오는저수지은행나무  볼 목적으로 새벽 출발해 해 뜨기 전에 문광저수지에 도착했는데허걱!사람이 그렇게나 많을 줄은 몰랐네요주말에 사람 많은 관광지는 잘 안 가는데 직딩들을 배려해서 일요일에 갔더니우와  사람과 차들이 그렇게나 많다니 ...여기저기 대포 카메라들이 순간포착을 위해서 곳곳에 줄줄이 줄을 서서 기다리더라고요사람이 너무 많으니 여유롭게 은행나무 길을 즐길 여유는 없더라구요 ㅠㅠㅠ내년에는 꼭 평일에 혼자 가리라 맘속으로다짐했음 ㅋㅋㅋ저수지 주변이 엄청 넓은 가본 데 안개 때문에 가까이 보이는 은행나무 길만 돌아보고별 흥미 없어하는 남자들 때문에 안개 걷히고 해 뜨는 건 못 보고 왔네요 ㅠㅠㅠ또 다짐 평일에 혼자 갈 거임 ㅎㅎㅎㅎ0초0초광고 후 계속됩니다.다음 동영상subjectauthor취소충북괴산단풍명소 문광저수지은행나무재생1좋아요0좋아요공유하기재생 (space/k)재생00:120:00:00재생 (space/k)재생음소거 (m)음소거00:00/00:12실시간설정전체 화면 (f)해상도자동 360p자막사용 안함재생 속도1.0x (기본)해상도자동 (360p)1080pHD720pHD480p270p144p자막설정사용 안함옵션글자 크기배경색재생 속도0.5x1.0x (기본)1.5x2.0x죄송합니다. 문제가 발생했습니다. 다시 시도해 주세요.도움말음소거 상태입니다.도움말라이센스고화질 재생이 가능한 영상입니다.설정에서 해상도를 변경해보세요.더 알아보기00:00충북괴산단풍명소 문광저수지은행나무​0초0초광고 후 계속됩니다.다음 동영상subjectauthor취소충북 괴산 단풍 명소 문광저수지은행나무재생2좋아요0좋아요공유하기재생 (space/k)재생00:070:00:00재생 (space/k)재생음소거 (m)음소거00:00/00:07실시간설정전체 화면 (f)해상도자동 360p자막사용 안함재생 속도1.0x (기본)해상도자동 (360p)1080pHD720pHD480p270p144p자막설정사용 안함옵션글자 크기배경색재생 속도0.5x1.0x (기본)1.5x2.0x죄송합니다. 문제가 발생했습니다. 다시 시도해 주세요.도움말음소거 상태입니다.도움말라이센스고화질 재생이 가능한 영상입니다.설정에서 해상도를 변경해보세요.더 알아보기00:00접기/펴기충북 괴산 단풍 명소 문광저수지은행나무50m© NAVER Corp.더보기/OpenStreetMap지도 데이터x© NAVER Corp./OpenStreetMap지도 컨트롤러 범례부동산거리읍,면,동시,군,구시,도국가문광저수지충청북도 괴산군 문광면 양곡리 16은행나무길충청북도 괴산군 문광면 양곡리 54-1#문광저수지은행나무길을 보고 괴산 시내로 나와서 아침으로  아침부터 줄서야 먹을수있는#서울식당올갱이해장국먹고마침#괴산오일장(3일8일) 이 서는 날이라 괴산오일장 휘휘 돌아보고 군것질거리들도 사 먹고카페 들러 커피까지 마시고   월요일 출근해야 하는 직딩들을 위해집으로 돌아오니 2시가 안됐더라고요  올라오며 휴게소에서 호두과자도 먹었는데 ㅎㅎ시간을 아주 야무지게 쓴 하루였네요50m© NAVER Corp.더보기/OpenStreetMap지도 데이터x© NAVER Corp./OpenStreetMap지도 컨트롤러 범례부동산거리읍,면,동시,군,구시,도국가서울식당충청북도 괴산군 괴산읍 읍내로 283-1 서울식당​",20241104
"여행을 떠나본다.(괴산 문광저수지, 문희농원, 자연드림파크... ","추억여행으로 하루를 시작해 본다.괴산의문광저수지​동이 트는 호수 위를 피어나는물안개​물안개에 가려진낚시터​길게 늘어선 은행나무의 노오란단풍 물결50m© NAVER Corp.더보기/OpenStreetMap지도 데이터x© NAVER Corp./OpenStreetMap지도 컨트롤러 범례부동산거리읍,면,동시,군,구시,도국가문광저수지충청북도 괴산군 문광면 양곡리 16​전시되어 있는 이인수 님의 은행잎 시입니다.문광 저수지 은행나무 길에 오면내 작은 손에봉선화 꽃물 드려놓고곱다 곱다 하시던 할머니 생각나요​노란 은행잎이 지는데떨어진 은행잎이 발등을 덮는데할머니의 은행잎같이 노란주름진 미소가모닥불처럼 마음을 데워요​한 해 두해 여러 해,수북이 쌓이는 은행잎처럼할머니 가슴에 가득 고여요​그 언젠가 하루를 지낼자연드림파크50m© NAVER Corp.더보기/OpenStreetMap지도 데이터x© NAVER Corp./OpenStreetMap지도 컨트롤러 범례부동산거리읍,면,동시,군,구시,도국가자연드림 괴산자연드림파크점충청북도 괴산군 칠성면 자연드림길 229​문경사과축제사과가 탐스럽다.​몇 년 전에 들렸던 맛집고등어구이가 예술이었던 그곳.동화원산장식당50m© NAVER Corp.더보기/OpenStreetMap지도 데이터x© NAVER Corp./OpenStreetMap지도 컨트롤러 범례부동산거리읍,면,동시,군,구시,도국가동화원산장식당경상북도 문경시 문경읍 새재1길 48​소화도 시켜야 하고개미취 꽃을 보기 위해문희농원으로. 간다.50m© NAVER Corp.더보기/OpenStreetMap지도 데이터x© NAVER Corp./OpenStreetMap지도 컨트롤러 범례부동산거리읍,면,동시,군,구시,도국가문희농원경상북도 문경시 가은읍 대야로 893-41 1층개미취는 우리나라 특산식물이며, 늦여름부터 늦가을 사이에 하늘을 향해 꼿꼿 하게 올라오는 꽃대를 통해 풍성한 꽃을 피웁니다.네이버다소 늦은 듯내년에는 10월 초에 올 것을 달력에 적는다.​이렇게 잘 가꾸어 놓은 꽃님들을 보게 되어문희농원에 감사함을 전한다.#문경사과축제2025#문희농원개미취#문방저수지#은행나무#자연드림",20251028
